num,question,answer
94,Jewish?,"Mediterranean. Yes, too Jewish, yes. And lot of people that — remember I said my grandfather, her father was of a Macedonian heritage. So naturally he was dark, black hair and slightly slanted eyes. One of my brothers has that feature. So —and my mother would not step by. But the last time, when she was taken to the execution square, as we called it, something happened. And my mother told me she just — she had enough, because he offended her."
95,"The officer. Contact reference@ushmm.org for further information about tis collection Interview with Jolanta Pawlikowski * January 21, 2015",Yes.
96,The Gestapo.,"Th-The — he o — he off — offended her and she just — she’s, I couldn’t stand it any more, and I spit straight in his face. He took — that I remember, he took his big glove and slapped my mother and she fell on the ground. There were — it was rubble there, and I know that she had a wound someplace on the side of the head, because ther — the blouse was stained, and we were all crying."
97,So he would really — he ordered all of you children to watch as if —,Yes.
98,— your mother is going to be shot.,"Mm-hm, yes, yes. My mother refused to sign aus — that she was a German."
99,"Oh, she refused to sign that she was an ethnic German.",Yes.
100,Volksdeutsche.,"Vo-Volksdeutsche. She refused to do this. She said, I was an Auslander in Germany, born there, but I am not German. So what were you doing in Herna(ph)? And she never wanted to sign anything else in the formula, that she would have the papers, that she — she was told, if you sign an Gott glauben, that means — Contact reference@ushmm.org for further information about tis collection Interview with Jolanta Pawlikowski ° January 21, 2015"
101,To believe in God.,"— believe in God — in God, not zhem(ph) cat(ph), that means Roman Catholic, you'll be fine. They’ll leave you alone. My mother refused that."
102,"So, in other words, she could si — if she would refuse — if she would accept to sign that she believes in God, but she’s not a Roman Catholic —",Right.
103,— that’s okay.,And if she would sign that she is a —
104,Volksdeutsche.,"Yes, that she’s a Volksdeutsche. No. My mother said no, I’d rather die."
105,"And the German officer, do you remember his name?",No.
106,Okay.,"No, I don’t — not remember. I don’t remember."
107,"How did — how did she feed you during those years, cause your father’s gone.","My mother was given a choice. She could not teach, all the schools were closed."
108,Yeah.,"She could either work by regulating the riverbanks. That was very hard work. 6 Interview with Jolanta Pawlikowski January 21, 2015"
109,Physical work.,"Physical work. Or work in a ammunition factory, which was organized by the Germans int — 1n the tobacco factory. Course Poznan was known for its production of tobacco."
110,So it—,So she was —
111,— the tobacco factory had been reorganized into a munitions factory.,"Right. So she worked in the ammunition. She took — she preferred to take that, because she would not be able to — she was too weak."
112,Too little.,"Too little, and I mean, to dig, shovel all that glop outside, and no. So she was paid certain amount of money for that. She — we knew that, you know, you can purchase for 10 pfennigs, you can buy a day old, two day old loaf of bread, which was much better, more nutrition — more nutritional than — than a fresh bread, because it tasted fine, you know, much better than the old bread. But 1t was gone very fast."
113,Yeah.,"And many times I was the one that would go. And I remember, I was maybe four and a half or so, and I would go. It was not far away, a street away from the 7 Interview with Jolanta Pawlikowski January 21, 2015 place where we lived. There was a bakery, and everybody knew me, because I always had a nice bow in my hair up here, cause that’s — I said, I am going out. Grandma always put her best dress when she goes to church and when she goes shopping, so I have to be dressed properly, too. So I went there, and the ladies liked me. And that’s the only place — if there was no German person, or a young person who was maybe —"
114,From the — right.,"— from the other side, we could speak Polish. Otherwise it was all in German."
115,Really?,Yes.
116,So in—,I didn’t realize that I was speaking two different languages. It came to me only later.
117,"So in public life, in — in Koscian —",Koscian.
118,Koscian.,KoScian. In German it’s called Kosten.
119,Kosten.,"Mm-hm. 08 Interview with Jolanta Pawlikowski January 21, 2015"
120,"KoScian. So in public life there, you could not speak Polish, you had to speak German.",Yes.
121,"When you’re out on the streets, when you’re —",Yes.
122,"— you know, in public.","Yes, yes, yes, yes."
123,I didn’t realize that.,Yes.
124,I didn’t realize that.,"Besides, there was always somebody walking on the street, a gendarme of this kind or of that kind."
125,Did KoScian have a large German population before the war?,"There were quite many Germans, yes."
126,Were there Jews?,"That I don’t know. There were Jews, because my father — my grandfather said that his tailor, he would make shoes for him, he would make —"
127,Clothes for him.,"— clothes for him, yes, and for his family. 59 Interview with Jolanta Pawlikowski January 21, 2015"
128,So they would exchange their services.,"So they — they were — they were ex-exchange. If they left — there must have been, because there were certain — certain shops and my mother went to school with girls who were Jewish, to the teachers’ seminary, where she was at le — when She lived in KoScian, she would take a train from KoScian to Leszno, and she said, we never saw any difference, we were all Poles. Because you were born in Poland, so you were — okay."
129,"By the time you were walking the streets as a little girl, do you — I mean, let me rephrase that. By the time you were old enough to go out and to this bakery —",Yes?
130,— were there any Jews left in this village?,That I don’t know.
131,Okay.,"No, no. Because KoScian actually was a town. It was an old town, it had one of known churches called Fara(ph), which was because there was a higher — and my grandmother was kept once. She went to church on Sunday, we did not see her for three days."
132,Why’?,"They were looking for someone who was carrying information papers. Contact reference@ushmm.org for further information about tis collection Interview with Jolanta Pawlikowski » January 21, 2015"
133,Underground.,"Und — from the underground. And you know how women — my grandmother liked to go to church on Sunday. Wa — I never knew why, she only told me when she came to the United States in 1960, when my mother brought her to live here with us. She said, I always wore my — my original garb. Long skirt, with three underskirts, and I always had a shawl on my shoulders. And only — there were only a few pews in the front, and the rest was just benches, or people stood, or people sat on — on — well, on stones, or on little stools, or something like this. And my mother was not surprised that Grandma didn’t come after the evening prayers. But she didn’t come in after 10 o’clock. And then somebody knocked on the doors, and that I remember, because that must have been about 40 — end of ’44, or 40 f — or — or — no, not — yes, end of ’44 or beginning of ’45. And said, Manya, Babcia nie przyjdzie."
134,What’s that mean?,"Grandma will not come. Where is she? The Fara(ph) is closed. And only afterwards, when Grandpa — Grandma came to America in 1960, I asked her, I said, could you tell me what happened? You were always so avoiding — you were trying to avoid the — the issue. When I ask, what were you doing? Why wouldn’t this woman come in? Because she escaped. How? Well, you know, she knows this 1 Interview with Jolanta Pawlikowski January 21, 2015 gendarme or that gendarme and she knocked on the door. She felt bad that your mother will worry about her, there are three children here and she has to go to work. And we stayed together with my — I went to pick up the milk in the milk can from the gentleman that was delivering milk on the corner. I would pick that up, and I would go to the bakery with the 20 pfennigs or 10 pfennigs, whatever my mother left me, and feed th-the — the boys, and — and — and then we would stay inside, we would not go out. She says, you are to not leave the house. Do not open any doors, any windows. Stay in. And then grandmother came in. Apparently there was somebody. She told me. She says, he hid under our skirts. I was always praying that he would — whatever, the policeman didn’t stop me, didn’t tell me to get up. And he says, my legs were going like this, because what would I do? He was under my skirt at that moment."
135,"So, if I-",So-
136,"— understood the si — the story 1s, is that people were in church.",Yes.
137,"Your grandmother was there as — you know, she had ties to the resistance, and this was part of the activity is that she was helping to hide somebody.","Yes. Contact reference@ushmm.org for further information about tis collection Interview with Jolanta Pawlikowski ~ January 21, 2015"
138,And one of the ladies in the church with her was allowed to leave it because she was friendly with the guards. And —,"The girl. One of her — th-that she — my — my grandma-mother told me. She says, we just lined up, all of us. And why I don’t know, that all of the older women from the rosary society would sit down on that li — in that line."
139,Yeah.,"And, all of a sudden, she says, I realized that the eyes were moving like this, between them. While somebody was searching in front, or on the other side, they were going. And she says, and we knew — and then I felt something under my feet."
140,And it was person.,It ma — it was a person. And he was carrying some information —
141,Underground — okay.,"— underground paper, yes."
142,"So, 1-","They didn’t find him, so —"
143,Okay.,"— they opened the doors, and let people out."
144,But they kept them there for three days.,"Yes. - Interview with Jolanta Pawlikowski January 21, 2015"
145,"And in the meantime, during those three days, this young girl was allowed to leave because she knew one of the guards. And she went to your mother’s home and said she’s not coming back.",Yes —
146,Okay.,— and she went to the other people to — especially —
147,To let them know.,"— to let them know that yes, yes."
148,"Okay, okay, now I understand. Now I understand. What a fearful childhood. What a f — you know, just —","I didn’t think of a f — of being — I was scared only because I did not like to stay when it was very dark, because we could not keep the lights on — besides, lights went off around nine or 10 o’clock."
149,Mm-hm. So it was rationed. Electricity was rationed.,Yes. Everything —
150,A curfew —,"— water was rationed, ev — gas was rationed and electricity was rationed. So, when — and my mother would come home, sometimes at two o’clock at night. I mean, two o’clock in the morning. Interview with Jolanta Pawlikowski ™ January 21, 2015"
151,Yeah.,Because they had to work. So —
152,Did you feel — what was your feeling within the house? Did you feel safe within the house?,Yes. Yes.
153,Mm-hm.,"Yes. Grandma would have — read to us books. I did not see Polish books. She had Grimms’ stories, Anderson’s stories, children’s stories, all written in German, and she would read to us. Actually she was reading German, and talk — saying — reading it in Polish to us so we would understand. So my — my two brothers would understand what was going on. They said, why these funny names? But you know, it was — but — but I loved stories, I loved when she read, and then she would of course tell us. And when my mother would go to my father’s parents, we would — she would not always take us with her. We would sit, and we would say the rosary, or we would sing, and she liked to sing. So, you know —"
154,"Did you have any other friends, or was it a really closed world.","It was a closed world. I only remembered my — I remember my — one of my cousins, my father’s second older sister, Stanislava, she had two daughters, and I really — Mearka(ph) and what was the other one? I correspond with her. It’Il come 45 Interview with Jolanta Pawlikowski January 21, 2015 back to me. And she cr — Mearka(ph) was my friend, and the — and she had an older sister. She was already 16 or so. But they lived — they didn’t live in that town, they lived someplace else. So she was the only person that I saw. She didn’t come to our house, we always see — saw her in my grandparents’ house. But the only time I saw other children would — when we went to my grandmother’s — maternal grandmother — to Rattzot(ph), which was 70 kilometers away from KoScian, and this was going through a large forest. It was cobblestones, those were huge stones, the old — and when I — that — I always loved to go there."
155,Must have been pretty.,"Oh, not only this, it’s the smell of the forest, the — the vegetation. I-I could pick up the bluebells and — and during summertime pick up the blueberries and — and raspberries, because, you know, it was — this was an original forest, and I could pick up all the — all — oh, anything that I wanted, you know, of di — of — of vegetation. It — it was — I loved to do this. Of course, we were very tired by time we hit the village, but it was fun."
156,And you — you were free from all of those constraints.,Yes.
157,"Yeah. x Interview with Jolanta Pawlikowski January 21, 2015","And that — that was the only place where I did not hear air raids, cause they were hitting star — tow — towns."
158,"So tell me, when your father 1s liberated in southern Germany, in Bavaria, by the American general, he even knows that you and your mother and maybe your brothers too, are near the Dutch border. What happened that you get from KoSscian on the eastern side of Germany, to near the Dutch border on the western side of Germany, how did that happen?","Because on June sixth of 1944, at two o’clock in the morning, the Gestapo came and told my mother, you have one hour. Take only necessary things, and we will — and we will take you to the train depot in Koscian."
159,"And so that meant your mother, or all of you?","All of us. He didn’t say — he said all of us. And then we waited there, and waited. And in the morning, six o’clock, they told my grandmother that, you are not her family. What is your name? And my grandmother said, Meeshak(ph). And your daughter — my daughter is Zurezak. You can take Ratychuk(ph), your grandson, the younger grandson, and you can go home. She went home, she cooked a bottle of pea soup, and brought it 1n a can, and this was our only meal that we had until we reached outside of Poznan, where were put into a transit camp. Contact reference@ushmm.org for further information about tis collection Interview with Jolanta Pawlikowski ” January 21, 2015"
160,So — so it was you and your brother and your mother.,"And — and my mother, right, right. And my mother was interrogated there for three days, who she was, why doesn’t she want to speak German. She says, I don’t speak German. But you were born in Germany, you had to learn German when you were in the seminary. She says, but I don’t speak German. She spoke — she actually spoke very poorly. She was very surprised that — as much as I could retain. And then after I became well, so I could — when I spoke, she opened her eyes, she says, Jola(ph), you speak German? Where did you learn this?"
161,Where did you learn it?,"I said, I spoke it all the time, Grandma was reading in German. We had — you had to speak in German outside. Well —"
162,So Grandma —,— my grandparents spoke German. What do you do?
163,So your grandmother read to you from the Grimms?’ fairy tales in both languages?,Yes.
164,"In Polish and in German. Interview with Jolanta Pawlikowski » January 21, 2015","She ti — yes, she wou — she would read it and translate it. Actually, when I finally got hold of — when I was already eight years old, and I knew the grammar of German — but speaking is one thing —"
165,Right.,"— but knowing the grammar. And I said, I remember this, I remember this, I remem — oh. So she wasn’t reading in Polish, she was reading in German. But she knew it so —"
166,Well.,"— well, that she could retell the story in the oth — 1n our language."
167,"Okay. All right, so the Gestapo was interrogating your mother and keeping her for three days, and is angry with her because she refuses to a have any connection to anything German.",Mm-hm. That was in the transit camp.
168,In Poznan.,"Ou-Outside of Poznan, yes."
169,What happened then?,"We were there til October 10"". We lived in barracks, like you would see barracks in Auschwitz, or wherever German camps were. And since she was an educated person, they must have known that she knows some German. But she 40 Interview with Jolanta Pawlikowski January 21, 2015 had — in Poznan my parents had a friend who was of German extraction. He was born in Poznan, but his parents came to Poland, or one of them did —"
170,Volksdeutsche.,"No, they were Germans."
171,They were Germans.,"They were Germans, but they became Polish citizens, because you could become a Polish citizen after you — well, that was the — you know, the — the second [indecipherable] that gave them the right. But his father was taken to a camp. He was — they never saw him when he was taken. He had a — like a cleaning outfit, but a large so — practically whole — all of Poznan knew who — who he was. And — but the son was a teacher, they had a daughter who was taken in as a— how — how do you say, as a— so they wouldn’t feel the persecution being Germans, she had to work in Berlin. A hostage, okay, like a hostage. She was allowed to come and visit her parents during certain holidays, and that was it. And she — her name was Dora and she would always come and visit my mother, or my mother would go — take the train and go to Poznan. And visit her."
172,This is before she di — before she’s —,"Before — be — be — be — before we were taken out. Interview with Jolanta Pawlikowski "" January 21, 2015"
173,"Okay. And when you say cleaning business, is that like a dry cleaning business?","Yes, yes, dry cleaning."
174,"I see. Okay. And so, how does his life — how does — how does he intersect with your mother?","Because he was not well enough to be 1n the army, in the German army, because they were taken. He knew several languages. He knew French, he knew Polish, he knew German and maybe he knew English, that I don’t know. But he was a translator. And when my mother would be — would be called in t — for interrogation, he somehow, as she was passing by, he would tell her, ask for an interpreter. And that’s it. Because my mother told me this."
175,Okay.,"Because I would always ask her, I said, Mother, I can’t take it any more. I don’t know, he is — my brother 1s sick, he is hungry. Di — we had nothing to eat. Now, what — what do I do? Don’t worry, Vouyek(ph), Janek(ph), Uncle John will come, and bring something. Because people from the outside could bring something, leave it at the —"
176,"Gate. Contact reference@ushmm.org for further information about tis collection Interview with Jolanta Pawlikowski "" January 21, 2015","— gate, and — my mother sometimes received it, sometimes she didn’t get it, what he brought in. It was food, but one time I remember, and this is stuck in my mind, the Germans had a lot of dogs. And you know the gates, or — or the — 1t was barricaded, but it was iron barricade. The dogs would —"
177,Crawl underneath.,"— crawl underneath and make — and Uncle John called once. I saw him walking around, and my mother said, go with Anjay(ph), and take a walk. Because we had to walk, you know, in order for — for hygienic reasons. And she said, when he tells you to stop, and not look, turn around, and then he will disappear, you see what 1s there. Once he rolled in an orange. Who could get an orange? He must have gotten it from somebody, okay’? And I don’t know what I did. My brother was playing ball, and the ball came to the — to the railing. And I think right there, I put my skir — that I remember, I put my skirt on top, and just did oh, Andrew, here is the ball. Meanwhile, while I was giving him the ball, the other hand took the orange, and I put it underneath, into my panties. And I came back, and of course, I walking like this. And an — and he said [speaks Polish] my stomach is hurting me. And my mother said, what are we going to do now? I said, can’t we eat this? But she said, you're going to get all sick. But we ate it anyway, at night when everybody was b Interview with Jolanta Pawlikowski January 21, 2015 sleeping, or so-called sleeping. Because you know, we — we slept, there were one, two, three —"
178,Communal.,"— yes. Four beds in a line, and you never knew who was what, bunkers, or something like that. But we stayed there four months. When the Red Army started — entered Auschwitz, all the German camps began to close. That — you can verify this —"
179,"Yes, sure.","— 1n — 1-in — in — 1-1n books, or 1n — 1n reports."
180,Yeah.,"They started closing. When the opened Auschwitz, that was it. That’s why on the 10"" of October, instead of standing every day from eight o’clock til one o’clock in the center of the — of the —"
181,A-Appellplatz?,Yes.
182,Mm-hm.,"We had to stay there and wait, and if your number was called, that means you would go to your barrack, and somebody would be there, give you whatever. You had to go, take off your clothes. They would take you to a — as my mother called 4 Interview with Jolanta Pawlikowski January 21, 2015 it, the washing machine. To a barrack where they were — we would — could take a shower. But my mother never allowed us to go alone. We were there only twice. Once when we came in and four months later. And on that day, in the morning, we were told to take our belongings and give all of ours clothing to be put through some kind of a disinfection, and we’re going to go to the barrack where everybody —can you imagine? All — all right, this was good thing. It was not very cold, but my brother was shaking, and he says, oh, woda, woda. He wanted waters, he wanted so badly to get a shower, or — or a tub or something. And my mother said no, we are going to stand in the longest corner, in the darkest corner of the barrack where the — the water is coming out. And you are not going to look at water. You are going to face your — she held our faces to her belly, and she would turn around when the water was coming out, because the water nas — was not only water. There was chlorine coming out, because it smelled awful. You cou — people were"
183,Choking.,"— choking. And then it was hot water — I mean, there were people — I mean, this was decimation of people. We got out, thanks to our mother."
184,"So some didn’t make it out of there? 14 Interview with Jolanta Pawlikowski January 21, 2015","I[—I—my mother said, I don’t think that half, at least half didn’t make it. Because the older people were left, and were put away into incinerators, because they had incinerators there. Because when I went, 35 laters to Auschwitz in ’79, my husband wanted to see Auschwitz. I went there, and I walked in, and when I saw behind glass, piles of hair, shoes, teeth, I just felt sick. And I walked out, and I started to cry. And I said never, never, it’s — everything came back. I was six years old again. And I was —"
185,"Even though you weren’t in Auschwitz, even though this was in Poznan where this happened.",Yes. It —1t was in a transit camp.
186,Yeah.,"But this came back, because we had the same things."
187,"Yeah, yeah.","And the pieces of that hard, squared bread, which was something wa — that was more than sawdust. But, you know, th-this — this I — I will never forget."
188,You were such a child —,"And for many, many years, I would not touch dark bread, square dartch — dark bread. I could not take it. I would rather turn around instead of, you know, explain or make a face. No, no, it’s not good for me, and I wouldn’t. Now I have to eat, ‘5 Interview with Jolanta Pawlikowski January 21, 2015 because that’s part of my diet, but — and I got over it. But I will never go back to Auschwitz, never. Cause I don’t think I could face it."
189,I can’t imagine. I can’t imagine.,"I wa —I went to the holocaust museum last Saturday to see Karski exhibit, and I saw certain pictures and I just turned around and I said no, I — I cannot face it."
190,You mean the one in Skokie?,Yes.
191,Mm-hm.,"We were there several times. I went through the entire permanent exhibition of Auschwitz, Birkenau and — and Majdanek and others, pic — the pictures and — and artifacts that they had from those things. And I said no, I will not go there again. Not to that section. Bec —"
192,What happened after — I’m sorry —,Yes?
193,You wanted to say something?,"No, no."
194,"What happened after you left the room with your mother and the chlorophyll and the water, and everything like that. What did they — ‘ Interview with Jolanta Pawlikowski January 21, 2015","We were shoved — we were shoved through a corridor where there were racks, hot racks, where our clothes that we could — if 1t were ours, or not, you had to take whatever was there, and my mother knew which —"
