Question,Answer,topics
Q: Mm-hm.,"A: -- or -- or the idea. My father took own decision. We belong, like I said before, to u -- underground army, and still from our people from [indecipherable] was all time suggestion. We supposed to help Jewish people if we can. This was we can -- we can help. And my father was agood person, a soft heart, [indecipherable] and mother there, we must do something for Melamid, that's our -- our friends. We know e -- so many years I was -- during the ca -- celebration of the - - how you call -- the Jewish are 14 years old?","[1, 2, 3]"
"Q: The Bar Mitzvah, 13.",A: Bar Mitzvah.,"[1, 2, 3]"
Q: Yeah.,"A: I was there once, a second time, and you know, this was like friends, you know, how you can not -- say no. We try, we take the risk, and not -- that's not my op -- my idea only, that's my father, my mother opinion.","[1, 2, 3]"
Q: Uh-huh.,"A: We can help, why not, we -- maybe w-we be lucky. And still, for this job, you know, was death.","[1, 2, 3]"
Q: Right.,"A: Sentenced to death. And we did very nicely, very danger, very nervous and my father took one -- because not 12 people ta -- not once you can take this. And this time, German was very corrupted, very corrupted. For money, you know, or dru -- diamond or something, you can do many thing. And my father took some people and I was in -- I was in a place, I saw [indecipherable] later there, the atom -- ambass -- Swedish ambassador, and I was giving my people the signal, you can go there and open the door. You see, that's was cu -- not one those couple, people you know was involved in this, with transportation and was lucky.","[1, 2, 3]"
"Q: I -- ""m going to stop the tape now, but I want to get on the next tape, many more details about how you got them out of the ghetto, and to this place, because that was -- just getting them there was very dangerous. Q: Can you explain who -- who went into the ghetto, your father or you to tell Melamid --",A: My father.,"[1, 2, 3]"
Q: -- that you were going to take them out?,A: Yes.,"[1, 2, 3]"
Q: Your father.,"A: Qui -- my father, because all time like father take the more danger position and cover on child. That's happened to my father. And my -- and beside this, my father has better connection -","[1, 2, 3]"
Q: Okay.,"A: -- with the local Jewish police, and also Polish police.","[1, 2, 3]"
"Q: Polish, mm-hm.","A: And last day before the uprising -- liquidation the ghetto, m -- the German was very nervous, very corrupted. And on the corner to street, where was the entrance to the ghetto, that's was Leshno. That -- this place was mostly no traffic for only person buy good, buy produce and so on. And my father took the people to the place where was the entrance, and there was factor -- factory -- Jewish guy factory, Mr. Ravinski, where the guards on the entrance know it's many goods going back and forth from this facto -- big factory, knitting factory. And going back and forth, and has permit to go out and in, part Jewish going to ghetto -- outside the ghetto. In other words, after give some money, that's was some easy to take the people. And the people was -- first group was na -- four people, and go by carriage -- horse and carriage sac -- right? And have some boot, you know? And you must per -- take the timing right. Where the German take the [indecipherable] how you call the eight hours and eight hours and eight hours, how you call the - - change the --","[1, 2, 3]"
Q: Time -- the --,"A: Timing, no. I forgot the --","[1, 2, 3]"
Q: Vockt?,"A: Vockt, vockt. In other words ne -- the -- th --","[1, 2, 3]"
"Q: It was the changing of the guard, when they change the guard?",A: Changing the guard.,"[1, 2, 3]"
Q: Okay.,A: Only for [indecipherable] also.,"[1, 2, 3]"
"Q: Shift this -- yes right, right.",A: [indecipherable] also. Mean the people was very -- the gendarmes was very active for the changes.,"[1, 2, 3]"
Q: Right.,"A: That's was the time, and s-six o'clock [indecipherable] evening, the sun going down, it's little bit dark, that's was the time to do this.","[1, 2, 3]"
Q: I see.,"A: And my father did this on the way, that's a couple of kilometer, was -- was put our people who know we doing this, from our orga -- organization and friends. Show the peop -- the -- the [indecipherable], mean the fellow who take the cur -- horse and carriage.","[1, 2, 3]"
"Q: Yes, the driver.",A: Go -- driver.,"[1, 2, 3]"
Q: Right.,"A: Go ahead, go ahead, si -- for example some sa --","[1, 2, 3]"
Q: But were they -- were they in that cart?,"A: No, in the cart was four guy -- four people.","[1, 2, 3]"
Q: Four people. Were they hidden?,A: No.,"[1, 2, 3]"
Q: They were just sitting there.,"A: Sitting there, sitting there, that's was the problem, because if be cover, you know, that's something -- danger.","[1, 2, 3]"
Q: I see.,"A: If not cover, only the boots are down, mean it's all right. And you know, we was lucky, and that's through the whole Warsaw, through the German area, go to the embassadi, the Swedish embassadi.","[1, 2, 3]"
Q: The Swedish embassy.,"A: And I was there because there was round many German, too.","[1, 2, 3]"
Q: Mm-hm.,"A: I was give the sign, go ahead, is open.","[1, 2, 3]"
"Q: But now, the Swedish embassy was empty.","A: Now, about the -- all the -- not only Swedish, all embassadi --","[1, 2, 3]"
Q: Embassies were empty.,"A: -- was empty, only the caretaker for embassadi was there watching the building. All embassy after 1939, Poland fell, German win and Poland has not representative outside the country.Everybody was sent to own country, mean the ambassador or -- or [indecipherable] sent to ambassa -- to German, to Berlin or sent to the own country. And buildings was empty.","[1, 2, 3]"
"Q: And wasn't it suspicious to have somebody driving up in a horse cart, and people were --",A: You must -- you must take the risk.,"[1, 2, 3]"
Q: Mm-hm. And did your father know the caretaker in the Swedish embassy?,"A: Yes, yes, he done --","[1, 2, 3]"
Q: And this was -- and -- and so this was the connection?,A: -- you know -- was assuredly --,"[1, 2, 3]"
Q: Right.,A: -- not that was prepare everything.,"[1, 2, 3]"
Q: Yes.,"A: And Father pay money for the ki -- caretaker, because was a danger job.","[1, 2, 3]"
Q: Mm-hm.,"A: And Mr. Barnard was also rich people, not poor. They pay everything what -- food or organization there for inside and each week I or my father go there and check everything is all right. And we left the family Melamid. Second family --","[1, 2, 3]"
Q: Wait one second. Y -- did you bring food in? How did they --,"A: I not bring the food, the --","[1, 2, 3]"
Q: The caretaker.,"A: -- caretaker, because if I bring, that be --","[1, 2, 3]"
Q: That'd be suspicious.,A: -- suspicious.,"[1, 2, 3]"
Q: But is Melamid paying the caretaker to get money?,"A: Oh yes, yeah, yes, right.","[1, 2, 3]"
Q: So that he can bring in food?,"A: Na -- no, this was no problem.","[1, 2, 3]"
Q: Not --,"A: Money problem was not problem, and the people who -- the caretaker has two girls and wife take care for the people, and was very good, safe place.","[1, 2, 3]"
Q: Mm-hm.,"A: Now, the other part was Epstein, also Landau family.","[1, 2, 3]"
Q: Mmn-hm.,"A: And s -- for example, we take on this to -- we bring these people to Hungarian building, where was -- building was destroyed, part, and the basement -- because this building was -- belonged to very rich Polish landowner years, years ago, couple generation, and to s -- during the Warsaw uprising was destroyed and the basement was useful. Before there, that's was for -- basement only for storage the -- the wine. And this time was different. And we located the people there.","[1, 2, 3]"
Q: Was this also before the Hungarian embassy?,A: Yes.,"[1, 2, 3]"
Q: And so this a --,"A: Yes, all the time was --","[1, 2, 3]"
"Q: -- this was all your embassy associations, right?","A: Right, right, because this was interna -- you see, what happened, international law call if you have embassadi or [indecipherable] how you call the consulate, that's is -- it's international.","[1, 2, 3]"
"Q: International land, yes.","A: American polic -- not can go to the embassadi, and also German keep the [indecipherable] not go to the embassadi, has nothing to do. The sign there, you cannot cross that.","[1, 2, 3]"
Q: And they won't cross?,"A: No, no, no, not -- that's was -- that's was the reason. And you see what happened, this embassadi was everything all right.","[1, 2, 3]"
Q: Everything was?,"A: Only -- Swede -- Swedi -- near Swedish, Hungarian.","[1, 2, 3]"
Q: Yes.,"A: Embassadi was all right, only Polish underground army give the verdict, I don't know, the -- a judge who gives -- a judge give later there after the trial what -- verdict?","[1, 2, 3]"
Q: Verdict.,A: Verdict?,"[1, 2, 3]"
Q: Yes.,A: These guys supposed to be killed. And who was the guy?,"[1, 2, 3]"
Q: That was the punishment.,A: Punishment.,"[1, 2, 3]"
"Q: Yes, yes.","A: Who was the guy? This was the butcher of Warsaw, Kutschera, German Gestapo who killed thousand people by own hand. And this building was close to the ne -- building where we put the German there -- the Jews there.","[1, 2, 3]"
Q: Epstein --,"A: Why? Because we was thinking this is closer, be not sus -- suspicion. And everything be all right only we don't know about this -- the underground army supposed to kill the Kutschera. The top guy in Warsaw who tried to -- and against the underground and also killed thousand people.","[1, 2, 3]"
Q: So we're now talking 1944?,"A: That start 1944. You see, because this fellow was k-killed 1944, and from one month we have not connected and the start Warsaw uprising first 19 -- first August, September -- August 19 f -- September ""94.","[1, 2, 3]"
Q: deg44.,"A: And we lose fo -- fo -- with this family we lose connection, contact. We know later after Warsaw uprising, after I finish the war, the caretaker -- caretaker told us during the Warsaw collapse -- uprising collapse, the fellow must go f-from all over, and German troop, all the people, between these people to the Melamid [indecipherable] not Melamid, Mr. Landau's son, Mrs. Landau, and the third guy. And don't know what happened with him. We never see -- we was sent to concentration camp, and these people I don't know because was better situation, was call like pe -- PW --","[1, 2, 3]"
Q: POW.,"A: POW people, and we never connect with, we never know about these people. Mr. Melamid, that's other story, very interesting story. We come back little bit, after. After couple -- one year or something [indecipherable] the German, with big help of one -- one Gestapo adjunct, Skosofski from Woodz, Jewish guy, educated Jewish guy, Gestapo informer. Worked for jew -- for -- for Gestapo, and created something like this, how ma -- if some people are in Warsaw Aryan side, because was many, many, and German know about this, and put the, you know, idea","[1, 2, 3]"
Q: Put the word out.,"A: Who -- right. Who give to any dollars per pers -- in the golden -- in the gold for person, and go -- can go to exchange for prison -- German prison of the war. And location is third building from our factory, Hotel Pulski.","[1, 2, 3]"
Q: [indecipherable],"A: And -- you know this -- and these people, naive -- I never shou -- well, I never trust German, naive, maybe we'll be lucky. Was better situation because people can do something for me, but - - and my friends, Mr. Melamid, Mrs. Melamid, two sons, and some other family, pay the 20 dollars in gold and go there, and said, Oh we'll be free, and we'll go to France, and there we be change for prison of the war. And how was organize? Organize was very smart and interesting.","[1, 2, 3]"
Q: The postcard.,A: Postcard.,"[1, 2, 3]"
Q: Yes.,"A: You are very well. And the people all so nice, you know, thinking everything be all right. And second transport was organized because the people received something like this, my friend received too, and -- and go ni -- to the Hotel Pulski. And my father was suspicion and said, ""Don't go there, I go first, because it's almost my neighbor."" That's two houses, three houses from my father factory. My father go there and saw, and -- so many people, and talk and so on and so on. And people said, oh yes, all right, we -- we receive also some cards, and it's all right. My friends, Melamid, four people, decide we are going to Hotel Pulski. My father start crying. What you doing? Now, still the people go there, and was the second transport. And the transport go also west, because we know from our sources, and before go to France, turn right to concentration camp Bergen-Belsen. And our friends was there. And was lucky the war finish 1944, and after war was finish, I was looking for him, and for my two ma -- wa -- mother and two sister. And I was in Bergen-Belsen. And you know, two weeks, I miss. Two weeks ago Melamid went to --","[1, 2, 3]"
Q: Yeah.,A: -- na -- Israel.,"[1, 2, 3]"
Q: They were very lucky.,"A: Very lucky, very lucky.","[1, 2, 3]"
Q: Very lucky.,"A: And I meet -- after 60 years, I meet these people in Tel Aviv --","[1, 2, 3]"
Q: Yes.,"A: -- and in yi -- Jerusalem. And the woman, 95 years, the woman kiss me on the hand.","[1, 2, 3]"
Q: Right.,"A: Paul, you are everything for me.","[1, 2, 3]"
"Q: Right. Let me go back a little bit, because I realize that both the Landaus, the Epsteins, the Melamids escaped the big deportations in 1942 --",A: Yes.,"[1, 2, 3]"
"Q: -- when over 300,00 people -- so they were in the small ghetto when they -- the reduced sized ghetto when you [indecipherable] them out.","A: Yeah, right, right, and close to the --","[1, 2, 3]"
"Q: Yes. Do you remem -- is -- is there anything that you saw? Were you -- were you going in the ghetto when they were rounding up all these people for those few months? 330,000 people were rounded up and sent to [indecipherable]","A: Listen, this was organized mostly by -- by police. Jewish policemen. [indecipherable]","[1, 2, 3]"
"Q: Well, but it was on -- the Germans were taking the Jews away, right?","A: No, German, no -- for German order, only personally, I don't know the German take the people like this --","[1, 2, 3]"
"Q: No, no, no. No, no. I underst -- I understand that, I'm not -- I'm just asking whether you saw large groups of people leaving there -- if you were coming in every day --",A: Right.,"[1, 2, 3]"
Q: I don't know when it was that you stopped going.,A: Mostly I go to Narlefki [indecipherable],"[1, 2, 3]"
"Q: Right, right.",A: -- and Umschlagplatz was very far from there. I never was there. [indecipherable],"[1, 2, 3]"
"Q: No, no, I understa -- no, you wouldn't have -- you wouldn't have even been allowed to be there, I'm sure.","A: Right, right, that --","[1, 2, 3]"
"Q: But did you see groups of people marching, going?","A: No, no.","[1, 2, 3]"
Q: You didn't see?,A: No.,"[1, 2, 3]"
"Q: Did you see the ghe -- the Warsaw ghetto burning, did you hear --","A: Oh yes, absolutely --","[1, 2, 3]"
Q: -- the uprising in the Warsaw ghetto?,A: -- absolutely.,"[1, 2, 3]"
Q: Yes.,"A: And I tell you one more thing, how people help during this time.","[1, 2, 3]"
Q: Uh-huh.,"A: From other unit, where belong my brother, was i-idea give the Jewish people possibility to go out from the ghetto on Zakra chimska, very close to north part of the ghetto, and this group Akar group, make big hole in the -- and they put g-grena -- grenade, and give the chance, people go out from ghetto. Meantime, my brother friends, and I know this guy, Wilk, named Wilk, who are in the [indecipherable] books, was killed. One person was killed because German from the watching tower kill him.","[1, 2, 3]"
Q: Mm-hm.,"A: And the friends of this guy, who was in the action, put the grenade below the --","[1, 2, 3]"
Q: The wall?,A: -- killed guy and blow out.,"[1, 2, 3]"
Q: Uh-huh.,"A: That's was -- right now if you go to Warsaw opposite the -- some church on Zakra chimska, I think so si -- called the -- is special placard , how people from Akar j -- try -- give chance go out the Jewish people, and Juzek Wilk was killed there. Big placard like this.","[1, 2, 3]"
"Q: Mm-hm, mm-hm.",A: And happened.,"[1, 2, 3]"
"Q: Did you know that there was a carousel, you know, that -- that the -- the Germans built outside the wall while the ghetto was burning?","A: Listen, I don't know the German build, this is --","[1, 2, 3]"
"Q: No, no, it was out -- I mean, it was in the Aryan side, I don't know, did you see it?",A: I never saw.,"[1, 2, 3]"
Q: You never saw?,"A: I never saw, only this not German built. German are not so good build for people something like this. Only the -- during this time, the circ -- circus --","[1, 2, 3]"
Q: Mm-hm.,"A: -- was all time doing something like this, and this was profitable thing. Children go there and go around wera -- go around, and maybe was cr -- I heard was close to ghetto, and no -- I not think so. Was built for purpose. That's was a regular business.","[1, 2, 3]"
Q: It just happened that it was at the time.,"A: Happened, right, right.","[1, 2, 3]"
Q: But it -- it was at the time when the uprising --,"A: Yeah, yeah, yeah, that's something --","[1, 2, 3]"
Q: -- and the burning of the ghetto.,"A: -- I never saw, I never was there.","[1, 2, 3]"
"Q: Uh-huh, yes.",A: I -- is possible.,"[1, 2, 3]"
Q: Yeah.,"A: And on the other hand, I never think this di -- German did this. German has other problem, not something like this.","[1, 2, 3]"
Q: And did you watch the burning of the ghetto from your house?,"A: Oh yes, I no -- watch.","[1, 2, 3]"
Q: Mm-hm.,"A: And you know, it was very, very upset, you know, because was very -- and on all people, you know, who has little bit heart and brain, know what happened future for other [indecipherable]","[1, 2, 3]"
Q: Mm-hm.,"A: Because we feel not Jews, that's different nation, we was thinking, these are Polish citizen, Jewish persuasion.","[1, 2, 3]"
Q: Mm-hm.,"A: That's I feel, my -- all time.","[1, 2, 3]"
Q: Right.,"A: Right now is big -- try and be big different, Polish and Jewish. Was fellow who born there, in the same place where I born, and lived there, eat the same breads, take the same air. And must be different? As for me it's not. No, something wrong. P -- in Poland was 10 percent Jewish people, three percent was Evangelic and German, and couple percent was Gypsy, you know, couple percent was Ukrainian, and also was the Belarusian -- Belarus -- white Russian, you see? Buts now it's, you know, chop, chop, chop, everything separate. Before, I feel I born this way. This isPoland, only differ -- think differently like I think, and has the same chance like I have, and I supposed to accept this.","[1, 2, 3]"
Q: Right.,"A: And that's my feeling, my personal feeling.","[1, 2, 3]"
"Q: Right, right. We're going to stop the tape and change tapes now. Q: Paul, at a certain point you don't have the responsibility of Melamid family because they'd gone to the Hotel Pulski, and who knows? And Landau and Epstein, you also can't get to, right? You lose --",A: We lose the -- I go to concentration camp and lose the --,"[1, 2, 3]"
"Q: But wait, wait, there's a -- there's a Warsaw uprising.",A: Yes.,"[1, 2, 3]"
Q: Before you get caught.,"A: Say again, maybe I not catch you.","[1, 2, 3]"
Q: Before you get to the concentration camp --,A: Right.,"[1, 2, 3]"
"Q: -- before you go to Flossenbiirg, there's a Warsaw uprising, yes?",A: Right.,"[1, 2, 3]"
Q: Which you are a part of?,A: Right.,"[1, 2, 3]"
Q: Yes? So what happens.,"A: Well, Warsaw uprising, you know, this was, for me was only 30 days.","[1, 2, 3]"
Q: Right.,"A: And first two weeks I was very excited, and on other hand was very upset, you see, because in our unit was not enough guns, not enough arms. And that's was the big part. 30 percent in our group was with the guns. The other part has no guns.","[1, 2, 3]"
Q: Nothing.,"A: Nothing. You know, that's was the whole problem, and after two weeks I was very upset, between me and you. We di -- Warsaw uprising was -- I not see this time win the uprising. And mostly young people was anxious to fight with German. And before the Warsaw uprising we heard in radio the Soviet army put the Soviet, I don't know army or -- or -- or tele -- or radio only, ask Polish people, start fighting with German. We go, we cried now to Warsaw, we help you, blah, blah, blah, is something like this. And never help -- after start Warsaw uprising, next time was the last information for most folk [indecipherable]. Nobody help, nobody talk through the radio about this, and that's was the reason Polish -- Warsaw uprising was collapse. Not help.And Stalin stop all army and not let him go help Warsaw because was very upset to Poland from beginning and let the German kill the Polish patriots. That's what they did.","[1, 2, 3]"
"Q: Mm-hm, mm-hm.","A: And during the Warsaw uprising, my function was not the heroic big one. And still, a-after 30 days, I supposed to go to -- through the canals --","[1, 2, 3]"
Q: Sewers.,"A: Sewer, right, to middle part of the Warsaw where was the whole army concentrate there. And because this time I was without the guns and a rifle or something like this, I was sent back and first go the people who has ammunition, grenades and supply like guns and rifles. And two, three hours before I go there to sewer, German put the gasoline grenades, blow out the sewer someplace there, a-and we was not able go there. We must go back. After we go back, I mi -- go to my house, because my -- my officer rank -- high off -- ranking officer take us together and said, from now on we have not chance to survive if we are group. We must go each other ea -- own way, and car -- everybody is on own way. And who has the ammunition, or -- or a pistol orsomething, must throw out, destroy, throw out, don't give the German. And take the clothes what you have, change, and go to the -- to own idea -- own -- you are on your own.","[1, 2, 3]"
"Q: On your own, uh-huh.","A: And after this -- that's was six o'clock, or five o'clock morning, I listened this and we was s -- everybody go in own way, and I go to my parent's house where I live, and I chane -- I was lucky change the clothes, wash myself and eat something, and after 15 minute, ma-maybe half hour, I s -- heard, alles raus, bandit handehore, and something that's German ask going out, and the hands up, and leave the basement because my -- my family house was destroyed, and family was in basement. That's what's [indecipherable]. And from there out we go out.","[1, 2, 3]"
"Q: Now, you're all together, your father --","A: Yes, I -- right.","[1, 2, 3]"
"Q: -- your mother, your sist --",A: I meet my --,"[1, 2, 3]"
"Q: -- and your brother, however, is -- is in a --","A: No, my brother was in --","[1, 2, 3]"
Q: -- another part.,A: -- another part in middle of the Warsaw.,"[1, 2, 3]"
Q: Yes.,"A: Ina -- ina [indecipherable]. And we go out slowly, and German put later their grenade there, and destroyed everything what was there. And we go walk from our street to the Vola. That's p - - outskirt of Warsaw. And -- and meantime the German pick up people from the line, and one of the worst part was Ukrainian, and that's real Ukrainian only was with German army, and created the line, and between these two line we can go to Vola. Meantime the Ukrainian was -- createdvery bad situation. My -- for example, my mother has a -- a wedding band, and this fellow ask, give me the band, give me the gold band. My wife -- my mother cannot take out the band, because you know, is old woman, and cannot o -- you know what, the fellow take the knife, and try cut the finger for this stupid, stupid pieces of the gold. And my mother start yelling, and some of his German officer heard this, stop and take this guy out from the line, and said go ahead.Because German are not good people, only I never saw the people robbed somebody.","[1, 2, 3]"
Q: You never saw?,A: Robbed.,"[1, 2, 3]"
"Q: Robbed, uh-huh",A: Stolen.,"[1, 2, 3]"
Q: Mm-hm.,"A: You know, that's were very discipline. Like American also, discipline. Army is army. You can n -- you are bandit or you are army man. And Ukrainian people, you know, was the worst part people this time, on the world. Was kill own people for couple something like this. And after we go --","[1, 2, 3]"
Q: Can I ask you something?,A: Yeah.,"[1, 2, 3]"
Q: Why did the Germans call you a bandit? And your whole family bandits?,A: Million people called bandit.,"[1, 2, 3]"
Q: Everybody was a bandit?,"A: Yeah, yeah. What was in fighting with German mean are bandits.","[1, 2, 3]"
Q: So how did they know you were --,A: All Akar was bandits.,"[1, 2, 3]"
"Q: Right, I see.",A: Because --,"[1, 2, 3]"
"Q: And did they know that you were fighting? Or they assumed it, be --","A: No, no, call everybody.","[1, 2, 3]"
Q: I see.,A: I-I was dressed my civilian dress.,"[1, 2, 3]"
"Q: Right, right.","A: And this time you know why call ban -- bandit, because Geneva convention call something like this, these are freedom fighter, right? And supposed to be treat like a regular army people.And this time German think and talk these are not freedom fighter, these are bandit. And again, Red Cross tru -- during the ga -- Red Cross, and some other ger -- and convention people press German, call the people freedom fighter and mean POW.","[1, 2, 3]"
Q: Mm-hm.,A: That's my brother --,"[1, 2, 3]"
Q: Right.,"A: -- was POW and I was bandit. I was sent to concentration camp, and my brother was in prisoned of the war.","[1, 2, 3]"
Q: Right.,"A: And from there we was load into small train and to go Proshkov, that's co -- very big depot of train, depot train.","[1, 2, 3]"
