Question,Answer,topics
Q: Okay.,"A: -- they just had -- th-there was a -- one moment that I remember in the cattle train. We were passing certain points along the route, and all of a sudden, the whole train started crying. It was the border. And -- and someone started singing one of the prayer songs.","[1, 2, 3]"
"Q: So, when you were leaving Poland. When you were leaving Poland --",A: Mm-hm.,"[1, 2, 3]"
Q: -- and you were passing the border.,A: Yeah.,"[1, 2, 3]"
Q: People realized it.,"A: Well, it was a very moving moment, but --","[1, 2, 3]"
"Q: Yeah. Yeah. When you got to where you had to -- where they took you, you were then taken by sleigh, and the sleigh kept overturning?Interview with Mira Zimmerman 8 January 23, 2015","A: Well, it -- the sleigh -- th-the -- this -- the -- they had -- that territory had very bad snowstorm, and we were right in the middle of it. But we had a -- some kind of soup, I think, to -- we were fed, a little. Other than that, I don't remember.","[1, 2, 3]"
"Q: When they took you to the place that had been an army barracks, you told me, yes, it had been some sort of military place, was that correct?","A: Well, yeah, it -- I don't know if it was, quote, my -- my label of describing it as a military place, but it was a -- arranged sort of like the -- like what you come across sometimes, the old, unused -- no longer used military camp, or station.","[1, 2, 3]"
"Q: And w -- did -- was it a huge place, and did you -- was it a big place with lots of people in it?","A: No, it wasn't particularly lar -- big place. Just a few barracks.","[1, 2, 3]"
"Q: And you s -- and then th -- that's where you had to live, was in those barracks?","A: Ah, yeah.","[1, 2, 3]"
Q: Yeah.,A: More or less. I don't remember what was in between that --,"[1, 2, 3]"
Q: Were they heated?,A: The what?,"[1, 2, 3]"
Q: Was the -- was there heat in those barracks? Was it warm inside?,"A: Well, there's plenty of wood, so you had to make your own wood.Interview with Mira Zimmerman "" January 23, 2015","[1, 2, 3]"
"Q: Your own fire? Did people make their own fire, inside the barracks?","A: Yeah, I think you could use the facility that they had -- th-there were two camps that they m-moved us to, Mother and I, but I don't remember very much about the -- one of. I just remember that they -- Mother had to work very hard as a lumberjack.","[1, 2, 3]"
Q: She was a lumberjack?,A: [remember that.,"[1, 2, 3]"
Q: Did you go with her when she worked? Did you go with her when she was --,"A: No, I was in a camp, but Mother had two, quote, jobs in order to give me sustenance. After work, she tended to -- to my needs, and her own.","[1, 2, 3]"
"Q: It -- it sounds -- are you -- all right, let's pause. [break] So your mother -- I -- your mother must have had an un -- incredible hard life there.","A: Well, she did, because I -- and I was partially responsible, I was a burden. She -- she could do so much -- a woman can do so much, but in her case, we didn't have possessions to -- so we could exchange and sell things. We didn't have very much to sustain us.","[1, 2, 3]"
Q: Did anybody help you?,"A: No -- no. There was a-- one incident, I had the be -- some kind of an infection, or -- on the foot, and they send me to the felcher(ph) -- doctor in camp. It's a -- that just stayed with the kids that were -- if the husband was with the family, they Interview with Mira Zimmerman *deg January 23, 2015 allowed the woman to stay and look after the child, or children. But usually, in a case like this, you don't work, you don't eat. And when they -- when the -- the supplies came in, sometimes the supplies were somewhat ridiculous, because they would send ball gowns at the time that you need warm boots. So you couldn't --","[1, 2, 3]"
Q: Crazy.,A: -- you couldn't even buy things.,"[1, 2, 3]"
Q: Was the camp part of -- was it isolated from other buildings? Was there a village nearby?,"A: No, no, very little -- distances were considerable, th -- for one things, and secondly, you didn't have any maps, or whatever, and so that was th -- that territory was wild.","[1, 2, 3]"
Q: Were there any local people that you met there?,A: No.,"[1, 2, 3]"
"Q: So your only interaction, the only contact you had was with other people who were deported, and the guards.","A: And the guards, yeah, something on that order.","[1, 2, 3]"
Q: Was -- was there a fence around the camp? Was it like a prison?,A: There wasn't no need. Nobody knew where to go.,"[1, 2, 3]"
"Q: So you were in the middle of nowhere.ontectnetonancedjusetneey for tarher biormatoerabouttfisestecion Interview with Mira Zimmerman * January 23, 2015","A: Although I think some section of -- did have a ga -- a barbed wire, but I don't remember too much.","[1, 2, 3]"
Q: Is this the place you stayed for a long time?,"A: Well, the longest time that the camps were in operation supposedly, the beginning of the second war, and when the Yelta release started pouring --","[1, 2, 3]"
Q: You mean -- hang on just a second.,"A: -- started for -- forming -- [break] -- yelt -- Yelta directed, or released several thousand prisoners be -- that they were supposedly ready to form units to help Stalin fight inter -- Hitler.","[1, 2, 3]"
Q: I'ma little confused. I'm a little confused.,A: Yeah.,"[1, 2, 3]"
"Q: Because I reme -- I thought it was when Germany attacked the Soviet Union, then there weren't enough soldiers to help defend the allies, and the Polish government in exile came to an agreement with Stalin.","A: Yeah, yeah, well --","[1, 2, 3]"
Q: Was that it?,A: That's it.,"[1, 2, 3]"
"Q: That's it. And then that's why these units were formed.Interview with Mira Zimmerman * January 23, 2015","A: Well, that's why the units were formed, and Polish government to Polish forces outside Russia tried to participate, and I -- start these units that also helped some civilians. And we were the civilians.","[1, 2, 3]"
Q: How -- how did you find out about it?,"A: Well, it's a-- someone managed to get out of prison and wor-work himself back to the camp, and tell us about it. Although the Russians were supposedly -- supposed to inform us, they didn't.","[1, 2, 3]"
Q: They didn't. I see.,"A: They -- we found out, or at least I was told that they -- the residents of the camp found out, when this guy came in from prison, after he was released.","[1, 2, 3]"
"Q: I see. So how did -- did people then -- let's say they"" ve known now that they can leave, but the -- the guards don't let them? Did they let them leave when they found out, or did they still say no, you can't?","A: Well no, you di-- you didn't say anything, I mean, they only -- theyll had to admit that you can le -- go, and try and draw in some of those forming units, but then nothing was ce-certain. Mother and I -- Mother decided to try and draw in those units. She s -- she told them she wa -- would give me to a pryude(ph), which is like an orphanage, that she will give me to the orphanage, and sh-she would join as a nurse.","[1, 2, 3]"
Q: Okay.,"A: That worked fine, and she had the permit that that -- she could do so, but the commandant left the -- for some business or something, and then the next commandant didn't know about the release Mother had, and the -- th-they said -- the -- the assistant wouldn't okay it. So Mother decided to join the car -- th-the sleigh that took the men to join one of the units nearby.","[1, 2, 3]"
Q: Okay.,A: And somehow it was difficult for her to get few pieces together and join the -- the sleigh as it left the camp.,"[1, 2, 3]"
Q: So this was --,"A: We -- we walked -- we walked past the commandant, but Mother didn't have the permit to -- to leave the camp --","[1, 2, 3]"
Q: So this is --,A: -- any longer. So we is -- we ran away.,"[1, 2, 3]"
Q: This is that place that was in the middle of nowhere?,"A: Yes, it is.","[1, 2, 3]"
Q: In those bark -- in those barracks?,A: It is.,"[1, 2, 3]"
Q: And you ran away from there?,"A: Well, we ran away because that was there -- that was a way to -- to, quote, freedom. Interview with Mira Zimmerman * January 23, 2015","[1, 2, 3]"
Q: But how did you know where to go?,"A: We went with the cart, that's why we -- the man sta -- stopped the ga -- th-the -- the horse, this -- for a while, at -- s-some other mother mad -- made -- Mother and I made our way to the -- to get a ride from them. Once they had the ride from them, we stopped by the riverboat.","[1, 2, 3]"
"Q: Was this in summertime? Was this in summer, or was it in winter?","A: Oh, in the winter.","[1, 2, 3]"
"Q: Oh, so you ran away from -- from the camp in winter?",A: In winter.,"[1, 2, 3]"
"Q: Uh-huh. And were these men who stopped the wagon, were they Polish men who were on their way to join the units?","A: Well, th-these were Polish soldiers, so -- with families, the farmers of the area.","[1, 2, 3]"
Q: Okay. Okay.,"A: They saw Mother was trying very hard to s -- to spare me, and def -- try to keep herself still in reasonable condition.","[1, 2, 3]"
Q: Did you get sick when you were in the camp?,A: Did I?,"[1, 2, 3]"
"Q: Get sick, when you were in this camp?","A: In the camp, no, but later on in the -- the south of Russia, that's when a lot of sickness started.Interview with Mira Zimmerman *8 January 23, 2015","[1, 2, 3]"
"Q: Okay. And your mother, did she stay -- did she get sick in the camp, or did she stay healthy?","A: Mother managed to stay healthy, although some of the situations that they put her through to work, were not healthy.","[1, 2, 3]"
Q: What -- can you tell me a little bit about those situations?,"A: Well, the forest that they made her -- they work -- the wood -- the trimmed woods trunks that were floated down the river, they had to be -- that they got stuck sometimes. Th-They made the women -- well, both men and women work the -- the logs, move them right, and they would wear the rubber leggings of some sort, that --up to the waist. But most of them, those leggings were torn, so the wa -- freezing water that they -- the -- the prisoners had to work in.","[1, 2, 3]"
Q: That's horrible. That sounds -- that sounds like --,"A: Yeah, it -- some -- some of the situations that they were put through were inhuman, it seems.","[1, 2, 3]"
"Q: I can't imagine what it was like for her. I said, I can't imagine what it was like for her.",A: Yeah.,"[1, 2, 3]"
Q: And for you. And for you.,"A: Well, it -- it was difficult. It was difficult for Mother. And there -- there were other families, but -- but if the man could work, then it helped the woman, butInterview with Mira Zimmerman *deg January 23, 2015those that didn't have the man, or -- or those who man -- other members of the family were in a -- in prison, let's say, it still -- it was prison within the prison, it seems.","[1, 2, 3]"
Q: What did you do when she was at work?,A: The what?,"[1, 2, 3]"
Q: What did -- what happened to you when she was out working?,"A: Oh, when she was out working, I was with the other kids in the camp.","[1, 2, 3]"
Q: Was there a school?,"A: I-I-In what -- I remember there was some school, but the -- that time that the weather was warm.","[1, 2, 3]"
"Q: And when you were with the other kids, did you find playmates?",A: Did I what?,"[1, 2, 3]"
Q: Did you find playmates?,A: Did?,"[1, 2, 3]"
Q: Were there other people for you -- children for you to play with?,A: Yeah. I -- we -- we played like children's games.,"[1, 2, 3]"
Q: I remember reading that somehow your mother found a goat. Was that at this camp?,"A: That sometime -- oh, my mother bought a goat.","[1, 2, 3]"
"Q: She bought a goat?ontectnetonancedjusetneey for tarher biormatoerabouttfisestecion Interview with Mira Zimmerman "" January 23, 2015","A: Yeah, she had some gown, or had some -- something, and she o -- I was in need of some better nourishment, and that was Mother's solution.","[1, 2, 3]"
Q: Did it help?,"A: She bought a goat -- well, the -- the goat gave half a glass of milk, that was my --","[1, 2, 3]"
Q: And did other people in the camp know you had a goat?,"A: Yeah, they knew.","[1, 2, 3]"
Q: So she had to --,"A: If you -- if you could feed the goat, then that's what --","[1, 2, 3]"
"Q: Well, that's my next question, she had to feed not only you, but also the goat.",A: Yeah.,"[1, 2, 3]"
Q: How did she do that?,A: She made -- she told me to go in the -- along the road to -- to pick up some hay.,"[1, 2, 3]"
Q: And were you allowed to do that?,"A: Well, I was picking it up, that -- that which we -- fell on the ground, so I could do it, but they -- at one time they -- they said that Mother was responsible for me -- my stealing the goat.","[1, 2, 3]"
"Q: Stealing the goat, or the hay?","A: Stealing the ha-hay. And they sent her to -- in the courts. She had to walk for several miles, I think, to the di-- court station.","[1, 2, 3]"
"Q: Where she -- where you were accused of having stolen hay?Interview with Mira Zimmerman %8 January 23, 2015",A: She had to follow the telephone lines. That was the direction.,"[1, 2, 3]"
Q: What happened?,"A: Well, nothing, the -- the -- the -- the commandant assistant that took part in that part, at that particular project, didn't -- I t-told the judge that he would not take responsibility of Mother's negligence, the -- supposedly, at the same time, Mother had a like, little mishap, unfortunate accident, when a tree pivoted. They were cutting down the tree, and the tree pivoted, and instead of going east, it went west, or whatever. And Mother was in that area, and she ti -- she froze, she couldn't move.","[1, 2, 3]"
Q: The tree fell on her?,"A: She met -- she must -- of course she did. She must have [indecipherable] you know how it is when you are scared of something, whatever. And she fell between the piled up branches, and the branches saved her.","[1, 2, 3]"
Q: I see. I see.,A: So she did it -- the tree sort of was propped by other trunks.,"[1, 2, 3]"
"Q: So she was saved, but she was stuck?","A: Was sure, wa -- th-they helped her out after everything settled down, but it was a little difficult.","[1, 2, 3]"
"Q: Were there any other such difficulties that she and you had in th -- in that camp, either with keeping warm, or trying to get food?Interview with Mira Zimmerman *deg January 23, 2015","A: Well, that was always a problem. Mother pretended she smoked, and -- the tobacco. She could exchange, some guy that stopped by there from time to time.","[1, 2, 3]"
Q: So she would --,A: The what?,"[1, 2, 3]"
Q: Did she -- did she get tobacco as a ration?,"A: Well, this -- this -- she couldn't buy tobacco --","[1, 2, 3]"
Q: Okay.,"A: -- at the store. But she could also then take the tobacco to one of the villages that stop by, and they would give her potatoes or, I think -- and I think it was mostly potatoes. I don't know if there was --","[1, 2, 3]"
Q: So food. She would get food for the tobacco.,"A: Well, that was the -- the way to get some food. [break]","[1, 2, 3]"
Q: To keep clean? You were going to tell me about keeping clean.,"A: Oh, to keep clean, the blankets or the clothing, we had to boil ashes with -- in water, and it di-disinfected the thing that way.","[1, 2, 3]"
"Q: You mean, you would put the blankets in the water, and the -- and ashes --","A: With the -- yeah, with the ashes, the ashes, the wood ashes.","[1, 2, 3]"
Q: Wha -- what would the ashes do?,"A: Well, they -- they disinfect it mostly.","[1, 2, 3]"
"Q: Really? I never knew that.Interview with Mira Zimmerman *"" January 23, 2015","A: Well, that's what we were told. I didn't know any other way. The -- there was also another method of it -- we tried to fake out, or in somehow -- but I --I don't remember how they did it, but the barracks were infested with field lice.","[1, 2, 3]"
"Q: With field lice, okay.","A: And th-that was very annoying, what it -- I don't know if you are familiar what I'm talking about.","[1, 2, 3]"
Q: No.,"A: But they smell quite a-atrocious, and they -- well, they -- they are like lice. Like -- like --","[1, 2, 3]"
Q: Were you able to -- was there -- were there bathing facilities? Was there a place to take a shower?,"A: They -- they -- no, no, no bathing, you had to take care of yourself. But from time to time, someone like got a [indecipherable] problem, they got a problem with some medical issue, and sometimes they would just send them to the camp doctor -- doctor, but there was nothing else.","[1, 2, 3]"
"Q: Now, I want to ask you about when your mother got in trouble for the hay that was -- was for the goat.",A: Mm-hm.,"[1, 2, 3]"
"Q: Did you actually take hay that you shouldn't have, or was it somebody accused you of it?Interview with Mira Zimmerman "" January 23, 2015","A: No, I did --I-- this was something that dripped from the cart.","[1, 2, 3]"
Q: And so it was perfectly okay?,A: And it-t-t -- it was okay.,"[1, 2, 3]"
"Q: And somebody then just accused her anyway, of taking hay she shouldn't have?","A: Well, they -- the -- the -- they wanted, I think to take advantage of Mother's strength, and make her work a little bit harder.","[1, 2, 3]"
Q: Okay. Okay. Did she get a punishment for it?,"A: Well, I-- I think she -- she was -- she didn't get the full salary that -- that, quote, she earned.","[1, 2, 3]"
Q: I see. I see. What happened to your little dog Figa?,"A: Oh, he got a -- at the last minute, as the sleigh was about to start for the railway station, Figa jumped into the snow and disappeared.","[1, 2, 3]"
"Q: Oh, so you had been taking her with you?","A: We --- we were sort of planning to, cause that was my one thing that I treasured.","[1, 2, 3]"
Q: Did you make friends with other people in that camp?,"A: Well, yeah, of course we did. [indecipherable] as much she had the -- there was time for any, quote friendly relations. But if they had husbands with them, they sort of supplied some nourishment to the situation.ontactrefiranneGaushariarg a hither atrmedortabeattfiexaliaton Interview with Mira Zimmerman * January 23, 2015","[1, 2, 3]"
"Q: Yeah. And when you said your mother found out about these Polish units being formed, and she was going to sign up to be a nurse, and she arranged that you would be in an orphanage, would that have been staying in the camp, or would that have been an orphanage of Polish children moving with the unit?","A: Oh no, it was being the same as in camp. There was -- you couldn't trust the Russian authorities, whatever. There were kids that were picked up by the railway stations and the other places, that spoke maybe Polish, but they -- once they were taken to the orphanages, they disappeared from existence.","[1, 2, 3]"
Q: So it was not to a Soviet orphanage she would have gi -- she would have left you.,"A: Well, it would have been the Soviet orphanage, but not for the Polish kids, so far.","[1, 2, 3]"
"Q: Okay. Okay. I think we should break here. [break]Interview with Mira Zimmerman 8 January 23, 2015 Q: This is a continuation of the United States Holocaust Memorial Museum interview with Mira Zimmerman, on January 23"", 2015. And before the break, Mira, we were talking about your mother having learned that Polish prisoners were being released from the labor camps in Siberia. And she, as first finds -- makes arrangements to leave in one kind of way, and then the commandants change, and then she tries another kind of way. And you two end up leaving with some other people on a wagon, going towards the river. And do you remem -- can you tell me a little bit about --","A: The riverboat, yeah.","[1, 2, 3]"
Q: To the riverboats. Can you tell me a little bit about that riverboat journey?,"A: Well, it was a little, I think, frightening to all of -- in a way. But there was an incident where a chil -- a girl, a young, young, I think maybe younger than I, fell into the water, and they didn't stop the boat, didn't try to retrieve her.","[1, 2, 3]"
Q: She was just left there to drown?,A: They just left her to drown. The body was dragged after the boat.,"[1, 2, 3]"
Q: Oh my. Oh my. Did you see this?,"A: My mother to -- covered my eyes, didn't want me to look at -- tried to distract me.","[1, 2, 3]"
Q: Was the boat full of people?,"A: Yeah, it was packed.ontactrefiranneGaushariarg a hither atrmedortabeattfiexaliaton Interview with Mira Zimmerman "" January 23, 2015","[1, 2, 3]"
"Q: And who was running the boat? Was it the Russian officials, the Soviet officials?",A: The -- th-the -- th-the -- the Russians were running the boat.,"[1, 2, 3]"
Q: Okay. So the Soviets were -- were in charge of transporting you?,"A: Well, this was a way of transporting to the -- through the waterway traffic.","[1, 2, 3]"
Q: And where did they take you?,A: Hm?,"[1, 2, 3]"
Q: Where did they take you?,"A: Oh, th-this was -- they were -- they were simply trying to get to the centers of the formation of -- of this new, quote, addition to the Russian army.","[1, 2, 3]"
Q: Mm-hm. And -- the Russian army?,A: Well--,"[1, 2, 3]"
Q: Or the Polish army?,"A: These -- the Polish army, but it was in Russia, and under Russian jurisdiction.","[1, 2, 3]"
Q: Okay. Where did you land? Where did you finally end up?,"A: Well, I remember having to wait for several hours, and I was go -- got very scared. I was all alone. Th-the -- the individuals from that labor camp had to register to do -- fill out some papers, and it took quite a few hours to get that -- to do that s-signing up, and to -- to come back. I was scared that I would be left alone, that Mother was arrested. It was somewhat frightening thing, because I -- I was byInterview with Mira Zimmerman * January 23, 2015myself. But before, there were other people around, but at that point, th -- the people left, and they -- those that were from our labor camp were trying to get those papers com -- signed up and cleared.","[1, 2, 3]"
Q: Were you already off the boat when you were waiting for it?,A: The -- I-- we were on the dock.,"[1, 2, 3]"
Q: You were on a dock. Do you remember the name of that place?,"A: Oh, no, I don't remember.","[1, 2, 3]"
Q: Okay. Did your mother return? Did your mother return?,"A: Oh, course, Mother returned and she bought si--I guess they had some money allotted to the ki-- those from our boat [indecipherable] the -- Mother bought a doll for me.","[1, 2, 3]"
Q: Really?,"A: To -- to try to distract me from what was going on, what we were going through.","[1, 2, 3]"
Q: And she bought it for you there?,"A: At the onset. Anyway, Mother bought a doll at that place, and that -- and that doll unfortunately, didn't last very long. Someone stole it from me. It didn't really mean very much, but well, that's all mo -- Mother could do -- use to distract me and -- not to be scared, or something.","[1, 2, 3]"
"Q: Where did you go from there?Interview with Mira Zimmerman *deg January 23, 2015","A: Well, that was another place, I don't remember th -- the sequence now any more, but it was another place that collected, you might say, units for that formation of that army. And that was --","[1, 2, 3]"
Q: Mm-hm. And so that means you were amongst Polish military people?,"A: Pol - military people, mostly Polish. That what we had to deal with from then on, for some time, simply bec -- after finding out that we could leave th-the Russian free labor camps jurisdiction, then we could -- we still needed assistance, so the army units were open, fed some of the civilians. We got some food that way.","[1, 2, 3]"
"Q: Oh, I see. So the Polish army units were feeding some --",A: They started -- they started these refugee camp centers.,"[1, 2, 3]"
Q: Were you -- how were you housed? Were you living in barracks again?,"A: In barracks, or we -- th-the local housing that was available, some of them had, you know, specially the [indecipherable] then -- that they had kibidszkys(ph), mud huts, with the mud.","[1, 2, 3]"
"Q: Did you live in that, in those?",A: We did.,"[1, 2, 3]"
"Q: I see. By this point, was it still wintertime, or was it already warmer?","A: Well, it was still wa -- cold.","[1, 2, 3]"
"Q: Did you get sick --ontectnetonancedjusetneey for tarher biormatoerabouttfisestecion Interview with Mira Zimmerman "" January 23, 2015","A: Mother and s-some man got together and, quote, robbed a -- a storage of white beets.","[1, 2, 3]"
Q: White beets?,"A: The white beets, which are really sugar beets. A-And those white beets were so delicious when they were roasted in a -- in a campfire.","[1, 2, 3]"
"Q: Oh, really? Yeah.","A: Yeah. But anyway, Mother and actually the -- the man call -- talked my mother into being brave enough, and my God, Mother was brave, she -- she didn't need talking into, but anyway, Mother decided to join them on that excursion of ge -- helping ourselves from some -- beets were stored, I think before the army, or something like that. Bec -- just to store it, sucked up beets, because [indecipherable]","[1, 2, 3]"
"Q: Other than that, were you hungry there? Were you hungry in this place?","A: We were hungry. We were fed the beginning by -- by some -- I guess these were [indecipherable] or no, that's my -- maybe that was a little later, but at one point in our journey going south i-in Russia, we would get lepierszki(ph).Lepierszki(ph) was something like a deep dish pizza.","[1, 2, 3]"
"Q: Really? Uh-huh, with -- with tomatoes?","A: But it wasn't -- it wasn't filled with any, it was just a loaf like that.","[1, 2, 3]"
Q: I see.,"A: And they eat it with li-- I don't know that th-they have had something that they -- they were eating it with, but they gave some to -- to the prisoners.","[1, 2, 3]"
Q: But you weren't prisoners any more.,"A: No, we weren't prisoners, I don't know how to distinguish them to the -- to the","[1, 2, 3]"
Q: Refugees?,A: To the refugees.,"[1, 2, 3]"
Q: Okay.,A: Well --,"[1, 2, 3]"
"Q: Is this like a flatbread that you're talking about, it was a flat bread?","A: It's not flat. It was something like a -- a bread that's thick, but it was a-around, it was in a-- ina round form.","[1, 2, 3]"
