Question,Answer,topics
Q: Did you ever go to your native town in Germany?,"A: No. I've never been -- I've been back to Germany. I went back -- when I worked atBurroughs (ph), I went to Belgium, and I went to Germany for one day because Ihad -- and I met my uncle. He is the only -- the only relative I have ever met. Well, Ishouldn't say that. I met some of my cousins but the only one of that -- of that generationI met, and, you know, he was a doctor in Bonn, and so I went and had lunch with him andhis wife. That's -- that's all. That -- that was the only day, up in Germany.","[1, 2, 3]"
Q: Did you have --,A: I don't travel well so I just don't go much.Go ahead.,"[1, 2, 3]"
Q: Yeah. Did -- did you have some family who stayed back then in Germany when your,"A: Yeah. My grandfather -- my father's father and mother, they were both dead. Mygrandfather on my mother's side and her sister Kate did not want to leave Germany, andthey were -- I know Kate -- there was a Gastronaught (ph). We have the Red Crossreport, and my father (sic) was in a -- like a ghetto, a small ghetto, and I don't recallexactly where, but he was sick and he was old so he just probably passed away in there,don't have any real documentation on him. All my uncles -- my aunt, my father's oldestsister, went to England. I don't know when. All my uncles left. One of them was inArgentina, and the rest of them went to Israel, so they all got out, so the only ones -- theonly really close relatives I had was my -- my grandfather and my aunt, and they both The following transcript is the result of a recorded interview. The recording is the primary source document, not this transcript. It has not been checked for spelling nor verified for accuracy. This document should not be quoted or used without first checking it against the interview.eae rights ee eee RSSRE BPS Sea IS: Memorial MussH ase ection eb yal dest aeues: lntgimalien abgubgcess andInterview with Michael W. Wolff 20perished. They both stayed back.","[1, 2, 3]"
Q: And did your parents ever go back to their --,"A: My parents went back. My parents went back. My father was very leery of going. Hesays, I know, you don't want to go and say goodbye to them because he figured thatwould be his last trip, but they went back, and they eventually went to Israeland -- and -- and Germany, and they -- they saw -- they saw the people. My Aunt Hannah(ph) came to the United States, but I never met her because I was in Utah, and I don't -- Istill don't know to this day when she was coming through Utah, my father said don'tgo -- don't go to the station. I don't know why. It was very strange, and my father wassuch an easy person to get along with. I just don't know what happened. Something wentwrong, but yeah, eventually most of them moved back to Germany, and most of mycousins are in Germany and in Israel. I tried -- my father was the youngest. I'm the oldestof the next generation. I tried to get us together, and my mother said you're going to getone response. I think there is 12 of us, and I got one response, and nobody was interested.I have seen a few of my cousins as they come to the states, and, you know, if they cometo LA I usually meet with them, and one of my cousin's sons was in Orange County sowe met with him quite often, but they moved to Texas.","[1, 2, 3]"
Q: So let's continue.,A: That's basically it. I -- I don't have any more to --,"[1, 2, 3]"
Q: Have you heard from your parents what happened to their property back in Germany?,A: [know they got restitution.,"[1, 2, 3]"
"Q: Oh, they did?","A: I don't -- I don't know -- the property -- the sawmill was sold, and, you know, ten centson the dollar or some -- some ridiculous amount, so that was sold. My father's store, hesold -- my grandfather's store, very early on, you know, ""34, end of ""33, ""34 the brownchurch started coming in -- you know, standing in front of the store and telling peopledon't go in here because this is owned by Jews, you know, so he eventually sold it and hemoved in with -- with my father and mother and myself in Reichenbach. He moved inwith us, so that's the only property we basically had, and so -- I have the bill of sale. Itwas sold to -- you know, sold by Arnold Wolff, a Jew, to Doctor such and such, Arian.It's right on the -- on the bill of sale.","[1, 2, 3]"
"Q: And you told this story to your -- to your kids, right, and to your grandkids?","A: Yeah, kids and grandkids. I'm writing a book. I'm an engineer. I don't write well, soit's very slow, but I am trying to.","[1, 2, 3]"
"Q: What is their attitude -- attitude to your experience, to them being Jewish?","A: Well, it was basically -- well, both of my kids married out of their -- you know, theirspouses were not Jewish, although my -- and they are both divorced now so it doesn'treally matter, but they have nothing. I think my -- my daughter has converted toChristianity, so she's basically lost, and her -- her son is being raised as a Christian, andso that's my youngest grandson. My oldest grandson is married. He's married to an ItalianMexican gal, and I don't know -- they -- I don't think they do anything. His -- her side ofthe family did nothing, and my -- my son did nothing. When my son got married, he wentto our rabbi, and he wanted him to -- to get married -- you know, to marry them, and atthat time the -- you know, the reform didn't do mixed marriages so they refused them, so The following transcript is the result of a recorded interview. The recording is the primary source document, not this transcript. It has not been checked for spelling nor verified for accuracy. This document should not be quoted or used without first checking it against the interview.eae rights ee eee RSSRE BPS Sea IS: Memorial MussH ase ection eb yal dest aeues: lntgimalien abgubgcess andInterview with Michael W. Wolff 22 they -- we lost them totally. That kind of soured him on everything. Now that he is divorced and he is -- he has had major health problems -- he had a bypass operation -- now he is coming back. He has joined a temple and he is on the choir and he is starting to come back. He came up to Rosh Hashanah for services with us, so he is coming back after th fold. My granddaughter today as a matter of fact is going to Israel on the Birthright trip. She is leaving from New York probably right about now, so I'm curious -- very curious to see what the effect will be when she comes back. I know that -- she was also in London with me. They were very taken by the Holocaust Museum in London, and then when they heard the story, you know, that -- that really affected them. They were -- the other kid that was there, Mikey, my middle grandson, you know, he is a real goff-off, and he was -- he was all ears, and he was really attentive, and he told me, he says if you don't publish your book I will, so he was -- I know -- I know he took it very seriously, and it finally -- I think it finally sunk in. The 12-old-year old -- it was interesting. In Santa Barbara there is -- they did an exhibition. It's a room that the Jewish Federation did. I guess they copied Toronto. Toronto has a wall of Holocaust survivors, not particularly KTA but just Holocaust survivors, where they have big plaques. They're probably about, oh, a foot and-a-half wide and about three or four foot tall, three foot tall, where they have the pictures and the stories of the -- of the survivors, and Santa Barbara copied that, and I'm one on the wall, and so we do -- we do -- we do speak to groups. I go out several times a year and speak to schools or -- or you know, sometimes universities, sometimes adults, whenever -- whenever somebody comes and asks, so we do do that, and when my grandson, the youngest one, Joshua, was in third grade they were learning The following transcript is the result of a recorded interview. The recording is the primary source document, not this transcript. It has not been checked for spelling nor verified for accuracy. This document should not be quoted or used without first checking it against the interview.eae rights ee eee RSSRE BPS Sea IS: Memorial MussH ase ection eb yal dest aeues: lntgimalien abgubgcess andInterview with Michael W. Wolff 23 the Holocaust, which kind of surprised me. I thought it was a little early. Of course my daughter told the teacher about it so I was invited to speak, and I spoke, and they had one -- they had about -- about 25 kids in the classroom. One -- one was a problem. You know, he had attention deficit, but the rest of them were just amazingly attentive, and to be honest with you, I got the best questions from those kids that I ever got on any speech.Most of the time we talked to, you know, high schoolers, and it's not cool to ask questions so they don't ask a lot of questions, but I don't know -- since then Joshua has probably not even thought about it.","[1, 2, 3]"
"Q: Looking back at -- at your life in England and the early years of your life, do you think that this Kindertransport and Holocaust experience was decisive in your life, like did it affect certain decisions?","A: I don't think so. I don't think so because I was so young. You know, I talked to some of the fellow, you know, Kindertransporters, and it's kind of the same story. The younger ones, we did okay. Of course my mother took the extra effort to place with me with a family and some of them just went over. You know, some of them went with siblings and they were separated. Some of them went to -- into farms where they were put to work, and so, you know, some of them had a harder life than I had. I was so young. It just -- by the time I -- I got to Bolivia I was five years old, and, you know, life from there was -- you know, I wasn't used to anything else. You know, we were -- we were poor, and we -- we did what we could. You know, until we got to living in -- in the company house we were -- you know, in real dumps so to speak, and after that it was -- you know, it's always -- you do what you have to. You know, that -- that was my parent's way, you The following transcript is the result of a recorded interview. The recording is the primary source document, not this transcript. It has not been checked for spelling nor verified for accuracy. This document should not be quoted or used without first checking it against the interview.eae rights ee eee RSSRE BPS Sea IS: Memorial Missy esr! entior oboe desta ealess lp osonal abaukarcess andInterview with Michael W. Wolff 24know, and, you know, today over here my mother would have to go to therapy andwhatever to -- to recover, but, you know, it wasn't done. I don't know how she gave meup. I just -- I can't visualize giving my one child, you know, at three years old, givingthem away and not knowing whether you'll ever see them again. You know, how hard isthat? Just -- you know, it was just unbelievable what they went through, but for me itwas -- you know, I just don't have a memory of anything. The only bad thing probablyhappened when I crossed the Atlantic and we had some gunfire, and that's about it. That'sabout all I heard.","[1, 2, 3]"
Q: Do you remember when you just came to Bolivia what your parents were speaking,"A: The only thing -- the only thing I remember really is when we -- I don't rememberanything when we first got there. They probably wouldn't have talked in front of me. I'msure of that, and -- well, then I started learning German so I could understand it. Iremember very distinctly the day the war was over in Europe, there was a -- kind of like abachelor's quarters for the people that worked for the mining -- you know, there was anAmerican mining company. They had a big party, and the only time I saw my motherdrunk. She got tipsy. That's the only time, and the first comment she made is, I'm going togo see what happened to -- you know, to her father and her sister and contact the RedCross right away. We didn't hear for almost 15 years later, but that was her first action.That's the only time I really remember them talking. There were always -- there was agroup of Nazis in town, and we never associated, and they were always, you know, the The following transcript is the result of a recorded interview. The recording is the primary source document, not this transcript. It has not been checked for spelling nor verified for accuracy. This document should not be quoted or used without first checking it against the interview.eae rights ee eee RSSRE BPS Sea IS: Memorial MussH ase ection eb yal dest aeues: lntgimalien abgubgcess andInterview with Michael W. Wolff 25enemy, and even when I went to school in Aurora (ph) there was a big group of Nazis inthere, and, you know, it was -- we never associated with them, and most of the kids Iwent to school with were -- were Gentiles. There was a few Jews. Well, eventually I livedwith a Jewish family in Aurora (ph), and, you know, they were the same way. We juststuck to each other and I never associated with them.","[1, 2, 3]"
Q: And nowadays do you feel more like you're Jewish or American? Do you keep a more,"A: We go to temple very seldom. We do -- we do the holidays. We always have aPassover. We belong to Havurah, you know, in -- in our temple, and so we have thatextended family, but we don't really practice Judaism. You know, we do it during theholidays and we do Passover and we do -- we do a little bit of Hanukah, but Passover isalways big, but, you know, we celebrate Thanksgiving big, and my wife was -- was whatthey call a valley girl in Los Angeles, and they're sort of Jews. You know, they -- theyhad a Christmas tree, and they -- you know, they -- I don't think her -- except for herfather nobody ever went to temple. She is probably much more religious now than sheever was because she is part of the choir at the temple. She belongs to the sisterhood. Ibelong to the B'nai B'rith -- you know, the B'nai B'rith Lodge in town, but most of myfriends are Jewish, You know, not all of them but most of them, but we -- we don't reallypractice the religion.","[1, 2, 3]"
"Q: Well, do you want to add something to the story about your -- experiences?","A: Not much. You know, it is what it is and, you know, you kind of roll with it. Youknow, I was always taught my parents, you know, you do the best you can and that's it, The following transcript is the result of a recorded interview. The recording is the primary source document, not this transcript. It has not been checked for spelling nor verified for accuracy. This document should not be quoted or used without first checking it against the interview.eae rights ee eee RSSRE BPS Sea IS: Memorial MussH ase ection eb yal dest aeues: lntgimalien abgubgcess andInterview with Michael W. Wolff 26you know. Things happen. You know, who knows what would have happened? We werejust talking downstairs with one of the Kindertransport -- you know, do you ever think ofwhat would have happened if there hadn't been a Hitler? I said, well, my son wouldn't behere. That was one thing. Well, who knows? Who knows?","[1, 2, 3]"
"Q: Well, Mr. Wolff, I would like to thank you for the time --","A: Well, thank you.","[1, 2, 3]"
"Q: Thank you for the amazing story, and good luck with your book. Thank you so much.",A: Thank you.,"[1, 2, 3]"
Q: And this concludes the United States Holocaust Museum interview story with Michael,"A: Thank you.Conclusion of InterviewThe following transcript is the result of a recorded interview. The recording is the primary source document, not this transcript. It has not been checked for spelling nor verified for accuracy. This document should not be quoted or used without first checking it against the interview.eae rights ee eee RSSRE BPS Sea IS: Memorial MussH ase ection eb yal dest aeues: lntgimalien abgubgcess and","[1, 2, 3]"
