Question,Answer,topics
"Q: Okay, okay. And did you have to move to a different neighborhood?","A: Well, not a bad neighborhood, but a different neighborhood, yeah.","[1, 2, 3]"
Q: And it's at this point that your nanny no longer stayed with you? That is --,A: Yeah.,"[1, 2, 3]"
"Q: Yeah, okay.",A: But she was there always.,"[1, 2, 3]"
Q: Do you remember the date that Hitler annexed Czechoslovakia?,A: No.,"[1, 2, 3]"
Q: Okay.,A: No.,"[1, 2, 3]"
"Q: I believe it was in 1939. I think it was March, but I'm not sure.",A: I'm not sure of that.,"[1, 2, 3]"
"Q: Okay. But how did that ki -- how did that resonate in Bratislava, when that",A: The Slovaks were different from the Czechs.,"[1, 2, 3]"
Q: Okay.,A: The Czechs stayed against the German. The Slovaks greeted them with pleasure.,"[1, 2, 3]"
Q: Why?,"A: The president of Slovakia was a Catholic priest, who was very happy andcooperative with -- with the Germans.","[1, 2, 3]"
Q: How do you explain that?,A: [have no idea.,"[1, 2, 3]"
Q: It's so diametrically different.,"A: [have no -- yes, yes.","[1, 2, 3]"
Q: How did this -- how was this experienced on a personal level?,A: Very unpleasant.,"[1, 2, 3]"
Q: Did -- what happened to your father's business?,A: My father's business was arizeered(ph)?,"[1, 2, 3]"
Q: Aryanized.,"A: I don't know, I don't know.","[1, 2, 3]"
"Q: Ar-Aryanized, yes.","A: Aryanized, yes? I don't know exactly when and how, I just don't remember.","[1, 2, 3]"
Q: Do you remem --,A: It was not important enough for me.,"[1, 2, 3]"
Q: Yeah. Was there a change in him?,"A: I don't think so. He was a born optimist.The following transcript is the result of a recorded interview. The recording is the primary source document, not this transcript. It has not been checked for spelling nor verified for accuracy. This document should not be quoted or used without first checking it against the interview.The interview is part of the United States Holocaust Memorial Museum's collection of oral testimonies. Information about access and usage rights can be found in the catalog record.28Interview with Alice TyrolerMay 8, 2013","[1, 2, 3]"
Q: Was he?,A: Yeah.,"[1, 2, 3]"
Q: What would he say when things like this would happen?,"A: It won't last long. He did not want to leave Bratislava because he said, thesepeople are all my friends, they're not going to do anything to me. And it was verysurprising.","[1, 2, 3]"
"Q: Well, tell me about some of that.","A: I don't know exactly the time, but they came to -- they came to get me once forthe first time for it, but I was ill. I had a infectious disease, so they didn't come in.So if -- they came a second time. They took me and my mother and took us to -- tothe police. And from then on, to Novaky, to the camp.","[1, 2, 3]"
Q: Had -- had Czechos -- had Slovakia already declared its independence?,A: I don't know how it worked. I really don't know how it worked.,"[1, 2, 3]"
Q: Okay. Do you remember --,A: I wasn't interested.,"[1, 2, 3]"
Q: Of course.,A: I don't know if you understand what I mean.,"[1, 2, 3]"
Q: Oh yeah.,"A: It was, who cared? And they were willing to sell us, supposedly was the onlyhead of the state supposedly, I don't know if it's true. That's what I heard. Then Dr.The following transcript is the result of a recorded interview. The recording is the primary source document, not this transcript. It has not been checked for spelling nor verified for accuracy. This document should not be quoted or used without first checking it against the interview.The interview is part of the United States Holocaust Memorial Museum's collection of oral testimonies. Information about access and usage rights can be found in the catalog record.29Interview with Alice TyrolerMay 8, 2013Tiso, the president, paid for each Jew that was deported, he paid the Germans to takethem.","[1, 2, 3]"
Q: What a -- what a betrayal. Do you remember how those guards looked when they,"A: They were Slovaks, Slovaks. Was called Hlinka, Hlinka guard.","[1, 2, 3]"
Q: Okay. Were they young?,"A: Yeah, I think so.","[1, 2, 3]"
Q: And what was their manner like?,"A: They brought us to the police, and there were all kinds of our friends over therealready sitting.","[1, 2, 3]"
Q: How old were you?,A: How old was I? That was in -- I think I was almost 16.,"[1, 2, 3]"
"Q: So it was in ""42?","A: Yeah, it was in ""42. I had in the meantime, after school, my father had a verygood friend who had a bakery, including like a patisserie, where people would havetables. It still exists today in Bratislava.","[1, 2, 3]"
Q: And which chi --,"A: It's called Konditorei Mayer. They were German, but very nice. They werefriends of my parents, cause they had about four stores away from my parents"" store.And so when they throw me out of school, I don't know if you're interested in that -- The following transcript is the result of a recorded interview. The recording is the primary source document, not this transcript. It has not been checked for spelling nor verified for accuracy. This document should not be quoted or used without first checking it against the interview.The interview is part of the United States Holocaust Memorial Museum's collection of oral testimonies. Information about access and usage rights can be found in the catalog record.30Interview with Alice TyrolerMay 8, 2013","[1, 2, 3]"
"Q: Yes, I want to know about that.","A: When they threw me out of school, what do you do at the home all day long? So,this friend of mine, the -- the ha -- the Uncle Mayer, they called him, told my father,why don't you let her come, and she can learn in my bakery, to -- to bake and tocook, etcetera.","[1, 2, 3]"
Q: And did you do that?,"A: And then I-- yeah. And when my father came with the idea home, I said, whyshould I go to learn to bake and to make hors d"" oeuvres -- you know, the very noble,elegant things? What do I need it for? So he said, when you're going to have later ona cook, cook in your house, then you can supervise better, and you're going to knowhow to do things.","[1, 2, 3]"
Q: Did that make sense to you?,"A: No. Now, or then?","[1, 2, 3]"
Q: Then.,A: No. But it was better than hanging around doing nothing. So I worked there for afew month then.,"[1, 2, 3]"
Q: Mm-hm. But just a few months?,"A: Yeah. About a year, or something like that.","[1, 2, 3]"
Q: Mm-hm. And what was the experience like?,"A: Very hard work, learning very, very nice things.The following transcript is the result of a recorded interview. The recording is the primary source document, not this transcript. It has not been checked for spelling nor verified for accuracy. This document should not be quoted or used without first checking it against the interview.The interview is part of the United States Holocaust Memorial Museum's collection of oral testimonies. Information about access and usage rights can be found in the catalog record.31Interview with Alice TyrolerMay 8, 2013","[1, 2, 3]"
Q: Can you still make them?,"A: Yeah, if I wanted to, but --","[1, 2, 3]"
Q: You don't want to.,"A: -- not now, nah.","[1, 2, 3]"
"Q: Nah. Did -- at that point, was -- in Slovakia, were you forced to wear yellow","A: Yes, the big one.","[1, 2, 3]"
"Q: Okay. And when did that come in, fairly --",A: I don't know.,"[1, 2, 3]"
Q: Okay.,A: [really don't know.,"[1, 2, 3]"
Q: But fairly soon after all of the changes?,"A: I think so, yeah.","[1, 2, 3]"
Q: Okay.,A: But I can find out those things for you whatever you -- whenever you need it.,"[1, 2, 3]"
"Q: No, no, I-- I'm not so much -- sometimes I'm interested in dates and things, but","A: And then I had a third year in the other one, in the mixed one.","[1, 2, 3]"
Q: In the mixed one.,"A: Czech and Slovak, yeah.","[1, 2, 3]"
"Q: And that was okay, to go there, it was allowed?","A: Yeah, oh yeah, of course. And in the meantime, of course, we had organized --there was a very well-known bookstore in Bratislava, it was called Der Steiner.Steiner Buchhandlung.","[1, 2, 3]"
"Q: Steiner Buchhandlung, uh-huh.","A: Yeah. And they had the big house, summer home, with a garden, which had afence. And they allowed all of those young groups of Jewish children to do whateverthey wanted in their garden, because we saw that we couldn't go there, because theywould beat us up in -- you cou -- would walk up about 10 minutes. It was a very nicearea, and there were the summer homes.","[1, 2, 3]"
Q: And was this bu -- was this bookstore owned by a Jewish --,"A: Steiner familie, yeah.","[1, 2, 3]"
"Q: Yeah. Jewish family, yeah.",A: Yes. All that -- about 200 years.,"[1, 2, 3]"
Q: What was going on -- uh-huh?,"A: One of this -- one the -- one of the sons of the owner went with me to school, andwe went to school, and he died about almost two years ago, in Jerusalem. He wasworking for Yad Vashem --","[1, 2, 3]"
Q: Oh really?,"A: -- when he retired, yes. His name was -- in Hebrew was David, but we called himZiggy. Siegfried Steiner.","[1, 2, 3]"
Q: Siegfried Steiner.,"A: Yes. And his sister was Rially(ph) in Hebrew, and she was the [indecipherable]the leader of the group of Jewish children which I belonged to.","[1, 2, 3]"
Q: Did you --,"A: We would meet there, and talk there, it was all Zionistic organization.","[1, 2, 3]"
Q: What was the name of the organization?,"A: What was the name of the organization? One was -- one was Maccabee Hatzair,that was mostly the sport. Bakhovka(ph) was the swimming club, and then was -- Ithink it was B'nai Yehuda(ph), I'm not sure. Aki -- B'nai Akiba.","[1, 2, 3]"
Q: B'nai Akiba.,"A: B'nai Akiba, I think, yeah.","[1, 2, 3]"
Q: What was going on with your brother with the -- all these things that were,"A: My brother had his group, where he belonged to.The following transcript is the result of a recorded interview. The recording is the primary source document, not this transcript. It has not been checked for spelling nor verified for accuracy. This document should not be quoted or used without first checking it against the interview.The interview is part of the United States Holocaust Memorial Museum's collection of oral testimonies. Information about access and usage rights can be found in the catalog record.34Interview with Alice TyrolerMay 8, 2013","[1, 2, 3]"
Q: Okay.,"A: But the Steiners were very good friends of ours. The parents were friends, andwe were friends with the family. By the way, the sister, Rially(ph) Steiner, she diedvery early in Auschwitz. We know that. And then was there a -- a very good friendof my brother's, his name was Leo Lachner(ph). He died a few years inSwitzerland, he was a -- I think he was a composer in Switzerland. They were oldfriends. I don't know if [indecipherable]","[1, 2, 3]"
"Q: It -- it's fine. I-I mean, the more names you can recall, the better it is.","A: Oh, I can --","[1, 2, 3]"
Q: Yeah.,"A: My -- my -- the first and second year was the -- we had one main teacher in deut --in deut -- in gymnasium. It was called the Deutsche Statzial(ph) gymnasium, and hisname was Dr. Erbian(ph) Goy(ph), and he was very, very nice to us.","[1, 2, 3]"
Q: And he was German?,A: I don't know what he was.,"[1, 2, 3]"
Q: Okay.,A: Probably. He taught in a German gymnasium.,"[1, 2, 3]"
Q: Yeah.,"A: Yeah.The following transcript is the result of a recorded interview. The recording is the primary source document, not this transcript. It has not been checked for spelling nor verified for accuracy. This document should not be quoted or used without first checking it against the interview.The interview is part of the United States Holocaust Memorial Museum's collection of oral testimonies. Information about access and usage rights can be found in the catalog record.35Interview with Alice TyrolerMay 8, 2013","[1, 2, 3]"
"Q: So, were there Slovak people who showed that they didn't like what was going","A: I don't know, we didn't -- I don't -- didn't have much contact with --","[1, 2, 3]"
Q: Okay.,A: -- with people.,"[1, 2, 3]"
Q: Okay.,A: We tried to survive.,"[1, 2, 3]"
"Q: Yeah, yeah.",A: And learn.,"[1, 2, 3]"
Q: Yeah.,"A: But when we had these [indecipherable] in the -- the garden, or ever we were,was mostly reading, and studying. Then came two teachers, two young women fromBerlin, refugees. They survived, and they came to -- and they started a religiousschool for the few girls over there, that was also in Steiner garden.","[1, 2, 3]"
Q: So it was a refuge.,"A: It was a refuge, yes, yes. I was still in contact with his wife. I was in very closecontact with him til -- til he died. He lived [indecipherable]. His cousin was -- was inthe store til the end, til now.","[1, 2, 3]"
"Q: I don't understand that very well, he was in a store?","A: His cousin.The following transcript is the result of a recorded interview. The recording is the primary source document, not this transcript. It has not been checked for spelling nor verified for accuracy. This document should not be quoted or used without first checking it against the interview.The interview is part of the United States Holocaust Memorial Museum's collection of oral testimonies. Information about access and usage rights can be found in the catalog record.36Interview with Alice TyrolerMay 8, 2013","[1, 2, 3]"
Q: Yes?,A: Stayed in Bratislava.,"[1, 2, 3]"
Q: And owned a store?,"A: And owned the store, yes.","[1, 2, 3]"
Q: Store.,A: The same Steiner Buchhandlung.,"[1, 2, 3]"
Q: Wow.,A: Yeah. There are books about them. I'm sure of-- I'm sure there are in washing --in your museum.,"[1, 2, 3]"
"Q: Well, it's important to know about this from different people, and different","A: Yeah, but I mean there -- I'm sure there are.","[1, 2, 3]"
"Q: Yeah, okay, okay.",A: Yeah.,"[1, 2, 3]"
"Q: When you were arrested with your mother, were your brother and father left",A: They were not home.,"[1, 2, 3]"
Q: So they would have taken you all?,"A: Yeah, they would have taken anybody they saw.","[1, 2, 3]"
"Q: Okay. And when they took the two of you, you left an empty house?","A: No, full house.","[1, 2, 3]"
Q: An empty house of people.,A: Yeah.,"[1, 2, 3]"
"Q: Of people, but a full house of items.","A: A full -- yeah. That was -- before that though, everything was already taken; theradio, and -- and the -- all jewelry, it was already all taken by the state.End of File OneThe following transcript is the result of a recorded interview. The recording is the primary source document, not this transcript. It has not been checked for spelling nor verified for accuracy. This document should not be quoted or used without first checking it against the interview.The interview is part of the United States Holocaust Memorial Museum's collection of oral testimonies. Information about access and usage rights can be found in the catalog record.38 Interview with Alice Tyroler May 8, 2013 Beginning File Two","[1, 2, 3]"
Q: This is a continuation of the United States Holocaust Memorial Museum,A: [inaudible],"[1, 2, 3]"
Q: Yeah. And we were talking about -- we were talking about the requisition and the,"A: I don't know, they just made an announcement, you have to bring it there andthere, and you took and you brought it.","[1, 2, 3]"
Q: Did you do this yourself?,"A: I remem -- no, I didn't do it.","[1, 2, 3]"
Q: Okay. What is it that you remembered?,"A: [remember that I missed the radio very much, because there were no TVs oranything. And well, whatever jewelry there was, and good things, pictures, and youknow, something.","[1, 2, 3]"
Q: What was -- what happened to you after you were at that police station?,"A: After the police station, they took us on the train, and took us to Novaky.","[1, 2, 3]"
Q: And what is Novaky?,"A: Novaky was a camp that had -- was a forced labor camp, and also selection, some-- they went sometimes both to Auschwitz from there too.The following transcript is the result of a recorded interview. The recording is the primary source document, not this transcript. It has not been checked for spelling nor verified for accuracy. This document should not be quoted or used without first checking it against the interview.The interview is part of the United States Holocaust Memorial Museum's collection of oral testimonies. Information about access and usage rights can be found in the catalog record.39Interview with Alice TyrolerMay 8, 2013","[1, 2, 3]"
Q: I see. Did you know about those selections at the time?,A: Yeah.,"[1, 2, 3]"
Q: Did people know where they were going?,"A: We had an idea, yes.","[1, 2, 3]"
"Q: Okay. So, this was in 1942?",A: Yeah.,"[1, 2, 3]"
Q: Had by that time you heard about what was happening to the Jews in other,A: Oh shu -- yes.,"[1, 2, 3]"
Q: Okay.,"A: They were -- I mean, I don't know what you would call them in English, theywere [indecipherable] they took messages from one place to another one. I mean,the whole world knew what was going on. Here they knew what was going on.","[1, 2, 3]"
Q: When -- how was your mother when you got to Novaky? You were together?,"A: Yes, we were together for a short while.","[1, 2, 3]"
Q: Who too --,A: My father and my brother stayed here in -- stayed there.,"[1, 2, 3]"
Q: In their home?,A: No.,"[1, 2, 3]"
Q: In the -- where?,A: Somewhere.,"[1, 2, 3]"
"Q: Uh-huh, they were hiding.","A: In Nanny's -- in Nanny's home, yes.","[1, 2, 3]"
Q: Okay.,"A: And he was working also for -- that was illegal, something illegal, Jewishorganization, my brother. And my father was an expert, and he was hired by acompany that belonged to the state. That gave him the privilege to wear the littlestar. There were big yellow stars, and little stars. And the important, working -- ifhe's in -- good enough to work, he had the privilege to work in very little star.","[1, 2, 3]"
"Q: And it -- was it so that when you and your mother were arrested, that it was at that","A: I think so, I don't know --","[1, 2, 3]"
Q: Okay.,"A: -- really, yeah.","[1, 2, 3]"
Q: Okay. And you didn't know what was going on with them because you were at,"A: We had no idea, yeah.","[1, 2, 3]"
Q: Okay. What was --,"A: And after a while, my father got a permission to bring my mother out, and I wassupposed to follow a week later. And she didn't want to go, she didn't want to leave The following transcript is the result of a recorded interview. The recording is the primary source document, not this transcript. It has not been checked for spelling nor verified for accuracy. This document should not be quoted or used without first checking it against the interview.The interview is part of the United States Holocaust Memorial Museum's collection of oral testimonies. Information about access and usage rights can be found in the catalog record.41Interview with Alice TyrolerMay 8, 2013me there. But I was able to communicate with my brother, through the nanny. Youknow, it --","[1, 2, 3]"
Q: Yes.,A: -- somehow were --,"[1, 2, 3]"
Q: How were you able to do that when you were in the camp yourself?,A: We were able sometimes to send out the note.,"[1, 2, 3]"
Q: Okay.,A: When you found somebody who will take it.,"[1, 2, 3]"
Q: How was your mother's --,A: And he --,"[1, 2, 3]"
"Q: Uh-huh, excuse me.","A: --he--- my brother said then, you can't come yet, you'll come probably in a weekor two, but we are not sure. We can't get it in writing. So I really -- we decided to tellmy mother then the permission was promised for me to go, so she would go. And I --we'd-- we -- we were told then, if she doesn't go now, we can't go any more. Shehad to go first.","[1, 2, 3]"
Q: And she eventually --,"A: She eventu -- she gave in, yes. Because if I can't come a week later after her, thenshe would have spoiled the whole thing.","[1, 2, 3]"
Q: Yeah.,"A: But I wasn't sure that I could go, and I -- I was glad to get her out.","[1, 2, 3]"
Q: Yeah.,"A: Because I knew when she's out, she would be safe, because [indecipherable]was there, and they will do whatever they can. And I stayed, and I told her I really --was almost a lie, but I did anyway. So.","[1, 2, 3]"
Q: So what happened?,"A: She went home too, and she officially was able to live with my father and -- overthere.","[1, 2, 3]"
Q: Okay.,"A: Somewhere, I don't know where.","[1, 2, 3]"
Q: Okay.,"A: They were not in hiding any more, because he had gotten the job.","[1, 2, 3]"
"Q: What about your brother? Was he included in that safe -- safety net, or --",A: I don't think so.,"[1, 2, 3]"
Q: Okay.,A: He was in -- he had to make his own.,"[1, 2, 3]"
Q: Okay.,"A: But they were somehow in contact, but he had to make his own. We never talkedabout the time, never, after the war or anything, never. It was too painful. My father-- then later on it came to it -- then they withdrew my father's permit of working. I The following transcript is the result of a recorded interview. The recording is the primary source document, not this transcript. It has not been checked for spelling nor verified for accuracy. This document should not be quoted or used without first checking it against the interview.The interview is part of the United States Holocaust Memorial Museum's collection of oral testimonies. Information about access and usage rights can be found in the catalog record.43Interview with Alice TyrolerMay 8, 2013have somewhere some paper, where the release of him from his employment, he'snow free -- the state is now free to deport him, my mother and my brother and me.Whoever they can find, they can take. I have it in writing from the -- from the Slovakstate, but I have to find it, I didn't really --","[1, 2, 3]"
Q: It would be very interesting to see that document eventually.,"A: IfI can find it, Pll let you know.","[1, 2, 3]"
Q: Yeah. Do you know what he was an expert in?,A: My father?,"[1, 2, 3]"
"Q: Yeah, that he --",A: Tex -- textiles.,"[1, 2, 3]"
Q: So he was hired because of his expertise in textiles?,A: Yeah.,"[1, 2, 3]"
Q: Okay.,"A: And he was hired, I don't know what he was hired for.","[1, 2, 3]"
Q: Okay.,"A: I didn't talk to him about it, because I never saw him any more.","[1, 2, 3]"
Q: How did that -- how --,"A: Then he, my mother and my brother --","[1, 2, 3]"
Q: Yeah.,"A: -- went to the nanny, into the apartment in hiding. She had the sister. She lived --they lived together in the same apartment. Those two women agreed to save theirlives.","[1, 2, 3]"
Q: What were their names?,"A: The nanny was Anna Weiss, and the -- Francisca Yahan(ph).","[1, 2, 3]"
Q: Yahan(ph).,A: Yeah. Francisca Yahan(ph) and Anna Weiss. Anna Weiss was the nanny.,"[1, 2, 3]"
"Q: Okay. But all this was going on, and you didn't know about it because you were",A: [knew [break] let me put it in.,"[1, 2, 3]"
Q: Okay.,A: Here you have Frieda -- Frieda nerv --,"[1, 2, 3]"
Q: [have --,A: Gizzy(ph) Fleischman.,"[1, 2, 3]"
Q: Gizzy(ph) Fleischman.,A: Yeah.,"[1, 2, 3]"
Q: This is book is [speaks foreign language here],"A: [indecipherable] Gizzy(ph) Fleischman, yeah.","[1, 2, 3]"
"Q: Okay, and it's --","A: Pll just tell you, and she's coming in -- The following transcript is the result of a recorded interview. The recording is the primary source document, not this transcript. It has not been checked for spelling nor verified for accuracy. This document should not be quoted or used without first checking it against the interview.The interview is part of the United States Holocaust Memorial Museum's collection of oral testimonies. Information about access and usage rights can be found in the catalog record.45Interview with Alice TyrolerMay 8, 2013","[1, 2, 3]"
Q: The store.,"A: --into my store, yeah.","[1, 2, 3]"
Q: Okay. And this is acknowledgement in a book by Mr. Oskar(ph) Noiman(ph),"A: This fell off, I am sorry.","[1, 2, 3]"
"Q: Okay, that's okay. So --","A: I don't know how to do that, otherwise I wouldn't make --","[1, 2, 3]"
"Q: Okay, now we're fine. So, we were talking about --",A: Yeah.,"[1, 2, 3]"
Q: We were talk --,A: The beginning of Novaky.,"[1, 2, 3]"
"Q: Yeah. I mean, you were in Novaky as all of this was going on.",A: Yeah.,"[1, 2, 3]"
"Q: So, you didn't know what was happening?","A: No, I had no idea what was happening.","[1, 2, 3]"
Q: And did that permission for you to leave a week later ever come?,A: No.,"[1, 2, 3]"
Q: It never did?,A: No.,"[1, 2, 3]"
"Q: So, how did -- how did you -- how did that affect you?",A: Iwas very happy that my mother was out. I was free to do whatever I wanted. Iwas working underground anyway.,"[1, 2, 3]"
Q: So why don't you tell me a little bit about that underground work?,"A: Underground is nothing much, it's the -- for example, we had the -- do you wantto tape that?","[1, 2, 3]"
Q: Yeah.,"A: Okay, let me think, I have to think about it.","[1, 2, 3]"
Q: About the underground activities?,"A: Yeah, I have to --","[1, 2, 3]"
Q: Okay.,"A: [heard about it, I was too young to do too much.","[1, 2, 3]"
Q: Okay.,A: There were mostly men in there.,"[1, 2, 3]"
Q: Okay.,"A: And we had the connection with Auschwitz, there was one man who went backand forth, until they caught him.","[1, 2, 3]"
Q: That's quite amazing.,"A: Yeah. I don't remember his first name, his last name -- we called himHelfgott(ph). The blond young man who spoke fluently German, and went back and The following transcript is the result of a recorded interview. The recording is the primary source document, not this transcript. It has not been checked for spelling nor verified for accuracy. This document should not be quoted or used without first checking it against the interview.The interview is part of the United States Holocaust Memorial Museum's collection of oral testimonies. Information about access and usage rights can be found in the catalog record.47Interview with Alice TyrolerMay 8, 2013forth, and we ask him where he went, he said, don't ask. And one nice day he didn'tcome back, so they caught him.","[1, 2, 3]"
