Question,Answer,topics
"Q: Was he a guard, was he a prisoner?","A: No, he was one of us, yeah. There was, for example, they brought in, at thecertain time in -- I don't know if you ever heard, there was a so-called Siestejprapore, which is the sixth division of Jewish soldiers. In order to go like to themilitary, everybody had to go. They wore green uniforms. The Jewish group woreblack uniforms, and were doing the ugly and difficult work, digging and -- well, thatwas it. And they came in in about 1943, they brought them -- transferred them fromthe military into the camp.","[1, 2, 3]"
Q: As prisoners?,"A: No, as -- yeah, as inmates from the camp. Never -- never saw the pr -- yeah, as aprisoner. Okay. So, there was a group of young men, and one of them came withtyphoid from -- but he didn't come with his group of soldiers, he came from anothercamp, but that was a political camp, that was not a Jewish camp.","[1, 2, 3]"
Q: Okay.,"A: He was called Elaver(ph), and there they had political prisoners. And I knew --we knew his family -- I knew from home his family, but he came alone. His fatherwas a psychiatrist who was killed by one of his patients, but before. And his name The following transcript is the result of a recorded interview. The recording is the primary source document, not this transcript. It has not been checked for spelling nor verified for accuracy. This document should not be quoted or used without first checking it against the interview.The interview is part of the United States Holocaust Memorial Museum's collection of oral testimonies. Information about access and usage rights can be found in the catalog record.48Interview with Alice TyrolerMay 8, 2013was Janko(ph) Sakay(ph). And you couldn't bring him -- didn't bring him in thebarracks, so they brought him in a tent.","[1, 2, 3]"
Q: Okay.,A: And I--I took care of him. Wasn't afraid of that.,"[1, 2, 3]"
Q: You didn't catch the typhoid?,A: No.,"[1, 2, 3]"
Q: Did he -- did he get better?,A: Yes. He became a editor of a newspaper.,"[1, 2, 3]"
Q: Underground newspaper?,A: No.,"[1, 2, 3]"
"Q: I mean, after the war.",A: Afterwards. After the war.,"[1, 2, 3]"
"Q: After the war, okay. So tell me a little bit about your daily life in Novaky.","A: When the -- when those soldiers came in, they came of -- say about 200 -- I reallydon't know how many came over there. The camp was divided into three[indecipherable]. Okay, and there was barbed wire, like -- like a camp. I lived on thethird one, the third, on top. And there were over there, barracks for families. I was inthe barracks for families because I came in with my mother. And then were thebarracks for young men, separated. And the joke was I never went into the barrack. Ididn't -- I wasn't interested to go into the barrack with all the guys. And one day, in The following transcript is the result of a recorded interview. The recording is the primary source document, not this transcript. It has not been checked for spelling nor verified for accuracy. This document should not be quoted or used without first checking it against the interview.The interview is part of the United States Holocaust Memorial Museum's collection of oral testimonies. Information about access and usage rights can be found in the catalog record.49Interview with Alice TyrolerMay 8, 2013camp, there was a -- for some reason they built a swimming pool in camp. I think thereason for it was, what they did in Theresienstadt, to -- when somebody comes in,some Red Cross or something, they show them how good they treat the people. Idon't know. That was my interpretation, I don't know. And over there, I was a gre --I was a very good swimmer, so -- so we swam over there. And one day I heard -- itwas on the -- I think it was on a Su-Sunday. Was after work, we were there, and Iheard they had brought Gizzy(ph) Fleischman in there, okay? So I got up in thebathing suit with just like a robe, and I went after her to see if I can help her, becauseI knew she's in trouble, because they -- they held her separate in a prison.","[1, 2, 3]"
Q: And -- okay. How -- who was Gizzy(ph) shl -- Fleischman?,"A: Gizzy(ph) Fleischman was the aunt of my brother's best friend, who lived tilabout two years ago, in Australia.","[1, 2, 3]"
"Q: Okay. And how was she well-known, how was she famous?","A: She was very, very active in, as you saw, in that c-camp, in the underground.","[1, 2, 3]"
Q: Okay. Do you know what her -- role she played?,A: No. People didn't talk. And I was too young. I was a [indecipherable] but shewas already about 40 years old or something.,"[1, 2, 3]"
"Q: So did you go, and did you find her?","A: Yes, I found her. I found her and I -- they let me in, the guard, because she wasbeing interrogated, and she was in a separate room held.The following transcript is the result of a recorded interview. The recording is the primary source document, not this transcript. It has not been checked for spelling nor verified for accuracy. This document should not be quoted or used without first checking it against the interview.The interview is part of the United States Holocaust Memorial Museum's collection of oral testimonies. Information about access and usage rights can be found in the catalog record.50Interview with Alice TyrolerMay 8, 2013","[1, 2, 3]"
Q: Okay.,"A: She was not in the barracks with the other people, because she was too important.And I made her --I met her, she was very happy to see me. And then I said, I see youtomorrow, and find out where you are and what's going on, and see you -- theydidn't let me stay very long. But she was being treated normally, I mean, not -- andthen two days later, she was gone. She was taken to Auschwitz. And this way, at thetime when I went down, somebody else walked next to me, a big guy. It was myfuture husband -- became my future husband. We met over there because he came inwith his military, and his sister was married to a man -- next to Novaky, next to thecamp, was a city. There was a --","[1, 2, 3]"
Q: What was the city?,A: Prievita(ph).,"[1, 2, 3]"
Q: Prievita(ph).,"A: Prievita(ph), yeah. There was a liquor and marmalade factory, and he was thedirector there. The factory belonged to a Jewish family, they were calledHymar(ph), and my later brother-in-law, they were called Grott(ph). He was able topay the guard off, my --","[1, 2, 3]"
"Q: This Mr. Grott(ph), was he Gentile?",A: No-,"[1, 2, 3]"
Q: He was Jewish?,A: -- was a Jew.,"[1, 2, 3]"
Q: Okay.,"A: The Hymars(ph) were Jew, too.","[1, 2, 3]"
Q: Okay.,A: They were also Jewish.,"[1, 2, 3]"
Q: But how was he able to stay and be director of that marmalade factory?,A: They let them stay for a while.,"[1, 2, 3]"
Q: Okay.,A: Because they exported.,"[1, 2, 3]"
Q: I see.,"A: They let them stay. I don't know what the deal was over there where it was, butthey were there. Wasn't official any more, but he was there. He was not officially thedirector any more, but he was. And he was there visiting because his sister was incamp with two boys. Her two boys were three and six years old. We brought them in1968 here, because my sister-in-law took them into the home after, because thesetwo boys, the mother with the two boys were caught and taken to be shot. But theydid not shoot the boys, because the peasant who -- there was one woman peasant,there were two little boys, nice looking, good little boys, with the mother, and theywere going to shoot them three. And the peasant begged the German soldier, give methe boys, I don't have any children. So they told her, take them.The following transcript is the result of a recorded interview. The recording is the primary source document, not this transcript. It has not been checked for spelling nor verified for accuracy. This document should not be quoted or used without first checking it against the interview.The interview is part of the United States Holocaust Memorial Museum's collection of oral testimonies. Information about access and usage rights can be found in the catalog record.52Interview with Alice TyrolerMay 8, 2013","[1, 2, 3]"
Q: Like kittens.,"A: Yeah, take them. Shot the mother in front of the kids.","[1, 2, 3]"
Q: Oh my God.,"A: The six year old remembered, the three year old doesn't. So, now, are we finishedwith Novaky, or you want to hear more?","[1, 2, 3]"
"Q: Oh no, I-- I want to know a little bit more.",A: Okay.,"[1, 2, 3]"
Q: I want to know --,"A: Okay, I worked in two or three places. I worked in -- there we made -- we madethe backpacks for the military, and then I worked in the kitchen a little bit. The moreyou worked, the less you were -- the more they let you stay, okay. So, I wasn't veryscared, I -- because I was young and stupid, so [indecipherable]. So I stayed there inthe barracks, had a lot of good friends, and started to go out with this man I met onthe way to the pool.","[1, 2, 3]"
Q: So this man who followed you to --,"A: He didn't follow me, he went on the same street, on the same road.","[1, 2, 3]"
"Q: Ah, okay, so when you went to see Gizzy(ph) shle -- Fleischman, it was by","A: By coincidence, and he went to his -- to the bra -- to the sister of my futurebrother-in-law.The following transcript is the result of a recorded interview. The recording is the primary source document, not this transcript. It has not been checked for spelling nor verified for accuracy. This document should not be quoted or used without first checking it against the interview.The interview is part of the United States Holocaust Memorial Museum's collection of oral testimonies. Information about access and usage rights can be found in the catalog record.53Interview with Alice TyrolerMay 8, 2013","[1, 2, 3]"
Q: Got it. The one who was shot --,A: Yeah.,"[1, 2, 3]"
Q: -- eventually.,A: Yeah.,"[1, 2, 3]"
"Q: Yeah, okay. And so you started to date him.","A: We started to date, yeah --","[1, 2, 3]"
Q: And what is his na --,A: --as much as we could.,"[1, 2, 3]"
"Q: Of course, in the -- in the middle of Novaky.","A: In the middle of Novaky, yeah.","[1, 2, 3]"
Q: What was his name?,A: Paul.,"[1, 2, 3]"
Q: Last name?,A: Tyroler.,"[1, 2, 3]"
Q: Tyroler.,"A: Tyroler, yeah.","[1, 2, 3]"
Q: Yeah. And where was he from?,"A: He was from Rutke(ph), from Slovakia.","[1, 2, 3]"
Q: Okay.,"A: Yeah.The following transcript is the result of a recorded interview. The recording is the primary source document, not this transcript. It has not been checked for spelling nor verified for accuracy. This document should not be quoted or used without first checking it against the interview.The interview is part of the United States Holocaust Memorial Museum's collection of oral testimonies. Information about access and usage rights can be found in the catalog record.54Interview with Alice TyrolerMay 8, 2013","[1, 2, 3]"
Q: And what about him --,A: He was very --,"[1, 2, 3]"
Q: What --,"A: He was very -- he was in Hashomer Hatzair, that was a Jewish organ -- also aJewish organization, it was more the free -- free thinking --","[1, 2, 3]"
Q: What about him appealed to you?,"A: I don't know. I don't know. I was 16, he was 21. I don't know.","[1, 2, 3]"
"Q: But you know, it is unusual that a romance would start sp -- you know, to grow in","A: Oh, what do you mean? What do you think, they didn't have boyfriends, orsomething?","[1, 2, 3]"
"Q: Well, tell me about that.","A: I don't know. We started to -- he used to come -- he -- he lived on the first objekt,he used to come after work sometimes. And because his brother-in-law had -- theywere called the guardista(ph) th-the Hlinka guarde --","[1, 2, 3]"
Q: Okay.,"A: -- that was the -- the group of -- of people who supervised the camp, it was the --","[1, 2, 3]"
"Q: Mm-hm, got it, okay.","A:--no---I don't know, it's actually -- what you would call them -- they were calledHlinkova garda. Hlinka was a big anti-Semite, and of course, very glad to kill the The following transcript is the result of a recorded interview. The recording is the primary source document, not this transcript. It has not been checked for spelling nor verified for accuracy. This document should not be quoted or used without first checking it against the interview.The interview is part of the United States Holocaust Memorial Museum's collection of oral testimonies. Information about access and usage rights can be found in the catalog record.55Interview with Alice TyrolerMay 8, 2013Jews. Because my brother in -- future brother-in-law had connection with the guards,he gave them money, or whatever --","[1, 2, 3]"
Q: Right.,"A: -- they let him come visit his sister, you know.","[1, 2, 3]"
Q: Okay.,"A: They were still official legal outside at this time. And -- what did I want to say?That came very -- came very good later on when the camp was -- when the uprisingcame. But over there in camp, it was nothing special. Nobody s -- nobody starved todeath from hunger. It was a difficult life, we worked very hard, and --","[1, 2, 3]"
"Q: Were -- I mean, but were there many selections to Auschwitz?",A: Not any more.,"[1, 2, 3]"
Q: Was it a filtration?,"A: Not any more after I came. Yeah, they stopped it.","[1, 2, 3]"
Q: So it became a work camp?,A: Forced labor camp.,"[1, 2, 3]"
"Q: Forced labor camp, okay.",A: With lots of -- with lots of old people and children and whole families.,"[1, 2, 3]"
Q: Okay. [break],A: I sound even worse now.,"[1, 2, 3]"
"Q: So, you were saying about Paul -- The following transcript is the result of a recorded interview. The recording is the primary source document, not this transcript. It has not been checked for spelling nor verified for accuracy. This document should not be quoted or used without first checking it against the interview.",A: Yeah.,"[1, 2, 3]"
"Q: -- about your -- he wasn't your husband then, but -- but --",A: A friend.,"[1, 2, 3]"
Q: Pardon -- your friend.,A: Yeah.,"[1, 2, 3]"
Q: That he was able to pay off a guard.,"A: He -- no. He -- there was a doctor, the doctor of the camp, was Dr. Schpera(ph).He was a friend of my later brother-in-law.","[1, 2, 3]"
Q: Okay.,"A: You know, with the [indecipherable] family. So he was able to [indecipherable]and my f--","[1, 2, 3]"
"Q: I'm going to test a little bit more -- [break] Q: This is a continuation of the interview with Mrs. Alice Tyroler, on May 8"",",A: Paul.,"[1, 2, 3]"
"Q: Paul. There was a doctor, you were saying, in Novaky --","A: No, there was a doctor in camp. His name was Dr. Schpera(ph). He was a localdoctor, and when the camp was established, they, of course, made him the doctorover there. We did not have much medication, the joke was, it was iodine andaspirin, that you went to buy.","[1, 2, 3]"
Q: Okay.,A: Because they didn't give us much medication. And he went out every day on thebicycle --,"[1, 2, 3]"
Q: Okay.,"A: -- to -- with the prescription, and whatever they needed, and came back. Besidesthey brought back the BBC news, every day, to the right place.","[1, 2, 3]"
Q: So the camp was rather well informed.,"A: Very well informed, yes.","[1, 2, 3]"
"Q: How many inmates were there, let's say at its height?",A: I don't know.,"[1, 2, 3]"
Q: Do you know approximately how many it had?,A: Must be a couple of thousand. I can find out for you.,"[1, 2, 3]"
"Q: Okay, it's not a -- okay, that's fine. And what were you -- you mentioned earlier","A: We ro -- made knapsacks and they made all kinds of things. They made clothing,they made men's shirts. Was many [indecipherable]","[1, 2, 3]"
Q: Okay.,A: Yeah.,"[1, 2, 3]"
Q: Okay.,"A: So I, when I finished with my work, with one shift of that, I went to the shirtmanufacturing department and folded them.","[1, 2, 3]"
Q: I see.,A: I was good at folding shirts.,"[1, 2, 3]"
"Q: Were there many fatalities, or ca-- in Novaky?","A: No, not too many.","[1, 2, 3]"
"Q: Okay. And how did the guards treat the prisoners, or the inmates, however you",A: No problem.,"[1, 2, 3]"
Q: No problem?,"A: They didn't give us problems, no. We lived -- I mean, we behaved properly, andone thing that I remember, one of the girls who was ill, was there alone, about myage. She cracked up and she got hysterical, and --","[1, 2, 3]"
Q: And what happened?,A: They took her out. Probably --,"[1, 2, 3]"
"Q: So, in that kind of atmosphere, where, compared to other places, other enclosed","A: It's a-- was -- yeah, was one of the easiest ones.","[1, 2, 3]"
"Q: But then, how do you explain that your future brother-in-law's sister is shot in",A: She wasn't in there. That was after -- after we -- the -- that happened after --,"[1, 2, 3]"
Q: After what?,A: After the whole -- the camp ended at some time.,"[1, 2, 3]"
"Q: Oh, I see.","A: Yeah, sure.","[1, 2, 3]"
Q: I see.,A: That was already in the mountains.,"[1, 2, 3]"
Q: I see. So how long were you in Novaky?,"A: Iwas in Novaky from -- I think it was July, or -- July -- I think it was July, I'm notsure, deg42.The following transcript is the result of a recorded interview. The recording is the primary source document, not this transcript. It has not been checked for spelling nor verified for accuracy. This document should not be quoted or used without first checking it against the interview.The interview is part of the United States Holocaust Memorial Museum's collection of oral testimonies. Information about access and usage rights can be found in the catalog record.60Interview with Alice TyrolerMay 8, 2013","[1, 2, 3]"
Q: Okay.,A: To August 44.,"[1, 2, 3]"
Q: Over two years.,A: Yeah.,"[1, 2, 3]"
Q: Had you any news about what was going on with your own family at that time?,A: No.,"[1, 2, 3]"
Q: Okay.,"A: Absolutely not, no. Then the -- what was I going to say? Okay, so we werealready at that, and BBC news came in, and then in 44, in August ""44, there was theuprising of the partisans in Slovakia.","[1, 2, 3]"
Q: This would have been the communist partisans.,A: Excuse me?,"[1, 2, 3]"
Q: The communist backed partisans.,"A: I think so, yeah.","[1, 2, 3]"
Q: Yeah.,"A: But internationally, we had Fr-French, we had Russian, we had all kinds ofpartisans.","[1, 2, 3]"
Q: Yeah.,"A: This time, they came and they worked on [indecipherable] and about 200 youngmen went out to stop the Germans -- to stop the German tanks, so not too many came The following transcript is the result of a recorded interview. The recording is the primary source document, not this transcript. It has not been checked for spelling nor verified for accuracy. This document should not be quoted or used without first checking it against the interview.The interview is part of the United States Holocaust Memorial Museum's collection of oral testimonies. Information about access and usage rights can be found in the catalog record.61Interview with Alice TyrolerMay 8, 2013back. And I think they knew that, but that's what happened. And what we had, myfuture brother-in-law, from this factory --","[1, 2, 3]"
Q: Yes.,"A: -- had access to trucks, and he gave -- he lent two trucks to the partisan -- to thegroup over there.","[1, 2, 3]"
Q: Right.,"A: They were mostly people who were in the camp. Very few partisans, they didn'tstay there, they brought it in, and disappeared. And we loaded the trucks withchildren, and older people, and my friend Paul and I went on -- on -- on a truck, onthe top, with -- with guns, and there was a -- full of kids and older people. And wetook them to Banska Bystrica, which was a place where --","[1, 2, 3]"
Q: Right.,A: -- have you heard the name?,"[1, 2, 3]"
Q: Yes.,"A: Okay. There was -- still free -- there were partisans, they were in charge at thistime. We brought them there, and they took care of them there. And they wereshooting [indecipherable] away, so everybody jumped up and down, you know,every time they came over a plane --","[1, 2, 3]"
Q: Yeah.,"A: -- it took down as many people as we can, and in -- that was in the city, next to thehighway like those --","[1, 2, 3]"
Q: Sort of the --,A: -- big holes.,"[1, 2, 3]"
Q: Yeah. Sort of trenches that --,A: Tren --,"[1, 2, 3]"
Q: Yeah.,"A: Trenches, yes. And they -- they were hiding there, and -- and the plane didn't seepeople [indecipherable]. And one time, the last time when I was on there, I hadenough, I didn't go down, I stayed on, and the -- came down, flew over me. I sawhim, he saw me and he didn't shoot. German pilot.","[1, 2, 3]"
Q: And you were right there in his target?,"A: I was right there, yeah. So he was a decent guy.","[1, 2, 3]"
"Q: But yet, he was shooting other times? Or was it other planes?",A: I don't know.,"[1, 2, 3]"
Q: You don't know --,A: Who knows?,"[1, 2, 3]"
"Q: -- you don't know, yeah.","A: Who knows, something flies over you.","[1, 2, 3]"
"Q: Yeah, yeah.","A: He didn't shoot me. So then we went into Banska Bystrica, the family of Poles had friends there, so we went with them in -- they had a house there, so we stayed with them, and they took me along, because when we came out of the camp, we picked up Paul's whole family.","[1, 2, 3]"
"Q: So you, more or less, was it like you broke out of that camp --",A: No.,"[1, 2, 3]"
Q: -- or had the Hlinka guards disappeared? How did --,"A: Yeah, they -- they -- they opened it when the partisans came in with the weapons, they opened the camp.","[1, 2, 3]"
Q: I see.,A: Everybody could go wherever he could.,"[1, 2, 3]"
"Q: Okay, okay. So they were losing the war?",A: They were not lo -- didn't last long.,"[1, 2, 3]"
"Q: Oh, okay.","A: Didn't last very long. So we were in Banska Bystrica for -- for a while, and one day there was a air raid, and Paul's sister was going to try to serve tea, you know, like to the group of men sitting there. And it was dark, so she went instead of the steps up, she went to -- the wrong way. Flew down the st -- flew down the flight of stairs, broke the collarbone and the shoulder, but had a -- May, June, July, au -- three and a half months old baby. So I-- I started taking care of the baby. Luckily, she was nursing. That's all she could do. Put her in the sling -- The following transcript is the result of a recorded interview. The recording is the primary source document, not this transcript. It has not been checked for spelling nor verified for accuracy. This document should not be quoted or used without first checking it against the interview.The interview is part of the United States Holocaust Memorial Museum's collection of oral testimonies. Information about access and usage rights can be found in the catalog record.64Interview with Alice TyrolerMay 8, 2013","[1, 2, 3]"
Q: And hold her.,"A: Put her in a sling and it grew back. No doctor, nothing. Then we went from there, wetried to go in the mountains, if somebody let us in or not -- I have also somewhere in mypapers, and I might find it. When I find the papers, I'Il let you know.","[1, 2, 3]"
Q: Okay.,A: Okay?,"[1, 2, 3]"
Q: Okay.,"A: There was a school principal in the village. This is all in the mountains. And hehad the -- he took us in for a couple of days, until we found something else. He tookus in in the -- behind in the [indecipherable] same school, the room behind the wall,he had two very badly injured partisans, French partisans, whom he saved the life,yes. Was a nine year old boy who had a s -- her -- his son. And he went for food andthen the -- yeah, and got quiet, didn't say anything, because he knew. There werenine year old kids, non-Jews.","[1, 2, 3]"
Q: Yeah.,"A: One time I remember I went with Paul to look for another place, to anothervillage. And as we walked up the hill, there were two guards with -- with guns. Andthe question was [speaks German] Germans.","[1, 2, 3]"
Q: Yeah.,"A: Soldiers. And of course we couldn't understand. We're not allowed to, I mean.We did not know [indecipherable] we knew. So just [indecipherable]","[1, 2, 3]"
Q: Can I ask a question at this point? Would you say that you th -- I don't know how,A: Bluntly.,"[1, 2, 3]"
Q: Did you look pa -- did you look particularly Jewish?,A: Me?,"[1, 2, 3]"
"Q: Yes, and Paul.",A: Paul not at all.,"[1, 2, 3]"
Q: Okay.,A: Paul was reddish blonde --,"[1, 2, 3]"
Q: Okay.,"A: -- six foot tall, and perfectly Slovak.","[1, 2, 3]"
Q: So he could pass.,"A: He went for -- then we went to one overnight to a -- to a peasant, to anotherfamily, and they let us stay overnight. And all of a sudden we heard shooting, andthere was father and daughter. But [indecipherable] and the neighbors came runningand said, did you hear the shooting? And a peasant to -- said, don't worry about that,they only shoot Jews, they don't shoot our people. So they didn't know who wewere, we were just refugees.The following transcript is the result of a recorded interview. The recording is the primary source document, not this transcript. It has not been checked for spelling nor verified for accuracy. This document should not be quoted or used without first checking it against the interview.The interview is part of the United States Holocaust Memorial Museum's collection of oral testimonies. Information about access and usage rights can be found in the catalog record.66Interview with Alice TyrolerMay 8, 2013","[1, 2, 3]"
Q: Got it.,"A: Another little thing that maybe doesn't make sense to record, or something --","[1, 2, 3]"
"Q: No, it does make sense.","A: We had the baby carriage, with the little baby, four months old baby. And it wassnow, was in the winter. And I pushed the ba-baby carriage, because they couldn't --I mean, the --","[1, 2, 3]"
Q: Yeah.,"A: Came by a German car with an officer, very nice guy. He got out of the car, hesaid, [speaks German here] You know, because he saw I could hardly push. He gotback onto the truck and drove away.","[1, 2, 3]"
Q: You could probably use some gasoline he's -- is what he said.,"A: Yeah, but I-- I've --I said -- I was stupid, I didn't know. I probably spoke --","[1, 2, 3]"
Q: Right.,"A: --more civilized German than him, but --","[1, 2, 3]"
"Q: Yeah, of course.",A: But that wa --,"[1, 2, 3]"
Q: You don't give off that you do.,"A: No, I couldn't.","[1, 2, 3]"
