Question,Answer,topics
Q: Did you get sick in this place? Remember you told me earlier you got very sick when you went south?,"A: That's right. First of all, th -- someone caught something that registered very high temperatures. And she wa -- she was taken to the hospital. This was in a, quote, mud house, in a kibidka(ph). And they were taken to the hospital, which was several miles away, but you could get some assistance. And they -- the individual, after some time, came back and at that point, two other people and myself caught -- had the -- it was typhus, or something. Interview with Mira Zimmerman >> January 23, 2015","[1, 2, 3]"
Q: Ah.,"A: It was the rather serious problem, and anyway, the -- Mother suffered quite a bit.","[1, 2, 3]"
Q: Did she catch it?,"A: She -- she didn't -- she didn't have anything to -- to give me, or to -- to ca -- the food was bad, the medical attention was normal for that particular area, but we were already rather weak. We didn't have enough nourishment to -- I g -- at that hospital, they -- like heating was bad, there were windows that were broken.Mother was scared I would get pneumonia or something, and that would be the end. And she visited me. She had to work most of the time. So -- but I managed to get out.","[1, 2, 3]"
Q: So you -- you got better.,"A: After later on, Mother got it.","[1, 2, 3]"
Q: Really?,A: So now we had the same problem.,"[1, 2, 3]"
Q: Did -- was this in the area where the Polish military units were being formed?,"A: Well, it was in that general area. There was a push of units in the camps, going south. So the next one would be out of -- out of Russia, was the Caspian Sea, we were taken on the boat, we went -- ended up in Persia.","[1, 2, 3]"
Q: Do you remember anything about the journey?,A: Germans?,"[1, 2, 3]"
"Q: No, no, no, the -- the trip on the boat.","A: Oh, to the boat. Over there, I don't remember very much, at the time, but later on, in that particular area by Persian Gulf, I saw the submarine that was supposedly the remains of a German attack.","[1, 2, 3]"
Q: Oh really?,"A: There was a sudden warnings and re -- regarding -- warning of the danger, or -- to wear ja -- lifejackets, because the boat might be bombed, just like the -- the other.","[1, 2, 3]"
"Q: So you had to wear those lifejackets, mm-hm.",A: [indecipherable] sticking out from the water.,"[1, 2, 3]"
Q: How were you able to get on these transports?,A: Out of what?,"[1, 2, 3]"
"Q: How were you able to leave Russia, and the sov -- well, not Russia, but the Soviet Union? How are you able to leave there, because neither you nor your mother were military people.",A: Well --,"[1, 2, 3]"
Q: How were they -- how were you accepted to go?,"A: Well, that just -- that -- they -- they made arrangements, once the -- the people got to the southern point, they made arrangements to get to Persia, and then toInterview with Mira Zimmerman *!January 23, 2015some other Mediterranean -- near Mediterranean area -- points. Some of my friends, for instance, were in Libya, and --","[1, 2, 3]"
Q: Oh really? From Russia?,A: Yeah.,"[1, 2, 3]"
"Q: Directly from Russia, uh-huh. Or directly from the Soviet Union, I should say.","A: Well, directly from the Soviet Union.","[1, 2, 3]"
"Q: Do you remember much about that boat trip, besides the sa --",A: The what?,"[1, 2, 3]"
"Q: Do you remember anything else from the boat trip, besides the submarine?",A: Boat trip? Which boat trip you talking about?,"[1, 2, 3]"
Q: The one going from the so --,A: On the river? On the --,"[1, 2, 3]"
"Q: No, going from the Soviet Union to Persia.","A: Oh that. Well, I know that per -- prior to -- to getting to Persia, I had to walk a stretch of si--I don't know, two sa -- se-several miles, but I don't remember how much. But I remember it from the fact that my shoes were stolen. We had to walk on sand, and this was very hot sand. And I suffered something ou -- terrible. I would step a few steps and Mother had to put something on the ground so I could cool my feet.","[1, 2, 3]"
"Q: Oh dear. So it took a long time?Interview with Mira Zimmerman * January 23, 2015","A: Well, it took a long time.","[1, 2, 3]"
Q: The -- it seems that people were doing a lot of stealing. You --,A: Well --,"[1, 2, 3]"
Q: -- lost a lot of things.,"A: Well, yi -- they helped themselves as they, quote, saw fit.","[1, 2, 3]"
"Q: Yeah. You know, your doll was stolen, your shoes were stolen.","A: Well, I missed a family photograph that was stolen.","[1, 2, 3]"
"Q: And the family photograph that was stolen, oh my. Did your mother make friends with any people at all, on this journey out of the Soviet Union?","A: Well, my mother became a Red Cross nurse. She had -- that was a -- in Persia, and that helped us a little, but otherwise it was difficult. We didn't have very much. On our journey from this northern part to -- to southern territory in Russia, I -- | - [indecipherable] her job, but those places -- we had ... oh, I can't --","[1, 2, 3]"
Q: Excuse me?,"A: No. I was going to try and recall how Danuta's father and mother mer -- it was one of those col-colle-collective centers, it was forming th-the nad -- a new addition to -- to -- to the Russian's armies.","[1, 2, 3]"
"Q: The Russian, or the Polish army?","A: The Polish army, but the Russian directors are right there. Anyway, the Polish army. He was taking his unit for exercise, and I recognized him, that it was him, and --","[1, 2, 3]"
Q: How did you -- what was this person you're talking about?,"A: That's was the -- it was -- at -- anyway, he was just taking his unit for exercise there, and I recognize him and run up to him, and Mother, Mother, this is -- I forget [indecipherable] what he told me to call him. But we made friends one time, I was warming myself near some kind of a stove, and that's how we met.","[1, 2, 3]"
Q: And how --,A: And then --,"[1, 2, 3]"
Q: And how -- how -- did he come ri -- did this gentleman come up to you?,"A: No. The -- he -- this officer did not come up to me, but i-- sort of examined me, looked at me. See, later we found out he had two daughters who were my age, more or less. So that was very likely the connection. Anyway, he -- he -- once, I was trying to warm myself again, and the -- the stove [indecipherable] burner was cooling off. There was almost no heat. So I knew him, and I recognize him as he was marching with his unit. It was something I --","[1, 2, 3]"
Q: And was your mother there?,"A: -- l introduced them. And that's how they, quote, met, and the ye -- years later, her -- got to know each other a little better.ontactrefiranneGaushariarg a hither atrmedortabeattfiexaliaton Interview with Mira Zimmerman ~ January 23, 2015","[1, 2, 3]"
Q: What was his name?,"A: Well, Vavjinya(ph) Soletski(ph).","[1, 2, 3]"
"Q: How do I-- could you say that again, his name?","A: Lawrence Soletski(ph), Vavjinitz(ph) Soletski(ph).","[1, 2, 3]"
Q: Lawrence Soletski(ph)?,A: It's Danuta's father.,"[1, 2, 3]"
"Q: I see, so Danuta is your sister?",A: She is my sister on my mother's side.,"[1, 2, 3]"
"Q: I see. Okay, okay. And so, in other words, your mother's second husband, you introduced her to her second husband?","A: Yeah, yeah, wa -- that's was the unusual part of circumstances.","[1, 2, 3]"
Q: And that was still when you were in the Soviet Union?,A: That was in the Soviet Union with the -- with [indecipherable] being formed to po -- po -- Polish units for the -- I think it's the Fifth Army that -- that had the Polish forces.,"[1, 2, 3]"
Q: And then you didn't see -- and then you left for Persia? And after that you left for Persia?,"A: Well, they put us in buses, and some crazy drivers started driving crazy way on -- in the mount -- very mountainous area.","[1, 2, 3]"
"Q: Oh, you mean in Persia?Interview with Mira Zimmerman degdeg January 23, 2015","A: In Persia, yeah, the -- the -- the drivers smoked this -- some drug, whatever. And really, there were precipices right next -- next -- the straight wheel.","[1, 2, 3]"
Q: Oh my goodness.,"A: And you -- you would -- you would swear you'd fall through and it was sort of frightening, but --","[1, 2, 3]"
Q: But you'd been through a lot of frightening things.,"A: Well, my mother tried to, like all the other mothers tried to quiet the kids, by reassure them.","[1, 2, 3]"
"Q: And by this point, how old were you?",A: [indecipherable] I wouldn't be -- I would be about 11 -- 10?,"[1, 2, 3]"
Q: How long did you stay in Persia?,"A: I think we were there about two years, Teheran.","[1, 2, 3]"
Q: What was life like for you in Persia?,A: Hm?,"[1, 2, 3]"
Q: What was life like for you there?,A: We - there was no difference. We were refugee camp.,"[1, 2, 3]"
Q: Was it a --,"A: They dumped us here, then they dumped us somewhere else, and so on, so on.They did the best they could, maybe.","[1, 2, 3]"
Q: Was the food -- did you -- did you get enough food?,"A: Well, we had a reasonable amount of food, I suppose.","[1, 2, 3]"
"Q: And what about your mother, was she working?","A: Well, in Persia she started work as a nurse.","[1, 2, 3]"
Q: Okay. And --,"A: With the -- with that -- that camp hospital, whatever.","[1, 2, 3]"
Q: Did you -- what were the facilities like? Were they -- were they different than they had been in the Soviet Union? Were there places to take baths?,"A: I think they were something [indecipherable] we were in [indecipherable] tents and in -- in -- in [indecipherable] tents, and there were -- we were told th- those were stables that the Germans kept the horses in. This was now a rather hot season, in a hot country. Every noon or so, there was a sandstorm.","[1, 2, 3]"
Q: Every day?,"A: Almost every day, and it was so unusual for us, we couldn't breathe almost. We had to -- we went th-the clean sheets that we had and covered ourselves and just stayed under the wet sheets, until th-the -- the wa -- storm passed. Otherwise, you could hardly breathe.","[1, 2, 3]"
"Q: My goodness, what -- what a situation.","A: Yeah, well, we were there for some -- for few months, I don't know how long. But we were glad to move somewhere else. Anyway, that particular experience was a rather unusual. Interview with Mira Zimmerman "" January 23, 2015","[1, 2, 3]"
Q: So you didn't stay there for a very long time?,"A: No, I don't remember it would -- all together, maybe over a year, a year and a half.","[1, 2, 3]"
Q: Okay.,"A: But you have to keep in mind, all the time listening to me, rattling on some --","[1, 2, 3]"
Q: You're not rattling on.,"A: It-- it was a -- it was different, but Mother managed to get better at [indecipherable] assistance, because she was a nurse. And that made it that much better.","[1, 2, 3]"
"Q: And, did you go to school at any point?","A: Well, th-these camps always had provisions of some sort of school, and some sort of medical possible assistance. Those that had the relatives in the army had better sup -- better assistance.","[1, 2, 3]"
Q: I see.,"A: We didn't have any -- any assistance, so Mother was the only one that took care of that.","[1, 2, 3]"
Q: It's amazing -- it's amazing what she was able to do.,"A: Well, it was -- it was difficult.","[1, 2, 3]"
Q: Yeah. Did she ever cry? Did you ever see her cry?,"A: No. Well, I did, but it was in a totally different situation.Interview with Mira Zimmerman 8 January 23, 2015","[1, 2, 3]"
"Q: Okay, not in -- during these years?","A: No, no.","[1, 2, 3]"
Q: Okay. Did you ever cry during this time?,A: When the -- my feet were burning.,"[1, 2, 3]"
Q: Yeah.,A: Yeah.,"[1, 2, 3]"
Q: What about when you lost the doggie?,A: What?,"[1, 2, 3]"
"Q: When Figa ran away, did you cry then?",A: The what?,"[1, 2, 3]"
"Q: When Figa ran away, did you -- Figa, your little dog.","A: Oh, th -- when Figa ran away, well, I did cry then, yes. We were trying to get that little dog out, because it went -- jumped into the very deep sn -- rather deep snow [indecipherable] likely froze.","[1, 2, 3]"
Q: It sounds to me that you didn't have much of a childhood.,"A: Well, we're -- we are born, and we die. Some of it has many turns and twists, and some of it is smooth.","[1, 2, 3]"
"Q: That's true. And so you had a lot of turns and twists, early on.","A: Yeah.ontectnetonancedjusetneey for tarher biormatoerabouttfisestecion Interview with Mira Zimmerman ""deg January 23, 2015","[1, 2, 3]"
Q: What happened after Persia? After -- you said you were there in Persia for a couple of years.,"A: Yeah, about -- well, Mother and I were there, but the armies, th-the -- the Fifth Army went to Libya and Syria, and ended up in wa -- Egypt, and Italy. That's how the armies went. But those that had some sort of contact with the -- someone in the army, got like, some support. And those that didn't, well, they had to do -- were in like in--in a refugee, concentration camps. They had to put them to -- in the places where they can get to them, or assist them.","[1, 2, 3]"
Q: And did you say you -- you moved ca -- from one camp to another within Persia?,"A: Well, in Persia, I think, there were two camps that we were in.","[1, 2, 3]"
"Q: And then, how was it you -- I assume you left Persia at some point.","A: Well, th-they just took us south, keep on going south, from Persia to India. India --","[1, 2, 3]"
Q: Okay.,"A: -- to -- to England, and then over here.","[1, 2, 3]"
"Q: When you first went to Persia, it was probably in 1941 or two, something like that?","A: It would be -- Persia? Yeah, about that.ontectnetonancedjusetneey for tarher biormatoerabouttfisestecion Interview with Mira Zimmerman """" January 23, 2015","[1, 2, 3]"
"Q: Okay. And if you stayed there a few years, so that makes it about ""44. Where did the war end? Where were you when the war ended?","A: Well, when the war ended, exactly, I think we were in -- in India.","[1, 2, 3]"
"Q: You were in India. And how is that you were taken to India, why India?","A: They had open a -- they had one of th-those unused camps, and the build -- the accommodation was there, it just -- it -- it just -- the money had to be allotted to -- to feed us.","[1, 2, 3]"
Q: So was this a British camp?,"A: The -- the -- the -- the camps, the camps were -- this particular camp were -- Mother worked as a-- a--a---a--- what do you call -- not refu -- I'm looking for a word that I can't --","[1, 2, 3]"
Q: Yeah.,"A: Ref-- no, it's a refugee camp. I'll thi-think of it when I go.","[1, 2, 3]"
"Q: Of course, you always remember things once it's all -- everything's all done.",A: Orphanage.,"[1, 2, 3]"
Q: She worked at an orphanage.,"A: The camp was mostly orphanage children, all s -- s -- part -- part orphanage. In other words, they had only one parent.","[1, 2, 3]"
Q: Okay.,A: Or t-t -- they were missing two parents.,"[1, 2, 3]"
Q: I see.,"A: But moth -- Mother was working there, and there was -- the refugee camps, they were trying to run permanent settlements, whatever, where there was a school, there was a church, and th-that kind of thing.","[1, 2, 3]"
"Q: And was -- was it -- this run by Polish authorities, or British authorities?","A: Well, i-it was run by Polish authorities, but th-the -- they must -- the funds came --well, they came from the government that was on temporary jurisdiction.","[1, 2, 3]"
"Q: You mean, the Polish government in exile?",A: The what?,"[1, 2, 3]"
"Q: The funds came from the Polish government in exile? It doesn't matter. I was just trying to wonder, these facilities, who did they belong to?","A: Well, I think to the country that -- that they were in.","[1, 2, 3]"
"Q: So, if it was in Persia, it would belong to the Persians, if in India, it belonged to --","A: Well, I think so. I d--I don't think that ever came up --","[1, 2, 3]"
Q: Okay. Okay.,"A: --as a question, but th-they were used as refugee concentration camps.","[1, 2, 3]"
"Q: And tell me Mira, when you were in India, you said you went to school there, and there were churches to go to.Interview with Mira Zimmerman "" January 23, 2015",A: Yeah.,"[1, 2, 3]"
Q: So it sounds like a little bit of a more normal life.,"A: Well, i-it's a -- that's what -- what they tried.","[1, 2, 3]"
"Q: How long did you stay there, with your mother, in India?","A: Oh, India, I think were about four years.","[1, 2, 3]"
Q: That's a good long time. That's a -- what part of India were you in?,"A: Karachi to Bombay, along that part. A few places, but --","[1, 2, 3]"
Q: Okay.,"A: We had ver -- relatively little contact, or communication with the -- with the country itself, because we were simply the refugee [indecipherable]","[1, 2, 3]"
"Q: Yeah, yeah. And if you stayed there four years, that means that it was the late 1940s before you left, yes?","A: About that. We left after the India received its changeover, and the -- became not part of the English empire, but India.","[1, 2, 3]"
"Q: Ah, so when the India -- India became independent.","A: Independent, yeah.","[1, 2, 3]"
"Q: I see. And from there, where did you go?","A: Well, England. Mother and I went -- went to England to -- to -- then Danuta's father and my mother married, and we decided to try out American soil.","[1, 2, 3]"
"Q: And how old were you when you came to the ameri-- to the United States?Interview with Mira Zimmerman ""8 January 23, 2015","A: Well, I was college age.","[1, 2, 3]"
"Q: Already college age? So that meant you were -- like in the early 1950s, something like that?",A: Early 50s.,"[1, 2, 3]"
Q: Early 50s. And where was -- where was Danuta born? In Britain?,A: In Britain.,"[1, 2, 3]"
"Q: I see. Is there anything else, Mira, that I have not asked you, that you think is important for people to know, about your story?","A: There was an incident about the goats. After work Mother went to the edge of the camp, and cut down those young twigs that just sprout out leaves. And at that time she used to sing, she used to -- to tell me -- taught me -- well, I guess, the poem. I d--I don't remember the -- that -- the author, whatever, but anyway, we -- we were playing, the kids were playing hide and seek or something, and I -- I was with them. They started to go -- go on the loft. Well, going back to the problem what Mother was doing, making bundles of these twigs to feed the goat, it was po -- essential that you don't shake the -- the bundles, because the leaves would fall off, and the goats wouldn't get any food. So you had -- Mother make me be -- listen very carefully, and not a-allow, or t-talk to the kids, not to go and play on -- in the loft. Well, one time the kids made comments about this and that. Finally,Interview with Mira Zimmerman ""4 January 23, 2015one said, oh, to the ghost, that they -- that they heard noises, whatever, like finally one of them says -- says, oh, if we ta -- say a prayer, it will all right.","[1, 2, 3]"
"Q: Okay, so they thought that --","A: So we started saying a prayer, but the boy -- I don't know which prayer it was, but anyway, they started saying a prayer, and I was saying the same ti -- prayer, but I -- I was thinking so hard, how am I going to stop all those kids going up there. Finally, I decided not -- not to say a prayer.","[1, 2, 3]"
Q: Not to say one.,A: No ... not to say a prayer.,"[1, 2, 3]"
Q: Were you able to keep them from going upstairs to the loft?,"A: Well, he did ...","[1, 2, 3]"
"Q: So Mira, it's okay. Again, this is something you'll remember later. That often happens to people.","A: No. It's a-- A2: You were wor -- one or two words behind in the prayer, and they thought it was a ghost. Remember that part of it?","[1, 2, 3]"
"Q: So Mira, it's okay. Again, this is something you'll remember later. That often happens to people.","A: The what? A2: You were saying it, the prayer, one or two words behind, and they thought it was a ghost, remember?","[1, 2, 3]"
"Q: So Mira, it's okay. Again, this is something you'll remember later. That often happens to people.","A: Not that one, no.Interview with Mira Zimmerman degdeg January 23, 2015 A2: No?","[1, 2, 3]"
Q: That's okay.,A: No.,"[1, 2, 3]"
Q: It's okay. Is there anything else you'd like to add to what we've talked about?,"A: Well, I don't know, you've been very patient with me, but -- and this is a--a somewhat unfair trial for me.","[1, 2, 3]"
"Q: I can understand that, and I appreciate -- I know that it has taken a lot of strength and energy to talk about. Thank you. Thank you for doing it. I think what I'll do now, is that we'll conclude our interview, the United States Holocaust Memorial Museum interview with you, Mira. So this concludes it with Mira Zimmerman, on January 23"", 2015. Q: Okay. This is the United States Holocaust Memorial Museum interview with Danuta Soletski(ph) Urbikas, on January 23"", 2015. And Danuta, I want you to tell us a little bit about how you are related to Mira, and how you have come to know about her story. So.","A: So, Mira and I have the same mother. My mother met my father in that whole turmoil during World War II, after he was released from the prisoner of war camp, and she and Mira were released from -- well, they escaped actually, from the labor camp. And it was in Tatishchevo, near Saratov, where was the first Polish army camp that was being gathered from all the soldiers that had remained, that hadn't been murdered in the Soviet Union. So they met there briefly, and they actually met again later on in Jelibod(ph), which was in Uzbekistan, or I don't know, it's on the border, near Tashkins(ph). Tashkins(ph) was another area where the Polish army had gone, and this is maybe 1500 miles or more away from Tatishchevo, or near Saratov.","[1, 2, 3]"
"Q: Okay. So I would like to -- for us to trace. | mean, some of the things that I asked Mira, she didn't remember where she wa -- you know, what the towns were, and so on. And tell me, how is it that you know all of these places?","A: Well, my mother talked about these experiences the whole time I was growing up. And they were rather in disjointed sequence. So when I had my first child, sheontectnetonancedjusetneey for tarher biormatoerabouttfisestecion Interview with Mira Zimmerman *"" January 23, 2015 agreed to put it all in order, with the help of my father. And so we embarked on this project to get it in chronological order, and get the geography right, and the history. And I started writing a book about it. And I did lot of research, and you know, interviewed my parents, mostly my father, and also other historians who were aware of -- of this migration, this whole journey of these people that had been deported.","[1, 2, 3]"
"Q: Okay, so I'd like to start from -- from the beginning at least, but we'll run through it, okay?",A: Okay.,"[1, 2, 3]"
"Q: So, Mira was born in Grodno, and that was in what part of Poland?","A: That at the time was eastern Poland. Today it is Belarus, right on the border really, with Lithuania and -- and not too far from where the current border of Poland is.","[1, 2, 3]"
"Q: Okay. And from Grodno, do you know what deportation they were taken on?","A: The February 10"" one, yes, in 1940.","[1, 2, 3]"
Q: Okay. And where were they taken to?,"A: They were taken first to a camp at -- across the Urals, which would have been technically Siberia. And I'm trying to remember the -- one was Mikelinska(ph), do you remember that name? And the other one, I am drawing a blank.Interview with Mira Zimmerman ""8 January 23, 2015","[1, 2, 3]"
Q: Okay.,"A: But they were first there for maybe a few months, and this was in winter. And then they were taken back to another camp near Perm, which is of Molotov. And that was where they really were for the duration of the time in the -- in the labor camp.","[1, 2, 3]"
Q: So Perm was a pretty tough place.,A: Mm-hm.,"[1, 2, 3]"
"Q: The -- some of the stories that Mira shared with us today, are they ones that you are familiar with, that you had heard about before?","A: Oh yes, I grew up with these stories, you know, but -- you know, these were things that were discussed, especially at -- during holiday times, or whenever our Polish friends would come over, because many of them had very similar stories, and they would start to talk about all these things. Or just Sunday dinners, you know, this was something that was so large a part of their lives. Especially my mother. You know, my father talked about it, but my mother was very -- you know, she -- she wo -- she went through so much, you know?","[1, 2, 3]"
"Q: So, if I can repeat a little bit, just to make sure that I'm clear about, she had to work as a lumberjack?","A: Right. She was fairly tall for a Polish person, maybe not as tall as I am, but she was, you know, generally speaking, the -- the Soviets took people who wereontectnetonancedjusetneey for tarher biormatoerabouttfisestecion Interview with Mira Zimmerman degdeg January 23, 2015 working in the country to do the harder jobs, because they were honed better. And the people who were in the cities were doing lighter work. And as Mira was saying, there was no one else f-- to work for them. It was just my mother. And so they came and assessed that she was strong enough, or whatever, to work in the forest, and she would have to go and chop off huge branches of trees that they felled, and -- and yes, there was one occasion when she -- I don't know, you know, she was so tired by then, and -- and malnourished, and just, you know, devastated by the whole experience, because for her it was a constant worry about saving Mira, that she didn't end up in one of those Soviet orphanages. And -- and so this tree was falling on her, and she just kind of stood there, and you know, they -- and watched this tree coming towards her, and at the last second she jumped into like a pile of rubble, and the -- the branches from this rubble actually cut the --","[1, 2, 3]"
