Question,Answer,topics
Q: Heino.,A: But he changed it to Henry Power.,"[1, 2, 3]"
Q: To Henry Power. And do you remember when this was taken? You must have been like four or five years old?,"A: Yeah, six and three years there.","[1, 2, 3]"
"Q: Three years. So it would have been 1924 or ""25 or something?",A: Yeah. And then my brother is three years and eight months older than me.,"[1, 2, 3]"
Q: Isee. I see. So it was your father with his two children?,"A: He was a young man, yeah.","[1, 2, 3]"
Q: Very young man.,"A: My father was born in 1897, and my brother was born in 1919. 1919.","[1, 2, 3]"
Q: And then now we will see another photograph of your brother. That's you.,A: My father was 22 years old when his son was born.,"[1, 2, 3]"
"Q: He was a young man to become a father, yeah.",A: And my mother was 24. She is two years older. She was.,"[1, 2, 3]"
Q: And then there is your brother Heino?,A: Heino.,"[1, 2, 3]"
Q: Who became Henry?,A: But he never -- he -- we always in Germany called him Heinz.,"[1, 2, 3]"
"Q: Ah, I see.","A: He must be 17, 16, 17.","[1, 2, 3]"
"Q: Okay. Rolling? So this is your brother right here, and you said this is when he was in -- a young man?","A: Yeah, he must be 17.","[1, 2, 3]"
"Q: Isee. Can we now pan to this photograph? Can I move it or not? Let me turn it. Let me turn it. This one. It looks like -- tell me, who is in this photograph of the two men there?","A: Well, one is my father, I think. It say over there.","[1, 2, 3]"
Q: That's over here?,A: Icannot read.,"[1, 2, 3]"
Q: It says your father.,A: And one is his brother.,"[1, 2, 3]"
Q: His brother-in-law.,A: Yeah.,"[1, 2, 3]"
Q: Uh-huh. Okay.,A: Icannot read. These are my grandparents.,"[1, 2, 3]"
"Q: Oh, we will film them in a minute.",A: And here it says -- who is it? You can read the letter.,"[1, 2, 3]"
"Q: I think his brother, but I can't really -- okay. Are we done with that one? Okay. And then we will -- on this one, let's focus on that, right here, and this -- VIDEO OPERATOR: Hold on. Q: Okay.","A: Both men, I'm sorry that he -- Werner? WERNER PREUSS: What?","[1, 2, 3]"
"Q: I think his brother, but I can't really -- okay. Are we done with that one? Okay. And then we will -- on this one, let's focus on that, right here, and this -- VIDEO OPERATOR: Hold on. Q: Okay.",A: You could read it better.ontectnetonancedjusetneey for tarher biormatoerabouttfisestecion,"[1, 2, 3]"
"Q: Okay. Can you tell us who is in here? It sounds like -- it looks like your grandparents, yes? Don't move it, don't move it, don't move it. Just --","A: No, Werner has -- WERNER PREUSS: But where is the pictures when you were the children? Why you take these pictures? This isall from","[1, 2, 3]"
"Q: Okay. Can you tell us who is in here? It sounds like -- it looks like your grandparents, yes? Don't move it, don't move it, don't move it. Just --",A: Yeah.,"[1, 2, 3]"
"Q: But this is your father's mother and father, yes? Is this right? Do you have another -- hang on. Let's cut it, please. Q: Allright. So who is in that photo there?",A: Gittel(ph).,"[1, 2, 3]"
Q: Gittel(ph)?,"A: Yeah. And what was her name, Werner, her maiden name? I forgot it. I forgot at thismoment. s+. Gittel, Gittel --","[1, 2, 3]"
Q: Ozorof(ph) or something?,A: Yeah.,"[1, 2, 3]"
Q: Ozorof. And your grandfather's name was what?,A: Joel.,"[1, 2, 3]"
Q: Joel Popower?,A: Popower.,"[1, 2, 3]"
Q: Uh-huh. And you were named after her?,"A: No, they didn't accept that in Germany. It was not in Germany.","[1, 2, 3]"
"Q: Because it was Gittel, and rather than -- and so that's how you became Jutta?","A: Yeah. They said, ""Oh, you mean Jutta,"" and so all the people what went to give the name for the child for the first born said, ""Yes, Jutta,"" so I became Jutta.","[1, 2, 3]"
Q: Isee. Okay. Thank you.,A: You're welcome.,"[1, 2, 3]"
"Q: Allright. So now we will take some of -- Q: Allright. So what is this photo?WERNER PREUSS: This picture was taken in 1939 in a working camp in Germany. It was not a camp really. It was a farmer's town where all what you see you there, we had to work for the local farmers. Q: And this is outside Berlin? Q: Oh, so they -- horse farms?WERNER PREUSS: Yeah, yeah. Q: Horse farms. Q: Okay. And you are in here, too? Q: You're in the last row I see? Q: Yeah.","A: Newspaper.WERNER PREUSS: No, in the magazine which we got all the time forthe ___, and somebody from Israel called me and say he saw the one of his friends, and he was also in this camp, but he -- afterwards, he was sent to Auschwitz later where he met his wife and lives in Israel.","[1, 2, 3]"
