Question,Answer,topics
"Q: Good morning, Mr. Wos.",A: Good morning.,"[1, 2, 3]"
Q: You're going to let me call you Paul?,"A: Yes, please do.","[1, 2, 3]"
Q: Yes? Yes? Thank you very much for letting us come to your home this morning.,A: That's my pleasure.,"[1, 2, 3]"
Q: Tell me what your name was when you were born.,"A: I born Paul Pawel Xenon Wos. The last name Wos, W-o-s and apostrophe over S, Wos.","[1, 2, 3]"
"Q: Right. And your father's name was also Pawel, yes?","A: My father was Po -- Po -- Pawel, and my grand -- ma -- father was also Pawel. That's was little bit a problem home because if somebody call Pawel, we don't know which one. That's -- my family called me Xenon, that second name Xenon. In other words, I was known by family, by my friends, Xenon. In school I was Paul -- Pawel.","[1, 2, 3]"
"Q: And did they -- did they make the Xenon a nickname, Xenic?",A: Xenic.,"[1, 2, 3]"
Q: Yes?,"A: Xenon, that was short Xenic.","[1, 2, 3]"
Q: And when were you born?,"A: I born in Warsaw in 1920, and December 22""C/. And my parents put in my paper, January first, 1921. This way I go in one year later to military.","[1, 2, 3]"
Q: I see. That was very clever.,"A: Yeah, I know that's couple days and not make difference.","[1, 2, 3]"
Q: So let's talk a little bit about your family. I would like to get a sense of your mother and father and your brothers and sisters. Tell -- tell me about your fa --,"A: I born in a family where mother was ann -- name Anna from home Shahofska, and my father pa -- Pawel Wos. And I born in a family where was four children, I was the oldest one. And next one was my sister Irena, and third was my brother Odin and fourth, Wanda. That's whole family, two sister, one brother, and me. We bo -- I born in Warsaw, and I study in Warsaw and finish high school in Warsaw and up to 1939, where war starts, you know, that's start literally upside- down. And up to 1939, that's was Warsaw uprising, I was sent to concentration camp.","[1, 2, 3]"
Q: Right.,A: That's --,"[1, 2, 3]"
"Q: So n-now we're going to slow down a little bit. Tel -- tell me what you remember about your father, what kind of a person was he?","A: My father was like mostly fathers, the best father. And my father and my mother was also very good, caring mother, and was on -- Father was very soft up to some point, and my mother was very strict, and take care of her -- her children very hard and very tight. And so was very good mother, very good father, not only for us, for everybody. And this part of my life I can say only some good thing about my parents. And Father was very hardworking man, my mother, too.And we was raised in a house where was the order, and time where was dinner we were supposed to be on time, not one hour later. And during the -- a meal, we sit together, eat and later there's sometime discussion about what happened during the day, and what was good, what was no good, and we was very close family. And s -- that's about my [indecipherable] family. In ourfamily was also the very close sister of my mother, Sophia, and was not -- never married, and was very hardworking person, and still was very intelligent lady who like, you know, poetry, p -- opera, etcetera, etcetera. That's was some part of family where we was very many times with our si -- aunt in operas -- I know all operas for example in Warsaw, this was very nice place, very nice building, and that's was for us pleasure. And that's was close family.","[1, 2, 3]"
Q: And you liked opera?,"A: I like opera, I like opera.","[1, 2, 3]"
Q: Do you remember what your first opera was?,A: I think so. First -- I don't know this -- Aida -- I think so --,"[1, 2, 3]"
Q: Aida?,"A: -- for time -- Aida was for me very interesting part, special, the Verdi created, you know, this so nice voices, I like this.","[1, 2, 3]"
"Q: Did you also have a favorite opera that was Pagliacci, is that true?","A: Pagliacci? Yes, sure, I -- I was -- it's nice.","[1, 2, 3]"
Q: So how -- how old were you when your aunt took you? Were you a young kid?,"A: I was young kids because my aunt was -- her s -- or each year, four, five free ticket for the government people, for booths in opera, and normally was booths for four people, and I was kids, maybe 12 years old, 10 - 12 years old, I go like fifth one.","[1, 2, 3]"
Q: Aha.,"A: That's was a pleasure and a good tul -- the best location, and you know, the voices were [indecipherable] opera very good because international opera, and we remember this part very nicely.","[1, 2, 3]"
"Q: Wa -- when you describe your parents, your mother is the disciplinarian --",A: Yes.,"[1, 2, 3]"
Q: -- and you say your father was soft up to a certain point --,A: Up to a point.,"[1, 2, 3]"
Q: Wa -- explain what you mean.,"A: I mean this one, you know, you -- small thing my father not react, and our was very loving children, and dedicated to family. And if something was very, very bad, or somebody did something wrong to our family, was very active, very powerful, because he was tall man, almost six foot, and everybody like him. Mean th -- not on -- only family and other people has a very [indecipherable] for my father.","[1, 2, 3]"
"Q: Did you do things alone with your father, did you go for walks with your father?","A: Oh yes, sure --","[1, 2, 3]"
Q: Yes?,"A: -- we -- that's was a family affair. We live close to Vistula river, and each evening, if it's not important other thing to do, we go all together, walking maybe two miles close to Vistula river, we walk. And this time was very popular walking on this special sidewalk, white sidewalk near the Vistula river. Everybody go there, thousand people going one way, other way, and -- and we go all the time with her father and mother. And then my father [indecipherable] now we must be [indecipherable] we must walk. That's was something -- something important. And during Sunday for example, was very important for us, we go -- because we are Christian -- Catholic, we walk to mass during morning hours, Sunday. We must be dressed, clean dressed, and -- you know, and Father and Mother and four children, we walk to church. After the mass we go mostly to old town, what for us was very -- from historical point of view, and also architectural point of view, because my father has very good taste, and -- I mean not only for eating taste, and forseeing some ma -- structure, like buildings. Like for example dresses, or something thing and historical part, we go to [indecipherable] town and s -- we walk around and Father point out and this is this house, belong to these people, then the other people took some [indecipherable] museum and so and so. In other words, created for us something what we call good taste for everything. That's was my father, part. Mother, on other hand, was very close to my father and was one -- if I can say, one woman what I can point like the best loving wife on her -- her husband. That was my -- my mother. And was whole time doing everything what created better - - good feeling for family and good for character for us. That's was my mother, and I have very big respect for my mother on this part of the -- I was the oldest son, and I know many different situation and I know one thing. My mother was best, loving, trustful woman for my father.","[1, 2, 3]"
Q: So they were very much in love?,"A: Oh, very much. And my father was very handsome man, tall and very good manner that's we like. Was not a -- a high education man, and born with this feeling, everything must be good, perfect, and nice. Not bother the other people. That's my feeling about it.","[1, 2, 3]"
Q: And what did he do for a living?,"A: My -- I -- if I can answer you this, I must go back to moment where my father was during the World War, first, was prisoner of the war, and was working four years during the war, arrested by German, and was four years in camp, where was working 94 -- ni -- ni -- 19 -- 19 after Polish state, it was created. My father come back from the prison -- mean the farm prison, and come back to Warsaw, and start working aw -- eight -- for example, propa -- he was about 20 years old, working for state like Marines, on Vistula river, because during this time, if you has -- are 18 ye -- or -- year -- years old, you cannot create a good education, because was very tough during the sn -- Russian occupation. Russian occupation was everything against the education, not likein other part of this time -- a other part of the Poland, li-ike Austria, or Germany, was much easier to educate that -- himself. In Russian part was not so easy, and my father c-come back from the ne -- I call this prison, and start working, like I said before, for na -- state, and start educated himself. I remember I was maybe five years old, I remember good, to our house each days or two days, came some student from the Polytechnical Institute, and give the technical instruction, technical education for my father for a couple years. In other words, my father was self-educated man. And was probably good student, because resulted in his life was very, very successful. And later ther -- ni -- my father, last time 1913 -- 30's my father start small business, knitting mill. And very small, and start growing, growing. And this part is very tight connected with ji -- Jewish people, because this part of the trade was mostly maybe 60 percent in Poland was in -- in Jewish hand, Jewish trade. And from this point start the connection with a Jewish people who was located mostly in future ghetto, [indecipherable] and this part of the town and was, I can recall, businessman.","[1, 2, 3]"
"Q: Right, right.",A: Small end businessman.,"[1, 2, 3]"
Q: Businessman.,"A: And 1930 -- 39 start, you know, war, and my father was more connected with Jewish people and special night before the w-war -- before the war -- ghetto uprising, because you know, we have two ghettos -- two uprising. Ghetto uprising and later the -- one year later, 1944 was Warsaw uprising where all nation and all Warsaw start fighting with the German, and that's was place where, you know, we lost --","[1, 2, 3]"
"Q: Right, right.","A: -- quarter million people, you know, there, also. That's my father trade.","[1, 2, 3]"
Q: Yeah.,"A: Now, what do you like to know more?","[1, 2, 3]"
Q: Did you work with him when you got a little bit older?,A: Not -- later there --,"[1, 2, 3]"
Q: Later.,A: -- and later there from 1942 --,"[1, 2, 3]"
Q: Uh-huh.,"A: -- | was working with my father because up to the ""42, I was working for -- because in my school, high school, you mu -- before the war, you must know the other language. You not receive the gymnasium approval, in other words, diploma if you know other language -- if you don't know other language, you are not pass.","[1, 2, 3]"
Q: Uh-huh.,"A: In other words, in my house, my sister was take the French. My brother, sister and me, the youngest sister, we took the German.","[1, 2, 3]"
Q: Uh-huh.,"A: And each in our house speak -- my father speak Polish, German and Russian, and we speak Polish and German, and my do -- sister Irena speak fluently --","[1, 2, 3]"
Q: French.,A: -- French.,"[1, 2, 3]"
Q: Uh-huh.,A: That's was the requirements.,"[1, 2, 3]"
Q: Right.,"A: What we have not in this -- the United States, I am scared because my children learned the French and now if you like ask for some French --","[1, 2, 3]"
Q: It doesn't work.,A: Not now.,"[1, 2, 3]"
Q: Not any --,A: Anyway.,"[1, 2, 3]"
Q: Right. Did you get along with your brothers and sisters?,A: Yes.,"[1, 2, 3]"
"Q: You're the eldest, and --","A: I was the oldest, I see -- have not s-special problem with my youngest br-brother and sister and so during the time -- my lifetime, I was maybe -- my sister is eight years older -- younger like me. In other words, I raise, almost, the girl, and because this I have maybe more sympathy for my youngest system -- sister. And we call all the time the [indecipherable] meaning young chil -- child in family. And it was favor for my mother, because -- and father, too, because was young.","[1, 2, 3]"
Q: Right. Did you like school?,A: School?,"[1, 2, 3]"
"Q: Yeah, did you like it?",A: Why not?,"[1, 2, 3]"
Q: Yeah. A lot of kids --,A: This way you know -- you know a little bit more.,"[1, 2, 3]"
Q: Right.,"A: Educated, sure.","[1, 2, 3]"
"Q: What was your favorite subject? Did you have one -- when you were young, when you were -",A: 1 -- su -- favorite subject? That's was geography.,"[1, 2, 3]"
"Q: Geography, yeah.","A: Geography was the best, history and geography. And still I never use this line I like only my - - is not favor, only professional way, was technical. I was future in -- I finish polytechnical -- [indecipherable] Polytechnical Institute in Warsaw University. And that's was for money, for [indecipherable]. And history and geography was my hard part of the subject.","[1, 2, 3]"
"Q: Yeah, right.","A: And that's -- we was travel all over the world, after we educated our children, who are the best children in the world, and especially in America, where raise the children was very, very hard.","[1, 2, 3]"
Q: Uh-huh.,A: And we were suc -- successful and thank to God we have good children.,"[1, 2, 3]"
Q: Right.,"A: One boy, one girl.","[1, 2, 3]"
Q: You like sports --,A: Oh yes.,"[1, 2, 3]"
"Q: -- very much, yes?",A: Maybe too much.,"[1, 2, 3]"
Q: Maybe too much? Why?,"A: Maybe too much, because you know the di-different story, this time, 1930 -- 1930 -- up to deg39, there, if you are good sportman, you can die because you have nothing to eat. You not even make -- not make money.","[1, 2, 3]"
Q: Right.,"A: Here in America, that's -- for sportsman is good place. If you are good sportsman, you can have better life. For example, in academic time I was, up to the 18 years old, I [indecipherable] up to the 1939 war, I was in academic team playing the basketball, and I was short. And I was good shooter, and was sometime too much I -- my father was very upset because I not learn what I supposed to do, and I spent more time for sport. And so I understand this, and so [indecipherable] everything was straight now, and also my sports part [indecipherable] I like and I was playing all the time my life, up to 75 years old before -- after a -- up to the operation, my heart operation, I play tennis, and I like very much. And also [indecipherable] subjects -- subject was I was in team where we are -- academic team where we [indecipherable] you know, eight people and for example, I was f -- on the [indecipherable] in the first part. And that's was only two, three years, because that war and [indecipherable] so --","[1, 2, 3]"
"Q: Right, right. Tell me something. Was -- was th -- was there in your house a certain kind of political consciousness as you grew up, in your discussions around the table?","A: Yes, oh yes, we -- we was all the time a very political family. Why? Because my parents grow and grandparents grow in atmosphere where we was -- where the people like free Poland.[indecipherable] Poland was divided by three parts German, Austrian and Russia, and was fighting and was simpatic for freedom of the Poland. In other words, this part, my parents bring to our house. My parents discuss all time political part. And to you political mean we was very tight to our history, to our freedom, and my parents was very like, have the right freedom forPoland, and that's we was discuss we move. In our house was all the time two or sometime three newspaper, different point of view. And sh -- we know -- try have the opinion, the right level opinion, not only one side.","[1, 2, 3]"
Q: Mm-hm.,"A: And we never be anti-Polish, for example, and we never was on the left or the right side take the position. And we raised this way and we was good Polish citizen.","[1, 2, 3]"
"Q: You have said that when your father went into his business, you began to have more of an association with Jewish people --",A: Yes.,"[1, 2, 3]"
"Q: -- or at least your father did. When you were going to school, were there Jewish kids in the school as well as Polish Catholic kids, or --","A: You see -- yes, I have couple -- ne -- not many, because you see, we was not too rich people.","[1, 2, 3]"
"Q: We have to stop the tape now, we're going to change the tape. Q: I -- Lasked you -- I'm going to go back to a couple of things, but the last question I asked you was about your association with Jewish kids when you were in school, in -- in elementary school, and high school. Were there Jewish kids in the high school, or did -- or --","A: In elementary school, yes. Only was two in this area, was not a Jewish area --","[1, 2, 3]"
Q: Uh-huh.,"A: -- because you know in Warsaw, a part -- the Jewish Warsaw located mostly in one part of the Warsaw. The north part na -- close to Narlefki and this area. And where I live, I live close to Vistula river, was not many Jew, and s -- Jewish people, and still was two young guy who was up to twa -- 14 years old, we was together in school, and you know, was very nice guy, on -- poor, and still was [indecipherable] this young people go to Palestine. And up to si -- 14 years old, this fellow has education, and later they both are interest in go to Palestine and be some carpenter or some mechanical something like this. And that's was stop my connection with the Jewish young person. And still sa -- we was invited to later there, I maybe mentioned to Melamid family, where was on Bar Mitzvah and etcetera. That's connection family who is jewi - - our family with Jewish family in the same branch, the same business, the same trade. And during the high school time, was not many Jews, mostly it was like Catholic and the Protestant, not Jewish young people. In other words, this time, up to ""39, in school was not close connection to young Jewish people. On the m-mem -- part of my family, from 1930 to 19 thir -- near ""42 - deg44, na -- we was connected very closely to couple family, Jewish family in the Warsaw ghetto. And special after 1939, the -- some family from Wilno moved to Warsaw, a Jewish family wo -- who moved to Warsaw, and name call Epstein, and we was close, and very important for us this time, we na -- was family name Melamid. Was three kids, and two g -- brothers and a girl, and a Melamid family and grand family of Melamid was Birnbaum. And he was very close, and still was a business connection and my father was couple times -- was very -- like I said before, he's ver -- was very nice, honest man, and was call for some arrangement, some discussion, not only discussion, it was business people, but be Catholic and Jewish. And to wa --","[1, 2, 3]"
"Q: A problem, you mean? Some si --","A: A problem, some --","[1, 2, 3]"
Q: -- problems?,A: Right.,"[1, 2, 3]"
Q: Uh-huh.,"A: And before go to the court, these people created some -- honest people from one side and other side, and dissolved the problem, in other words, straightened the problem. My father was called like the judge. In other words, Jewish people try -- know Father was honest and Catholic was thinking my father was honest person. That's was our connection. And --","[1, 2, 3]"
"Q: And was this in the 30's, before the ghet --","A: No, this was -- 30's - 30's.","[1, 2, 3]"
Q: In the 30's.,"A: Now the 19 -- from 1939, that's was little bit different situation because start created ghetto concentration camps in Poland.","[1, 2, 3]"
Q: Right.,"A: And for example, the concentration camp, very important thing. In Poland was, before the war, three and a half m-million Jewish people. The biggest concentration in Poland -- in Europe.Mean was for Jewish people, was some chance better like in Germany or France. And German know this after the war, and before too, the big concentration Jewish people in Poland, that's,from my point of view, was created and yet -- and German created so many concentration camps in Poland. One of the important concentration camp was Auschwitz. The Auschwitz was built first couple weeks after a war was [indecipherable] 1939, and first prisoner was not Jewish people, was Catholic people. And which one Catholic people? All professors from university. All the lawyers, engineers, and clergy was sent first to concentration camp, Auschwitz. That's first there was only Polish people was there, and was not directly kill, only hard labor created the deaths. 1941 start Jewish people there, and start the death camp. Concentration camp that's the one part, people dying because was overwork. And death camp, was sent there and killed.","[1, 2, 3]"
Q: Right.,"A: That's was the different and this must be straight, because I was in concentration camp, not in Auschwitz, only in Flossenbiirg, that's was political prison during -- before the war ""39, where Hitler put all opponents, own party, to concentration camp. Many German people was there, that's was political prison. And that's my own concentration camp.","[1, 2, 3]"
"Q: Right, right.",A: But we talk later about it.,"[1, 2, 3]"
"Q: Later we'll talk about that. Let -- let's -- let's go -- go ahead, I don't want to interrupt you, go ahead.","A: Ah yes, you ask me I -- I have many f -- I have not very close friend, and I -- Jewish people this time before -- during school, because in a class was 40 people, 50, and was two Jewish people, you know. And was living in different place, like we -- and we not have close connection. And still we seem the same, Polish citizen, has the same right like we Catholic, Protestant or Muslim, because was couple Muslim too.","[1, 2, 3]"
Q: Right.,"A: We have the same -- and I feel this -- I was raise in the same feeling, who because you must know and I am sure you know, the Polish Constitution was the second in the world after American Constitution, and it is the same Constitution, freedom from everyth -- everybody.","[1, 2, 3]"
"Q: Did -- wh-when you were growing up in Poland as a kid, before the war, did you experience people expressing anti-Semitism? Did you -- did you understand that there was a difference?",A: You know si -- you know si -- this is big word.,"[1, 2, 3]"
"Q: Yes, I understand.","A: A big word, a big question.","[1, 2, 3]"
Q: Yeah.,"A: I live -- I born there, and my race is this time there. And the feeling was not anti-Semitic so much -- some people, yes. Like the J-Jewish people has m-more educated in this time -- part -- part, not all, because if we talking about the Jewish, we must divide -- and the problem is, we must divide between -- up to bucar -- Vistula river west, and Vistula river east. Vistula river west was not big su -- problem. West -- excuse me, east, was mostly people very sympatic to Communist regime. Socialist Communist regime. On the west part of the Poland, I mean, from the Vistula river, was little differ -- different and was from German idea anti-Semitic, and was not catch all of nation. Was only ma -- some small part. On east Poland was very big, torrential Communist ideology. And I lose my --","[1, 2, 3]"
"Q: Well, I think what I -- what I was asking you is, given th -- when -- when people live separately, and in many societies they do this, yes?",A: Right.,"[1, 2, 3]"
Q: So that children are often raised to think --,"A: Oh, excuse me, that's I -- I not feel --","[1, 2, 3]"
"Q: Yes, okay.","A: -- now you remind me. Mostly was a economical problem. And that's -- if we call this anti- Semitism, that's wrong. That's was economical. Jewish people was hardworking, s-stood close together and was the same token, more successful. And Po -- Polish people, specially on -- on the east, was more lazy, like all the Russian this time. Not produce so much, not educated so much.And start the different between Jewish more educated and -- and born on the east part of the Poland, more lazy and more -- not created. So -- and that's was all time the different economical.Not only anti-Semitic -- I understand, because you are Jewish, you are no good. You are a Polish -- Polish, you are good -- you are good. And question is, economical -- the answer is economical base. That's if somebody called the anti-Semitism, that's not right. I not feel this way. Was some people was, from the point of view. This is -- Jewish mean this fellow is different like we are, because the fellow has [indecipherable] the fellow has the factory, the fellow working hard. And ss -- that's not ss -- for me it's not ss -- right. What I understand before the war, that's was only different on eco -- economical base, not religion.","[1, 2, 3]"
Q: So you don't think that there was some kind of difference based on the fact that Jews believed differently than Catholics or Protestants?,"A: No, I don't think so, I don't think so. I -- Ia -- race, you know, but to different people -- in my class, for example, was many -- not many, couple, Protestants. Nobody never talk about [indecipherable] feel this way, I feel other way. Generally speaking, like I said before, this was economical base in Poland.","[1, 2, 3]"
"Q: Okay, so let me ask you something. When Hitler comes to power in 1933 --",A: Yes?,"[1, 2, 3]"
"Q: -- between ""33 and ""39, before the war --",A: Yeah.,"[1, 2, 3]"
"Q: -- there is a rise of Fascism, or the right in Poland as well. Am -- am I not correct? There was","A: Before the war, was -- for me was not so popular start argument and fighting with the Jewish people, it was not popular. Some part of student in university created some, we are against the Jews who are educated in our university, because Jewish are 10 percent of the population, and in our class are 40 percent the Jewish people, educated by state. That's economical [indecipherable]. And all some student who said Jewish in our class supposed to be 10 percent, not 40 percent. And now you can call how you like, Anti-Semitist, or economical [indecipherable]. You see, that's the very big question.","[1, 2, 3]"
"Q: Do you think that the numerous clauses that was put into effect, the numerous clauses, which didn't allow as many Jewish students as before was a function of economics?",A: Economical --,"[1, 2, 3]"
