Question,Answer,topics
Q: Uh-huh.,"A: -- because some poor guys -- as -- very smart, cannot go to university because there was already, for example, 40 percent Jewish people. And this guy was [indecipherable] not me? Why I cannot go there? You see, that's the story. You must look both ways. And still I have very big respect for -- this time, for Jewish parents, try and pay for education own children. That's I mention [indecipherable] we must look after Jewish people. And take the sample, educate it own people. And this time, in Poland, many people not think this way. And Jewish people was ahead, educated own children. That's the very important.","[1, 2, 3]"
Q: So let me ask you something. So when you're -- when Hitler comes to power in Germany --,A: Yes?,"[1, 2, 3]"
"Q: -- were you very conscious of what's going on, is it --",A: Oh sure.,"[1, 2, 3]"
"Q: -- is -- did the papers have a lot of stuff, it's --",A: We -- we look all a moment --,"[1, 2, 3]"
Q: Yes.,"A: -- Hitler, and we were so upset. Why did friends, or British not do something?","[1, 2, 3]"
Q: Right.,"A: And Hitler grow, and you know, expend -- that's was our -- na -- is interesting. We look -- I said before, two, three newspaper daily.","[1, 2, 3]"
Q: Right.,"A: And we know, and each as -- from us, especially young people like me was thinking, we supposed to be the people who are honest, and people who are fair for everybody. He -- old people thinking, no, we are looking a little bit for right side. I was more liberal, after 1 grow up and I know a little bit more, I was little bit more towards center. And Hitler was created, you know, the situation, people start talking about the Jewish problem, and it's a -- etcetera. And not many people supported this idea, what I know.","[1, 2, 3]"
Q: Min-hm. Right.,"A: Some crazy guy at left or right, that's was not my idea. I try balance in my life opinion. And still Hitler did the worst part what happened to Jewish people, Polish people and other people who was lost life in concentration camp and death camp. That's what happened right now, and I not see in the newspaper in America right now mention how many people die, how they this or this. And now the German raise like big nation and -- and are successful, and our people in America, in Poland, are depress. That's my feeling. That's my [indecipherable]","[1, 2, 3]"
"Q: When di -- you talked about eating meals with y -- the whole family. Did you eat breakfast, lunch and dinner with the family? All three meals?",A: Yes.,"[1, 2, 3]"
Q: All three meals?,A: Yes.,"[1, 2, 3]"
Q: So is it --,"A: No, we would -- in Poland was differently to [indecipherable]","[1, 2, 3]"
Q: Mm-hm.,"A: Eight -- seven o'clock was breakfast very quick, very quick, and we go to school, and ni -- later there we come back, three o'clock, and five o'clock was dinner. And during dinnertime, everybody was supposed to be near table. That's -- we -- with my wife, doing the same way. Our children was raised the same time. During the meals, we sup -- special evening, six or five o'clock, we supposed to be together and we eat and we discuss and we change our opinion.That's very important thing, because this way father know what the children think, children know what father think. And they -- some idea, you know, left, right, was created, because I heard the other person opinion. That's was very -- and was and is important for family connection.","[1, 2, 3]"
Q: Right. And did people in your family have different viewpoints?,A: Oh sure di --,"[1, 2, 3]"
Q: Yes?,"A: -- absolutely, absolutely, specially my daughter, all time.","[1, 2, 3]"
"Q: No, I meant -- I don't mean your daughter, I don't mean -- I didn't mean after the war. I mean in -- in the 30's, when you are a little bit older --","A: Yes, yes.","[1, 2, 3]"
Q: -- and you can understand more.,"A: Yes, we was raise this way, everybody has own opinion.","[1, 2, 3]"
Q: Mm-hm.,"A: And own opinion, mostly the young people has na -- opinion little bit, now how I can say?Little bit left.","[1, 2, 3]"
Q: Mmn-hm.,"A: Liberal. Old people are going through whole life and see what happened, and said no, the true is in the middle. And you know, that's was -- later there we also go to m-middle you know, and we think that's the right way.","[1, 2, 3]"
Q: Mm-hm.,"A: You must think about the other fellows, other opinion, other idea, and that's way we was raised.","[1, 2, 3]"
Q: And were you afraid of war? Did your family think --,"A: Oh everybody -- everybody are afraid to war, if somebody know what mean the war.","[1, 2, 3]"
Q: But were you specifically afraid that Germany would attack Poland? Did your parents talk about this or not?,"A: No, afraid you sa -- afraid, that's one thing. If you are young people s-soldiers -- soldier, I was in this time soldier, you are all time afraid, because you know German was equipped with better i -- equipment, better trained and so and so, and Poland was less equipped. And so [indecipherable] knows. And that's war. And specially if you talking about the war, really not war, from east after the agreement between Hitler and Stalin, and take France and start -- give our back knife in the other back, that's different story and start [indecipherable] there, and KGBand so and so. You see, that's -- that's terror. War, that's one thing. Terror, that's little bit different.","[1, 2, 3]"
Q: Mm-hm.,"A: You know, and we have experienced worse, from the east big political terror, and from the west big advance equipped army. And we were s -- Poland was between these two big --","[1, 2, 3]"
Q: Mm-hm.,A: -- parties.,"[1, 2, 3]"
Q: Right.,"A: And wer -- personally, if you ask me what is good, better, German or the Soviet, I -- I put equal.","[1, 2, 3]"
Q: Mm-hm.,"A: One and the other one kill own people like Stalin 20 millions, and this part kill our people.","[1, 2, 3]"
"Q: Uh-huh, right.","A: That's -- that's -- we will look from this pint -- part [indecipherable]. Well, anyway, maybe --","[1, 2, 3]"
"Q: Okay, you finished high school in May of 1939?","A: In 1939 May, and I was drafted to -- I was 18 years old, I was drafted to -- that's was the popular situation. After you finish high school, you have diploma, you must work -- you must go to army for free, not for pay, for free for two years.","[1, 2, 3]"
Q: And that's every boy?,"A: Every boy, every boy.","[1, 2, 3]"
Q: And the girls had no obligation?,"A: Girl, last two years was something -- prepare for military like we did. And the [indecipherable] during the high school's time, two years we have -- we call [speaks Polishhere], prepare for the army duty. And we know how operate, you know, the guns [indecipherable] during the -- the war, if [indecipherable] and that's what 18 -- 16 to 18 years old the gir -- gir -- boy did.","[1, 2, 3]"
"Q: And was that during this regular school hours, or there -- was that after school?","A: No, no, during --","[1, 2, 3]"
Q: It was part of the school?,"A: Right. Only one time weekly. One time week, on Wednesday.","[1, 2, 3]"
Q: So what did -- what did you learn? You learned how to use a gun?,"A: Like you use the gun, organization di -- in the army, and equipment and so on and so on. And later, if you finished and graduated from high school, you have gymnasium diploma. You must know the other language and you must go through the [speaks Polish here] to military. And these people was already like me, sent to mili -- ni -- to military unit where we -- for we prepare the -- our border with Germany, 1939, for three months, for free. Later there, after three months, we was automatically -- supposed to automatically be sent to one year military school for future officer, army officer, like West Point, you see, and only West Point is more graduated, you know, that's like half West Point education, something. That's not the same [indecipherable].And 1939 I was after do -- received the -- a diploma, I was sent to a unit where we fortified our border and after three months we supposed to be transferred to a military school, and start war.17 September, the Soviets invade Poland, and I was in a unit where we relocated there. And 20 -- pe -- probably two, three days after the Soviet invade in Poland, we was ma -- surrounded by army -- Soviet army tanks, and after small shooting, we supposed to surrender. Our officers was on one side, the other people -- soldier on other side. And officer sent later there to concentration camp, and death camp to [indecipherable] 15,000 of Polish officer was killed, you know. And Iwas lucky, because I -- first night we was in barrack, were -- we were supposed to be selected later then I give my watch and 20 zloty and during night six people escape. We was not count, yet.","[1, 2, 3]"
Q: Right.,"A: And we was [indecipherable] if we not do now, we da -- later they"" Il be to -- too late. And --","[1, 2, 3]"
"Q: I'm going to have to stop you, we have to change the tape.",A: All right.,"[1, 2, 3]"
"Q: So we'll continue this story when we come back. Q: You -- you talked about being captured by the Soviets, yes?",A: Right.,"[1, 2, 3]"
"Q: And then, y-you didn't know, of course, what happened to the officers. Did yo -- did you --","A: I know was separate from us, and was --","[1, 2, 3]"
Q: But you didn't know then what they were going to do.,"A: Oh no, no.","[1, 2, 3]"
Q: No.,"A: That's -- that's was later, half year later.","[1, 2, 3]"
Q: Yeah.,"A: After half year, the -- you know, Stalin --","[1, 2, 3]"
Q: Right.,"A: Beria, and other Communist leader sign death for these people who was created Polish army.","[1, 2, 3]"
Q: Right.,"A: You see, what happened, if you look to history back, 1920, the Soviet army go west and try connect ru -- Soviet army with German -- six million German Communists. And Poland was on the way. And this time, Polish army -- voluntary army, stop the big, big army Soviet in -- near the Warsaw. And Stalin was the politruck there in his front, Polish's front and remember the so big army was stop by very small army not organize, voluntary army. And the Soviet must go back. And Stalin remember this, in own books mention, never forgot Poland stop invade S- Soviet [indecipherable] through the Germany. And that's the reason was created the Katyn and the all intelligentsia, all officer, all top generals was killed in Katyn, because Stalin remember what these people did for S-Soviet Communist invasion in the Germany, etcetera.","[1, 2, 3]"
"Q: Now in -- w-when they captured you, and they separated the -- the officers, how many of you were they -- were you, kids who were not officers?",A: No.,"[1, 2, 3]"
Q: You were all 18 year old and 19 year old --,A: 19 years old.,"[1, 2, 3]"
Q: -- you just graduated. So how many of you? A few hundred?,"A: Oh, that's was couple company --","[1, 2, 3]"
Q: Couple -- uh-huh.,"A: -- you know, a couple company was --","[1, 2, 3]"
Q: So it was pretty big.,"A: Yeah, yeah. That's -- it was a -- and between us was maybe 2000 people --","[1, 2, 3]"
Q: Uh-huh.,"A: -- you know, that's -- that's something. I-In this part where I was capture, was less, because the company was spread.","[1, 2, 3]"
Q: Uh-huh.,A: And I don't know what happened with the other. And -- was couple hundred people.,"[1, 2, 3]"
Q: Right.,A: You know.,"[1, 2, 3]"
Q: And what made you decide to bribe the germa -- the --,"A: Because I -- before -- because I read three newspaper, I know what mean the Communist who are -- Communist in the book is very nice. Practically bur -- talking, the east part, this is Asian people, and all time talking differently, doing differently, and you never know what happen.","[1, 2, 3]"
Q: So where did you --,A: That's 800 miles -- kilometer.,"[1, 2, 3]"
Q: 800 kilometers. So you walked at night --,A: Right.,"[1, 2, 3]"
"Q: And you slept during the day, but where did you sleep, did you hide, did you do something?","A: We try e -- this area was some people who are Polish citizen and the same token not only Polish citizen, was Polish characters. In other words, if we knock down -- knock to the door, and we -- the people see we are in uniform, give us sleep, give us something to eat, was not much, and -- little bit. And give us address where we supposed to go --","[1, 2, 3]"
Q: I see.,"A: -- and meet other guy help us. That's was the reason we were very slow from September to end of de -- December, we walk 700 kilometers by foot. And before we cross borderline on the river Bug, some big river, we was waiting when we can cross there, because there was German and here was the bol -- the Soviet. And we was almost two weeks waiting on the -- close to the river Bug, and we was working for farmers. Farmers this time was -- Polish farmer pick up the potato. And we pick up the potato, and I never did this job. I was terrible had, because you know, was very hard to do this, all the time in this position.","[1, 2, 3]"
Q: Right.,"A: And stay there. We work there two weeks, and one day the farmer [indecipherable] says eat, and money and -- that's the Polish farmer. And we crossed the river Bug. Couple days we was waiting, maybe we cross today, in water up to knee.","[1, 2, 3]"
"Q: So you -- you walked across the river, up to your knee it was?","A: Yes, w-water was up to knee, and we must pick up the time, the fellow on the other side, the German, not shoot us.","[1, 2, 3]"
Q: Yeah.,"A: Well anyway, after two -- December -- during December, before the Christmas, we -- I reach Warsaw and see the house was destroyed, partially destroyed, and we start terrible life during the oc -- German occupation.","[1, 2, 3]"
"Q: Right. Let me -- let me ask you something. As you're -- as you're walking, obviously once you get into Poland, and the part that the Germans had, was there a lot of destruction that you saw, all over?","A: Oh yeah, y -- all over the section. Not like was after the war --","[1, 2, 3]"
"Q: After the war, yeah, yeah, right.","A: -- not the war's destruction. And you see that, for me was very different feeling. I saw Polish army because I was there. I was Soviet army who was very poor equipped. And a-after I cross the river, I saw the German army, what was equipped very good, and the people are, you know, good looking in the uniform, because German put all the money not in the bread, and not in the butter, only put every -- on many -- every penny to military. And that's was first my shock. Three army, three different situation. And later where I saw third army, American army, that --","[1, 2, 3]"
"Q: When you saw the Germans, you know, seeing how well equipped they were --",A: Very equ --,"[1, 2, 3]"
Q: -- did that make you very nervous?,A: Oh su -- no --,"[1, 2, 3]"
Q: Bec -- because it --,"A: -- that's was ans -- I receive the answer. We -- like, Poland cannot win the war with army like that one. After I walked and I saw first the German army. That's was different feeling. Was a very powerful army. Later there you know, France, Poland --","[1, 2, 3]"
Q: Right.,A: -- fight longer --,"[1, 2, 3]"
Q: Right.,"A: -- like France and the [indecipherable] and you know, give everything. That's -- I ha -- I have nothing respect for French army, absolutely. Is very big zero. [indecipherable] Maginot, you were no good to us. Equip millions, millions dollars, and g -- was giving for nothing. Not fight. And Poland has not a line of Maginot or something like this, and fight. And right now we have something else. Well, anyway --","[1, 2, 3]"
"Q: Were -- were you very pessimistic when you came back to Warsaw? You si -- your family was okay, you came and you saw that the f --","A: Yes, maybe --","[1, 2, 3]"
Q: -- your family was all right.,A: -- young fellow --,"[1, 2, 3]"
Q: Yes.,A: -- all the time is homesick.,"[1, 2, 3]"
Q: Yeah.,"A: Right? You are army, first time out of the family, you thinking all the time about family. You know, I saw there, and you know was not other way. I cannot go in other place, I must stay with family in Warsaw. Sure I was upset and I know. This time maybe we know so much what kind German can do for your nation. Later then it was, you know, shooting. After two, three weeks, I was on the Warsaw street, each day was some execution you know, and people say a different execution, a loud talk [polish] polska, free -- freedom for Poland. That's -- you know what the German did? Put the gypsum in your mouth before you were shot. Not voice [indecipherable]","[1, 2, 3]"
Q: They cut?,"A: No, they put i-in your mouth before execution --","[1, 2, 3]"
Q: Yeah.,A: -- put in your mouth gypsum.,"[1, 2, 3]"
Q: Is that tape?,"A: Tape, and pu --","[1, 2, 3]"
Q: Tape to cover the mouth?,A: Only you breathe by nose.,"[1, 2, 3]"
Q: Mm-hm.,"A: And you cannot talk, you cannot shout, you know, th -- do something with. And was shot.And thousand people each month was shot on the street, [indecipherable] t-terror. And who was the people shot? Not poor people only. 90 percent was the people from the list, top education people. That's -- right now Poland lost so much educated people, and [indecipherable] Hitler the same, Stalin did the same. And you know, if you cut your head, mean the hand won't work. And the in -- intelligentsia, educated people are like the head.","[1, 2, 3]"
Q: Mm-hm.,"A: That's -- people know it, Soviet and German.","[1, 2, 3]"
"Q: Did you see any of these killings, did you --",A: Oh yes.,"[1, 2, 3]"
Q: You did.,A: Oh.,"[1, 2, 3]"
"Q: As a youngster? Wh-When you came back, during this first period.","A: Right, there was not one, not 10. Many. One I mention what I remember to -- right now.Close to Father"" factory, I -- snow, maybe two inches snow a-and raining [indecipherable] snow.","[1, 2, 3]"
Q: It was raining snow?,"A: Yeah. For example, and I cross the corner and I turn. And on the -- below the -- my foot was something like rubber. I say, what happened? And because snow covered this, after I go there, I saw the blood. And you know what was the pieces of the bl -- how you call it?","[1, 2, 3]"
Q: Flesh?,"A: Flesh was there. And on the side of the building was [indecipherable]. Maybe a half hour or maybe one hour before, was execution there. And you walk over the flesh of the people. And it was very popular, very popular. If one German was killed by pola -- Polish people, right away hundred other Polish people was killed, next couple hours. And the list was in Gestapo prison, in Gestapo, and after sa -- happened something like this German was killed, from the list put on the big board, this and this and this was killed because one German was killed. And mostly was intelligent -- intellige -- educated people.","[1, 2, 3]"
"Q: Paul, what did that do to you when you turned the corner and you stepped and you realized you were --","A: No, the German was gone.","[1, 2, 3]"
"Q: No, no, I know that, but you're -- you're feeling --","A: No, it -- feeling -- feeling was --","[1, 2, 3]"
Q: Was it --,"A: -- different. Very, very upset, and heart starts beating because you'd never know was killed your father, brother or your friends, or you co -- can be killed next time there, you know. That's was terrible, you know, the feeling was -- you know how you can feel, if you know innocent people was killed.","[1, 2, 3]"
Q: Did you know anyone who was killed during that early period?,A: Not specially -- I know the names --,"[1, 2, 3]"
Q: Uh-huh.,A: -- because famous names. That's not [indecipherable],"[1, 2, 3]"
"Q: Yes, no, I meant -- I meant a personal --","A: No, I --","[1, 2, 3]"
Q: You didn't.,A: Inever know my friends was killed this way.,"[1, 2, 3]"
"Q: Right, yes.","A: I can tell you from my class, 1939 was over 40 people, and I was after war invite to Poland from here, and you know how many people come back? Six.","[1, 2, 3]"
"Q: Six. Wow. I -- you know, I forgot to ask you, when you went home and walked in and saw your parents, they had not any idea where you were for months.","A: No, you see --","[1, 2, 3]"
"Q: September, October, November, December, right?","A: -- no, no, no, no, no.","[1, 2, 3]"
Q: So they must have been --,"A: You see, and I feel all the time like [indecipherable] if we talk about concentration camp. My mother was I say, devote Christian Catholic.","[1, 2, 3]"
Q: Mm-hm.,"A: And my mother all time pray for -- in this time for me. And during the Warsaw -- the German invade pol -- Warsaw, my mother give the -- all the young special people, eat, cigarette, and something like this. Bew -- because was thinking, help these people, help maybe me some --","[1, 2, 3]"
Q: Sometime.,"A: -- some other people help me. The same happened during the concentration camp. We help 12 Jewish people from ghetto, and you know, our family was very dangerous situation because each corner gi -- you saw the German gendarmes ask you your paper. If you take Jewish people to the whole Warsaw from one end to other by rickshaw or by horse or carriage -- c-cartless -- cartless -","[1, 2, 3]"
Q: Carriage.,A: Carriage.,"[1, 2, 3]"
Q: Yes.,"A: You see that's was very danger. And if you s -- if you be catch by German, her -- Jewish was killed on the spot. People not recognize all the time maybe, maybe, maybe, may-maybe not. I tell you one, and he was lucky. We was put the six people in Swedish ambassadia like, you know, and six other people was gra -- put in the Hungarian ambassadi and we was lucky. And was not lucky, my sister, Irena, who we please, we ask Irena help this family son, because the parents was a good -- not friends only, good business people, and we respect this. And no [indecipherable] and these people suggest Mr. Wos, to my father, help us, our son. We don't care about us, we have no choice, we are in the ghetto, we go for -- probably we dying. Help us [indecipherable]. And we did this. Talking to a special -- not me, Father, to my sister Irena, who was very famous and very good person, who was a artist -- paint -- artist, or educa -- for personal education, not artist [indecipherable]. And this fellow said fine, I am alone, I can help this young fellow, and took him to the own apartment, was alone. And this fellow mostly lived behind the arma -- no, wa -- how you call the -- how do you put the clothes? Armar -- Armra --","[1, 2, 3]"
Q: Armoire?,A: Armoire.,"[1, 2, 3]"
Q: Armoire?,"A: Armoire. And you know, was everything come right up to this moment where Warsaw uprising start, 1944, and all the people must go out from the building, German took everything out and sent to concentration camp bu -- because this part of the -- was not -- not -- this was a -- a -- a German [indecipherable] in other words [indecipherable]. And after the fellow took the boys down, and on the -- place on the ground, the German -- this is the Jewish guy, because was no -- wa -- [indecipherable] because w-was not outside the house, and killed both this guy -- the child and this guy who help him. That's happen, you see. Not many people think about this, you know, and that's was one hour different can be in more safety place.","[1, 2, 3]"
Q: Right.,"A: Entrapment. And do you know how many people in Yad Vashem receive medal like I received for helping the Jew? Altogether is 14,000. And you know the Polish people are 40 -- over 40 percent.","[1, 2, 3]"
Q: Right.,"A: And not included, the people who, like Nance, who save many, many Jewish girl. Not included the priest who has also saved the boys. And mostly not included, the people who were shot, like my friend the artist. [indecipherable] is little bit different.","[1, 2, 3]"
Q: Right.,"A: And sometime people give the idea about the Polish anti-Semitism and something ma -- fine, no, maybe even was some, I'm sure was. Some crazy people in Poland was too. Only, please look on the other way. How many people try help, and the same time Jews, and the same time was on the spot because only in Poland was death sentence. If you can help Jewish people for any way, give the bread, give the money, give the sleeping quarter, that's -- you know, you must balance.","[1, 2, 3]"
Q: Right.,A: One hundred.,"[1, 2, 3]"
"Q: We have to stop the tape now. Q: When you came home from walking these f -- September, October, November, December, almost four months.",A: Right.,"[1, 2, 3]"
Q: Did your parents recognize you when you walked in the door?,"A: Oh yes, sure.","[1, 2, 3]"
Q: They did. What did you look like?,A: I [indecipherable] them crying.,"[1, 2, 3]"
"Q: Yeah, I imagine.","A: And was -- house was partly destroyed, you know, and in our house was couple other people who was evacuated from east, and my mother was, you know, very, very pleased see me because was thinking I never come back because this time Soviet army take many prisoner to the Siberia.And I was close to a Soviet border. And my pa -- parents know, from radio, from ever -- from the news, and was thinking maybe I was dead already in Siberia. Was thousand -- one and half million people was sent to Siberia. Polish citizen sent to Siberia. And not regular people. Mostly the people who owned something was under that position in the government or something like this. This was go first, and family was destroyed. Mother was -- she can go one way, and the Father on the other way, or go to [indecipherable] or Katyn and killed. And people like my parents read the newspaper and you know, heard of the people who are the Soviet doing there.And moment I walked to my house and nobody know I am living -- still live or not. You know, was very big surprise. And you know, Mother, like all mothers, you know, ma -- has 10 children and still each one is the most important.","[1, 2, 3]"
Q: Were you dirty when you came in the house?,"A: Oh, dirty, hungry, almost without the boots. 700 kilometer, walking. That's -- that's the --","[1, 2, 3]"
