Question,Answer
Q: Okay.,"A: -- because it was so annoying. But I'm sure there were other things where shetried to prepare me, you know, to be a --"
Q: Sure.,"A: -- a little bit independent, or on my own, or, you know, eat with very goodmanners, or you know, whatever."
"Q: It must have been very hard for her, you know, a little girl, a li-- you know,","A: For my parents it had to be unbearable, and I really understood that when I hadchildren of my own. When I had a four year old and I thought, how did they dothis? But they w -- they didn't know that they had a good chance of coming to theStates. They wanted us to live."
Q: Yeah.,"A: You know, however. But I -- it had to be unbearable for them. My mother hassaid that she divided her life by, you know, the benchmark moment of when shesent her children away, before and after."
Q: Really?,A: Well --
Q: Yeah.,"A: -- what could be more memorable than that?The following transcript is the result of a recorded interview. The recording is the primary source document, not this transcript. It has not been checked for spelling nor verified for accuracy. This document should not be quoted or used without first checking it against the interview.The interview is part of the United States Holocaust Memorial Museum's collection of oral testimonies. Information about access and usage rights can be found in the catalog record.27Interview with Erika TamarDecember 18, 2015"
"Q: Well, truly. I mean, truly, it is -- it is-- yeah, yeah.",A: Conditions in Vienna na -- again not -- this is not personal knowledge --
Q: Okay.,"A: --at all, this is something that my parents told me, because my mother iscertainly a storyteller. From the time that Hitler came into power, every borderimaginable closed. And I'm really angry when I read that, you know, the Jewsdidn't want to leave their jobs, they -- none of this is true. They wanted to leave,there was no place to go. Every border closed. The American consul made it asdifficult as could be. My father was a practicing physician, a graduate of theUniversity of Vienna. When he applied for American visa, or whatever, theyinsisted they needed his elementary school records from Poland."
Q: No kidding.,A: Ye--I-it's like --
Q: No kidding.,"A: -- things to delay, to stall, to make it more difficult. Also, when he we -- came totalk to the American consul -- for a European this was insulting beyond belief,maybe not for an American -- he, the consul sat there with his feet u-up on the desk,and for a European man, that -- you know, that's the epitome of rudeness. Therewere very, very few places that took Jews. The Polish quota for the United States The following transcript is the result of a recorded interview. The recording is the primary source document, not this transcript. It has not been checked for spelling nor verified for accuracy. This document should not be quoted or used without first checking it against the interview.The interview is part of the United States Holocaust Memorial Museum's collection of oral testimonies. Information about access and usage rights can be found in the catalog record.28Interview with Erika TamarDecember 18, 2015was horrible, though my father signed up as early as he could. Trujillo was, youknow, considered a horrible dictator, but the Dominican Republic took as manyrefugees as they possibly could. Maybe with self-interest, feeling they were ed --getting educated people, or you know, who knows what. At the time that my fatherwas trying to get in United States, the only place open to us was Haiti."
Q: No kidding.,"A: And he hesitated because at that point he felt that his number was getting close,and he thought, what future would we have in Haiti, I -- you know, h-he took a hugerisk. Maybe we would have all been better off going to Haiti as a family. But yes,my parents prepared me as well as they could. They tried to make it, you know, likea very positive, like I'm going to leave this bare place and go to this wonderfulplace. I do remember that there was an air raid in Vienna with, you know, sirens, ablackout, and I said -- this I really remember, this I -- because I was so puzzled by it.I asked my father, are the bad men coming to bomb us? And my father said, ifanyone comes to bomb us, it's the good men. And I -- I had a real problem figuringthat out."
"Q: Yeah, exactly, because it's -- you know, there's a contradiction in logic.",A: Right. But it -- I--
Q: But there's logic.,A: Yeah.
Q: But it's the truth.,"A: Another way of preparing me in terms of -- my father had an original way oftalking to me sometimes, to try to make me understand what freedom meant."
Q: Okay.,"A: Like in United States we would be free. He said that freedom meant that I couldgo up to President Roosevelt, and call him a dummkopf, and nothing wouldhappen to me. And of course that stuck in my mind --"
Q: Yeah.,"A: -- because it was amazing to me that I could say something an adult -- of course,you know, I-"
Q: Of course.,"A: But it -- it was a way of telling me that you could say what you want, withoutfear."
Q: Yeah.,"A: And speak to whoever you want without fear. And that stayed with me, so I hada very positive image of going. I -- I-- though th -- I think the reality was a little bitdifferent, but --"
Q: Yeah.,"A: -- being prepared sa -- you know, to go to this wonderful place -- they really triedvery, very hard to prepare me and my brother. Much harder for my brother becausehe knew that the chances were very good that they would never come, and he had totake responsibility for me, and he did."
"Q: Well, for a nine year old those are big things --",A: He---
Q: -- those are huge bare -- burdens on the shoulder --,"A: He totally rose to the occasion. If you want to he -- I'm trying to think what else Ican tell you about Viennese background, because I'm almost about to jump --"
"Q: That's right, that's right.",A: -- to the transport. I don't know what else I can tell you.
"Q: Well, tell me a little bit about your brother, and what your relationship was like","A: In Vienna it was a normal, you know, brother --"
"Q: Did he have his friends and you had your friends, or --","A: I was so young, I mean, my friends were like, in the American terms, play dateswith mother --"
Q: That's right.,"A: -- mother's friends, some of whom I'm still in touch with, after all these years.The following transcript is the result of a recorded interview. The recording is the primary source document, not this transcript. It has not been checked for spelling nor verified for accuracy. This document should not be quoted or used without first checking it against the interview.The interview is part of the United States Holocaust Memorial Museum's collection of oral testimonies. Information about access and usage rights can be found in the catalog record.31Interview with Erika TamarDecember 18, 2015"
Q: Yeah.,"A: You know, one of my very close friends was a little girl that I played with inVienna, but it was through the parents. I -- I wasn't having independent friendships."
Q: Right.,"A: """"m sure my brother had friends in school, I don't know details of it at all. Wehad a normal brother-sister relationship, you know. I--I was enough younger than --than there really wasn't sibling rivalry and I think he was protective of me. Ourrelationship changed extremely when we were on the Kindertransport."
Q: How? Tell me.,"A: He was nine years old, and he rose to the occasion of taking care of me as if hewas an adult. And what saved me from the emotional trauma was that he becamemy mother, my father, my hero. And he really was -- took w-way beyond a nineyear old."
Q: Can you give me any examples of -- of how you felt safe because he was there?,"A: Well, he wa -- well, he was my family."
Q: Okay.,"A: You know, I-- I wasn't alone. I mean, that was major that --"
"Q: That's right, he was there.","A: --I wa --I was -- I was with family. Years later 1 met some people who had beenon the ship. You may know that there was a conference in 2002 in Chicago of1,000 children who'd come unaccompanied, and I went to that, and some of the 50children were there. I'm digressing now, but --"
"Q: It's okay -- it's okay, we can do that.","A: My three children went with me, because they thought it would be emotionallyhorrendous for me. Actually, when we got there, it was very triumphant."
Q: Was it?,"A: Oh, for all of us, it's like we're here, we made it."
Q: Okay.,"A: So I met other people who'd been on the ship with me, and one of them was alady named Helga Milgram(ph), who I serd -- unfortunately has since passed away,and she remembered me. I was the baby of the group, so I was more noticeable, andshe was maybe nine or 10, and she and a bunch of other eight, nine, 10 year oldlittle girls sort of took over caring for me, and you know, being extra nice to me,and when we talked about it later she said she was working through her own painby, you know, giving to me. And I didn't remember it clearly until I met her."
"Q: Oh, and so it came back.","A: And -- and the memory came back to me. I -- I didn't remember the faces, ornames, but I did know that on board ship all these older girls, you know, were verynice to me, and favored me. I asked her if she remembered my brother, and she saidher only memory of my brother was, he was this hand --"
Q: Okay.,"A: -- that I was forever holding. My brother wrote home to my parents thatsometimes I really embarrassed him because sometimes I didn't see him, and I hada panic attack and I cried, where's Henry, where's -- or Heinzie(ph) at that --"
Q: Yeah.,"A: Where's Heinzie(ph), where's Heinzie(ph)? And maybe he was going to thebathroom, and people were calling him, your sister needs you, she just wants you.So he -- he wrote home that sometimes it was embarrassing. In terms of taking careof me, as a little girl I tended to be carsick on long trips. When we went to Texas,my memory that I don't think was by car, I think it was by bus, I'm not a hundredpercent sure, but he did write to my mother, and I had seen the letters at one time oranother, that the whole way, he told me stories so that I would forget about beingcarsick."
Q: Oh.,"A: Now that is over and beyond a nine year old.The following transcript is the result of a recorded interview. The recording is the primary source document, not this transcript. It has not been checked for spelling nor verified for accuracy. This document should not be quoted or used without first checking it against the interview.The interview is part of the United States Holocaust Memorial Museum's collection of oral testimonies. Information about access and usage rights can be found in the catalog record.34Interview with Erika TamarDecember 18, 2015"
"Q: Yeah, yeah, yeah.","A: Are we on the ship, or sh --"
"Q: No, we're gonna come back. We're gonna come back --",A: Do wi- we -
Q: -- to Vienna.,A: -- do we want to go back to Vienna?
Q: We're gonna go back to Vienna because I want to come to the moment -- did,A: [have no memory of them.
Q: I see.,A: None at all.
Q: Okay.,A: I'm sorry that I don't.
"Q: That's okay, that's okay.","A: They were wonderful people I know, but I don't remember them at all."
Q: Do you remember saying goodbye to your own parents?,A: [remember going on a train --
Q: Okay.,"A:--and my mother and father seeing us off.The following transcript is the result of a recorded interview. The recording is the primary source document, not this transcript. It has not been checked for spelling nor verified for accuracy. This document should not be quoted or used without first checking it against the interview.The interview is part of the United States Holocaust Memorial Museum's collection of oral testimonies. Information about access and usage rights can be found in the catalog record.35Interview with Erika TamarDecember 18, 2015"
"Q: Okay. So it would have been you and your brother on the train, and them at the","A: They were on the platform, we went on the train. And a -- my parents made suchan effort to make this positive for me, they certainly - my mother didn't cry in frontof me, you know, they made this extreme effort to say oh, this is an exciting trainride adventure, you're going to United States, you know."
"Q: So whatever you saw, it was enthusiasm and excitement, rather than pain and","A: Well a--I think other children cried. Older children perhaps, who understoodmore. I did not."
Q: Okay.,A: I--I mean --I don't know if enthusiasm --
Q: Okay.,"A: -- is the proper word, because I was leaving my parents. But I don't think I wasas upset as you would imagine, because they made it such a positive thing [coughs]-- excuse me -- and they did lead me to believe that they would --"
Q: Come.,"A: -- come.The following transcript is the result of a recorded interview. The recording is the primary source document, not this transcript. It has not been checked for spelling nor verified for accuracy. This document should not be quoted or used without first checking it against the interview.The interview is part of the United States Holocaust Memorial Museum's collection of oral testimonies. Information about access and usage rights can be found in the catalog record.36Interview with Erika TamarDecember 18, 2015"
"Q: Yeah. And what about your brother, do you remember how he was reacting, or","A: Well he -- I know that he knew that there was a good chance that he wouldn'tcome -- that they wouldn't come, and I think there was much more sadness for him,and also he had the responsibility of me."
Q: Okay.,"A: You know, he was [indecipherable]"
Q: That's huge for a nine year old to have the knowledge that there -- that your,"A: Well, you know, it was a -- at that time in Vienna, there was a lot of talk aboutgetting a visa, getting an affidavit. We knew no one in the United States at all. Itwas part of family conversation. We wound up getting, I think, the affidavit from acomparative stranger, yes. Actually somebody -- a Christian who worked for SearsRoebuck. A distant relative of my mother's couldn't do an affidavit because he --he wasn't well positioned enough, he wasn't making enough money. He went to hisboss at Sears Roebuck and said that, you know, these people will not be a burden,the man is a doctor, he""! come to United States, he'll practice medicine here, but The following transcript is the result of a recorded interview. The recording is the primary source document, not this transcript. It has not been checked for spelling nor verified for accuracy. This document should not be quoted or used without first checking it against the interview.The interview is part of the United States Holocaust Memorial Museum's collection of oral testimonies. Information about access and usage rights can be found in the catalog record.37Interview with Erika TamarDecember 18, 2015he needs this affidavit. And this absolute Christian stranger, who had some positionat Sears Roebuck gave us the affidavit."
"Q: As a-- from the relative, from your mother's relative. In other words, he himself","A: His -- his boss, or --"
"Q: Oh, I see.",A: -- somebody who -- who worked --
Q: I see.,"A: -- who he worked for. I don't know who -- the man's name, I have no idea. I wishI knew."
Q: So it was the basis of that that you -- the Krauses(ph) could accept you and take,A: I-- from my parents.
"Q: Oh, for your parents, excuse me.",A: My parents had to have the affidavit to come over.
Q: Okay.,"A: Now, I don't know that the Krauses(ph) needed it -- an affidavit. What theKrauses(ph) did, and again, I know this from Steve Pressman's(ph) book --"
Q: Okay.,A: -- and not personal knowledge at all.
Q: Okay.,"A: They had visas that would go in -- to waste in [indecipherable] they were able tocollect 50 visas for the 50 children. If I remember correctly, Mr. Kraus(ph), wherethe children were concerned, made himself legally and financially responsible."
"Q: I see, okay, okay.",A: So that was --
Q: That was one set --,A: You know.
Q: -- and the oth --,"A: For my parents, they needed affidavit."
Q: Okay.,A: Which they got from a stranger.
"Q: So, do you remember more about -- let's go back to the transport over. You leave","A: At the time I didn't know -- I didn't find out until the conference in 2002, whereI got a lot of information. We stopped in Berlin. I did remember that we stayedsomewhere. I didn't know it was Berlin at the time, and it was my first taste ofwhat it was like to be institutionalized, where we stood on line for a towel, and we The following transcript is the result of a recorded interview. The recording is the primary source document, not this transcript. It has not been checked for spelling nor verified for accuracy. This document should not be quoted or used without first checking it against the interview.The interview is part of the United States Holocaust Memorial Museum's collection of oral testimonies. Information about access and usage rights can be found in the catalog record.39Interview with Erika TamarDecember 18, 2015stood on -- you know. Not that we were mistreated, it was just for the first time inmy life, it was like this institutional thing, and that stayed with me. I didn't know itwas Berlin."
"Q: Okay. And from then on -- from there, another train?",A: I don't remember.
Q: Okay.,"A: I--I--I know the traveling was by train. I know there was an overnight stop at --in Berlin. If there was more than one overnight stop, I don't know. I sort of doubtit, I think maybe it was just one."
Q: Okay.,A: But my next memory is being on the ship.
Q: Okay. Do you now know the name of the ship?,"A: Yes, well I found out."
Q: Yeah.,"A: I didn't know at the time, the President Harding."
"Q: Okay. Do you have any memories, any vision in your mind of what the ship","A: Ido remember that it was very large. I remember the -- the tone of when mealswere served, which I -- I --I have no -- you know, I -- I'm tone deaf, but there's like The following transcript is the result of a recorded interview. The recording is the primary source document, not this transcript. It has not been checked for spelling nor verified for accuracy. This document should not be quoted or used without first checking it against the interview.The interview is part of the United States Holocaust Memorial Museum's collection of oral testimonies. Information about access and usage rights can be found in the catalog record.40Interview with Erika TamarDecember 18, 2015three notes for meals being served. And I heard that much later on radio aboutsomething else, and I immediately perked up --"
Q: Perked up.,A: -- and got the familiarity. I do remember being onboard ship.
Q: Okay.,A: [had an adventure onboard ship.
Q: Tell me.,"A: There was a young woman, I think quite young, from Chicago, an American,traveling from Germany with her birds. She went by ship because she ha -- she wasbringing birds home. She was an American, but she had lived in Germany for awhile. One day on deck I was swamped by a wave, and my leggings, or whatever Iwore, were soaked, and I was just standing there by myself helplessly, and I didn'tknow what to do. And this young woman saw me, and took me to her stateroom,and got me out of my wet leggings and gave me something dry to wear. And Iremember a stateroom full of colorful birds. Now, this is a four year old's memory.It's perfectly possible that there were three birds. I just remember all these birds, ma--Ihave no idea. And I believe she spoke German, so -- because she had lived inGermany, so we communicated easily. And now here's the mystery. I slept in herstateroom, and I don't know how that came to be, whether she talked to the people The following transcript is the result of a recorded interview. The recording is the primary source document, not this transcript. It has not been checked for spelling nor verified for accuracy. This document should not be quoted or used without first checking it against the interview.The interview is part of the United States Holocaust Memorial Museum's collection of oral testimonies. Information about access and usage rights can be found in the catalog record.41Interview with Erika TamarDecember 18, 2015who were supervising me, or if she just had me there. I know I spent time there, andI do know I slept there at least once, and that it wasn't my imagination because shesent a letter to my mother, she got my mother's address. She put me to sleep, andshe says, sweet dreams, and I said, I'm going to dream about my mother. And shewrote that to my mother. So that clarifies that I really did sleep in her stateroom."
Q: Yeah.,"A: I don't know how much time I spent there. I know I was very, very fond of her,and fascinated by these wonderful, colorful birds. And that's a major shipboard --"
Q: Sure.,A:--memory for me.
"Q: Yeah, yeah.",A: I-I-
Q: It's very exotic for a child.,"A: Well, and also she was young, and she spoke German and she was very warmand generous, you know, she appreciated that I was a little girl traveling alone.Otherwise I -- you know, I spent a lot of time hanging onto my brother at all times."
Q: Yeah.,"A: But for sleeping arrangements, girls were separate from boys. I don't rememberwho I shared a stateroom with, I have no memory of that at all.The following transcript is the result of a recorded interview. The recording is the primary source document, not this transcript. It has not been checked for spelling nor verified for accuracy. This document should not be quoted or used without first checking it against the interview.The interview is part of the United States Holocaust Memorial Museum's collection of oral testimonies. Information about access and usage rights can be found in the catalog record.42Interview with Erika TamarDecember 18, 2015"
Q: Do you remember --,A: Ido remember these older girls were nice to me.
Q: Do you ha -- do you remember what the staterooms looked like?,A: No.
Q: Okay.,A: Just the one with the birds.
"Q: The birds. Just the one with the birds. And the ship itself, was it -- well it -- for a","A: It was large, but I don't have any real geographic memory of it."
Q: Do you remember being rocked? Were you seasick at all?,"A: I was not seasick, no. That I-- I am sure I was not. I've -- you know, I was fine. Ido remember, I think when we were getting close to New York harbor, we were allon deck, to be taught the worl -- words to the ""Star Spangled Banner."" And by thattime I knew a little bit English. But I do remember being mystified, oh say, can yousee -- I thought that was gibberish. It made no logical sense. I don't have a lot ofshipboard memories really, except that I-- I was -- yeah, I hung onto my brother andalso there was -- there was the lovely lady with the birds."
Q: What about the Statue of Liberty? Do you remember seeing that?,"A: [ve seen photographs of all the children looking at the Statue of Liberty, I don'tremember seeing it."
Q: Okay. Do you have a memory of arriving in the United States?,"A: The immediate arrival, no, no."
Q: Okay. What would be your next memory?,"A: The camp. The -- in -- there was a summer camp outside of Philadelphia wherewe were kept. And from there we were supposed to go to foster care. What I doremember, both onboard ship, and also in the summer camp, there was a realdifference, there were the kids who were going to relatives, and the kids who had noone, and who were going to foster care. And the kids who were going to relativeswere the lucky ones."
Q: Yes.,"A: All right now, here's a memory which may not be true."
Q: Okay.,"A: Ido remember people coming to look us over, who were potential foster parents.I do -- that is true, but I do also remember that they looked at us through a wirefence. Whether -- that seems strange, but that's my memory of it, and --"
Q: Okay.,"A: -- when -- The following transcript is the result of a recorded interview. The recording is the primary source document, not this transcript. It has not been checked for spelling nor verified for accuracy. This document should not be quoted or used without first checking it against the interview.The interview is part of the United States Holocaust Memorial Museum's collection of oral testimonies. Information about access and usage rights can be found in the catalog record.44Interview with Erika TamarDecember 18, 2015"
Q: So you're not a hundred percent sure of that wire fence part?,"A: I'm not, I -- this is what I remember, but as a grownup, I think, wouldn't that bestrange, to have children on one side of a wire fence, and the people --"
Q: Right.,"A: -- looking them over on the other side? I don't -- but I remember this wire fence,but it could be that I imagined it, I don't know. I think I did get that awful sense ofbeing looked over, so maybe I translated into being like an animal in a zoo, with thewire fence. Whether there was a wire fence or not, I can't tell you."
Q: Got it.,"A: I do know that I was very, very angry at being looked over. I felt it veryextremely, and because of that I wouldn't talk, and I wouldn't smile, and you know,I was -- my brother recognized the importance of finding foster family, so he was allcharm and smiles and showing his intelligence, you know. So everyone wanted mybrother, and who wanted this angry little girl?"
Q: Yeah.,"A: The camp was not winterized, they had to get rid of all of these kids --I1--I don'tmean get rid in a bad way --"
